,number,value,datetime_start,datetime_complete,duration,params_batch_size,params_buffer_size,params_ent_coef,params_gamma,params_learning_starts,params_log_std_init,params_lr,params_net_arch,params_tau,params_train_freq,state
340,340,-3.300000000000039e-05,2021-03-19 16:58:25.922347,2021-03-19 17:06:46.355183,0 days 00:08:20.432836000,256,10000,auto,0.9999,0,-2.177399563432045,0.002173654406961748,medium,0.02,64,PRUNED
341,341,43.28427739999999,2021-03-19 17:01:59.989831,2021-03-19 17:09:23.591699,0 days 00:07:23.601868000,256,10000,auto,0.9999,0,-2.1224350256686293,0.0022068602543009754,medium,0.001,64,PRUNED
342,342,-0.3084638,2021-03-19 17:06:46.356325,2021-03-19 17:13:55.889062,0 days 00:07:09.532737000,256,10000,auto,0.98,1000,-0.7698670331679216,0.00911247210216662,medium,0.001,8,PRUNED
343,343,1011.8014128000001,2021-03-19 17:09:23.592926,2021-03-19 17:33:01.770364,0 days 00:23:38.177438000,256,10000,auto,0.98,1000,-0.7818977193148651,0.00928211170332364,medium,0.02,8,COMPLETE
344,344,784.330701,2021-03-19 17:13:55.890480,2021-03-19 17:40:04.159348,0 days 00:26:08.268868000,256,10000,auto,0.9999,0,-0.6412352055208573,0.0013274625322321726,medium,0.02,16,COMPLETE
345,345,933.0883546000001,2021-03-19 17:33:01.772363,2021-03-19 17:55:39.560931,0 days 00:22:37.788568000,256,10000,auto,0.98,1000,-0.662847792498084,0.012260394260619015,medium,0.02,8,COMPLETE
346,346,-0.029089999999999998,2021-03-19 17:40:04.161643,2021-03-19 17:47:56.072786,0 days 00:07:51.911143000,1024,10000,auto,0.98,1000,-3.4145266780745063,0.012223263262532218,medium,0.01,8,PRUNED
347,347,-399.9018832,2021-03-19 17:47:56.075876,2021-03-19 17:54:49.849790,0 days 00:06:53.773914000,256,10000,auto,0.98,1000,-0.8693922069471473,0.008831567535542753,medium,0.02,8,PRUNED
348,348,-399.8954388,2021-03-19 17:54:49.851357,2021-03-19 18:02:12.416715,0 days 00:07:22.565358000,256,10000,auto,0.98,1000,-1.010210249768994,0.007699634265253986,medium,0.02,8,PRUNED
349,349,15.020582,2021-03-19 17:55:39.562959,2021-03-19 18:02:31.687815,0 days 00:06:52.124856000,256,10000,auto,0.98,1000,-0.7026779035928908,0.015316533554316794,medium,0.02,8,PRUNED
350,350,803.7084716,2021-03-19 18:02:12.418029,2021-03-19 18:28:23.874858,0 days 00:26:11.456829000,256,10000,auto,0.98,1000,-0.5978081849948462,0.014313227785784453,medium,0.01,8,COMPLETE
351,351,7.599857,2021-03-19 18:02:31.688722,2021-03-19 18:26:51.865163,0 days 00:24:20.176441000,256,10000,auto,0.98,1000,-0.5602099898569173,0.012087909620877534,medium,0.01,8,COMPLETE
352,352,5.9822006,2021-03-19 18:26:51.867384,2021-03-19 18:34:18.028418,0 days 00:07:26.161034000,256,10000,auto,0.98,1000,-0.31449726098750197,0.010275283556370637,medium,0.01,8,PRUNED
353,353,4.9352018,2021-03-19 18:28:23.876986,2021-03-19 18:36:37.478487,0 days 00:08:13.601501000,1024,10000,auto,0.98,1000,-0.3236663064384037,0.009616090118977502,medium,0.02,8,PRUNED
354,354,-0.937566,2021-03-19 18:34:18.029696,2021-03-19 18:43:06.777111,0 days 00:08:48.747415000,1024,10000,auto,0.98,1000,-0.47290348108452845,0.009371285410043987,medium,0.02,8,PRUNED
355,355,-0.2160028,2021-03-19 18:36:37.480022,2021-03-19 18:46:11.593100,0 days 00:09:34.113078000,2048,10000,auto,0.98,1000,-0.7628722439390614,0.006372717600087967,medium,0.02,8,PRUNED
356,356,-0.0899796,2021-03-19 18:43:06.778368,2021-03-19 18:53:00.612932,0 days 00:09:53.834564000,2048,10000,auto,0.98,1000,-0.7402131333899102,0.006162233877798031,medium,0.02,8,PRUNED
357,357,1094.1775148000002,2021-03-19 18:46:11.594465,2021-03-19 19:11:00.882512,0 days 00:24:49.288047000,256,10000,auto,0.98,1000,-0.7855791734205045,0.007492401468617787,medium,0.02,8,COMPLETE
358,358,-370.99386599999997,2021-03-19 18:53:00.616613,2021-03-19 18:59:57.102478,0 days 00:06:56.485865000,256,10000,auto,0.98,1000,-0.6674258725085639,0.007690007772345485,medium,0.01,512,PRUNED
359,359,-0.010734400000000005,2021-03-19 18:59:57.103883,2021-03-19 19:07:26.494646,0 days 00:07:29.390763000,256,10000,auto,0.995,1000,-0.9459004052967585,0.011832698971146584,medium,0.02,128,PRUNED
360,360,6.401783999999999,2021-03-19 19:07:26.495869,2021-03-19 19:14:37.823417,0 days 00:07:11.327548000,256,10000,auto,0.98,1000,-0.830783034182876,0.005464652439340533,medium,0.02,32,PRUNED
361,361,30.008231799999997,2021-03-19 19:11:00.884492,2021-03-19 19:18:34.979546,0 days 00:07:34.095054000,256,10000,auto,0.98,1000,-0.7955982298919878,0.005041091835202784,medium,0.01,32,PRUNED
362,362,0.9628316,2021-03-19 19:14:37.824421,2021-03-19 19:21:39.170408,0 days 00:07:01.345987000,256,10000,auto,0.98,1000,-0.9665617098483561,0.00473067498522468,medium,0.01,16,PRUNED
363,363,485.2972186,2021-03-19 19:18:34.980872,2021-03-19 19:27:53.260653,0 days 00:09:18.279781000,256,10000,auto,0.98,1000,-1.0103261257028897,0.007982118970488993,medium,0.005,16,PRUNED
364,364,884.8716718,2021-03-19 19:21:39.171615,2021-03-19 19:45:20.157599,0 days 00:23:40.985984000,256,10000,auto,0.995,0,-1.0659763323981215,0.007478097880011268,medium,0.005,8,COMPLETE
365,365,1276.8187619999997,2021-03-19 19:27:53.261951,2021-03-19 19:51:17.925432,0 days 00:23:24.663481000,256,10000,auto,0.995,0,-1.1874876869744126,0.005958072464869838,medium,0.02,8,COMPLETE
366,366,816.3336666000001,2021-03-19 19:45:20.160034,2021-03-19 20:05:15.257939,0 days 00:19:55.097905000,1024,100000,auto,0.98,0,-0.848751142869115,0.006259569883821695,medium,0.02,16,PRUNED
367,367,0.0638262,2021-03-19 19:51:17.927597,2021-03-19 19:57:57.737232,0 days 00:06:39.809635000,256,100000,auto,0.995,0,-1.2074293425720752,0.0063601678843742395,medium,0.02,8,PRUNED
368,368,916.9221318,2021-03-19 19:57:57.738559,2021-03-19 20:21:04.155429,0 days 00:23:06.416870000,256,10000,auto,0.995,1000,-1.1753122459847716,0.0064105008892457755,medium,0.02,8,COMPLETE
369,369,-0.32780719999999997,2021-03-19 20:05:15.259142,2021-03-19 20:11:57.859251,0 days 00:06:42.600109000,256,10000,auto,0.995,1000,-1.5299950710595855,0.008515316097306621,medium,0.02,8,PRUNED
370,370,0.7176802,2021-03-19 20:11:57.860346,2021-03-19 20:18:51.860439,0 days 00:06:54.000093000,256,10000,auto,0.995,0,-1.125673777078279,0.0032411841705347424,medium,0.01,8,PRUNED
371,371,355.57217099999997,2021-03-19 20:18:51.861506,2021-03-19 20:25:28.091120,0 days 00:06:36.229614000,256,10000,auto,0.995,1000,-1.1737975826938571,0.004563524699725308,medium,0.02,8,PRUNED
372,372,1006.5165638000001,2021-03-19 20:21:04.157551,2021-03-19 20:44:55.279329,0 days 00:23:51.121778000,256,10000,auto,0.995,0,-1.8426965839944536,0.004593642717915694,medium,0.01,8,COMPLETE
373,373,-264.80992159999994,2021-03-19 20:25:28.092298,2021-03-19 20:27:30.531961,0 days 00:02:02.439663000,256,10000,auto,0.995,20000,-0.8897009659915296,0.010275798072995342,medium,0.01,8,PRUNED
374,374,332.8117666,2021-03-19 20:27:30.533072,2021-03-19 20:34:26.137431,0 days 00:06:55.604359000,256,10000,auto,0.98,0,-1.8667092569315875,0.007456742977222607,medium,0.001,16,PRUNED
375,375,-0.1411188,2021-03-19 20:34:26.138568,2021-03-19 20:41:19.298196,0 days 00:06:53.159628000,256,10000,auto,0.995,0,-1.3878789635636388,0.0037504489912131094,medium,0.02,16,PRUNED
376,376,77.74893060000001,2021-03-19 20:41:19.299276,2021-03-19 20:48:29.539793,0 days 00:07:10.240517000,256,10000,auto,0.98,0,-1.7615959661413962,0.005219027760114158,medium,0.01,16,PRUNED
377,377,-0.5504312,2021-03-19 20:44:55.281179,2021-03-19 20:51:32.693939,0 days 00:06:37.412760000,256,10000,auto,0.995,1000,-1.763806638830288,0.00460770460321477,medium,0.01,8,PRUNED
378,378,920.9155215999999,2021-03-19 20:48:29.540926,2021-03-19 21:16:52.690837,0 days 00:28:23.149911000,256,10000,auto,0.995,1000,-1.8061779215294296,0.0031630033753112926,big,0.01,8,COMPLETE
379,379,-0.0589584,2021-03-19 20:51:32.695255,2021-03-19 20:59:38.439047,0 days 00:08:05.743792000,256,10000,auto,0.995,0,-1.8517176138623683,0.002862169206066631,big,0.01,8,PRUNED
380,380,327.5730074,2021-03-19 20:59:38.440354,2021-03-19 21:09:37.382565,0 days 00:09:58.942211000,2048,10000,auto,0.995,1000,-0.5640555307038084,0.003192796949383513,medium,0.01,8,PRUNED
381,381,8.5182828,2021-03-19 21:09:37.383897,2021-03-19 21:18:46.278441,0 days 00:09:08.894544000,1024,10000,auto,0.995,0,-1.6718068585818258,0.0037671164711684593,medium,0.01,8,PRUNED
382,382,904.5771826,2021-03-19 21:16:52.692908,2021-03-19 21:43:35.060829,0 days 00:26:42.367921000,1024,10000,auto,0.995,0,-1.6599032504472786,0.004325234013945645,medium,0.01,8,COMPLETE
383,383,879.4802073999999,2021-03-19 21:18:46.279618,2021-03-19 21:41:44.565031,0 days 00:22:58.285413000,256,10000,auto,0.99,0,-1.894419487037677,0.005813269258704719,medium,0.01,8,COMPLETE
384,384,302.49936660000003,2021-03-19 21:41:44.567169,2021-03-19 21:48:16.147915,0 days 00:06:31.580746000,256,10000,auto,0.995,1000,-0.741361210301926,0.0025127156247116513,medium,0.01,8,PRUNED
385,385,-1.1016679999999999,2021-03-19 21:43:35.062556,2021-03-19 21:50:15.958784,0 days 00:06:40.896228000,256,10000,auto,0.98,1000,-0.7545926078736878,0.002537560305692289,medium,0.01,64,PRUNED
386,386,444.59738699999997,2021-03-19 21:48:16.149192,2021-03-19 21:55:13.018416,0 days 00:06:56.869224000,256,10000,auto,0.98,0,-1.9547226487297713,0.008801155431882209,medium,0.01,8,PRUNED
387,387,-0.2004708,2021-03-19 21:50:15.959938,2021-03-19 21:57:11.801921,0 days 00:06:55.841983000,256,10000,auto,0.98,0,-1.931580638338856,0.008775250779484326,medium,0.01,8,PRUNED
388,388,0.5495976,2021-03-19 21:55:13.019745,2021-03-19 22:01:45.206215,0 days 00:06:32.186470000,256,10000,auto,0.98,0,-0.41829399321921157,0.005588492509666451,medium,0.001,16,PRUNED
389,389,-1.1252,2021-03-19 21:57:11.803125,2021-03-19 22:05:52.225353,0 days 00:08:40.422228000,2048,10000,auto,0.98,1000,-0.4563166154649029,0.005458342093093026,medium,0.001,16,PRUNED
390,390,-320.9891698,2021-03-19 22:01:45.207557,2021-03-19 22:12:19.584267,0 days 00:10:34.376710000,2048,10000,auto,0.98,1000,-1.5661419907804843,0.007396360912551363,medium,0.02,32,PRUNED
391,391,358.80003560000006,2021-03-19 22:05:52.226338,2021-03-19 22:12:23.845703,0 days 00:06:31.619365000,256,10000,auto,0.995,1000,-0.9080600302740705,0.010906768519040074,medium,0.02,32,PRUNED
392,392,0.0280694,2021-03-19 22:12:19.585556,2021-03-19 22:19:49.853429,0 days 00:07:30.267873000,256,10000,auto,0.995,0,-0.6260015085444751,0.0019778262174615104,medium,0.02,128,PRUNED
393,393,564.778007,2021-03-19 22:12:23.846809,2021-03-19 22:21:22.811664,0 days 00:08:58.964855000,256,10000,auto,0.98,0,-3.5500652661959258,0.003617824676242038,medium,0.02,128,PRUNED
394,394,103.3674426,2021-03-19 22:19:49.854727,2021-03-19 22:26:27.294651,0 days 00:06:37.439924000,256,10000,auto,0.99,0,-1.803842662528402,0.0036174468786530985,medium,0.01,16,PRUNED
395,395,0.48522479999999996,2021-03-19 22:21:22.812808,2021-03-19 22:29:24.957794,0 days 00:08:02.144986000,1024,10000,auto,0.99,0,-2.082601398326509,0.0042585920431772555,medium,0.01,16,PRUNED
396,396,109.23778040000002,2021-03-19 22:26:27.295895,2021-03-19 22:34:44.548639,0 days 00:08:17.252744000,1024,10000,auto,0.98,1000,-0.9828839089196341,0.0016966412039997642,medium,0.02,16,PRUNED
397,397,-160.3188534,2021-03-19 22:29:24.958947,2021-03-19 22:36:05.886806,0 days 00:06:40.927859000,256,10000,auto,0.98,1000,-0.9778272642537413,0.0016961666580525773,medium,0.02,8,PRUNED
398,398,716.5823042000001,2021-03-19 22:34:44.549584,2021-03-19 22:58:20.809479,0 days 00:23:36.259895000,256,10000,auto,0.98,1000,-1.4917937594126673,0.006950725221343302,medium,0.02,512,COMPLETE
399,399,46.383684599999995,2021-03-19 22:36:05.887968,2021-03-19 22:37:54.641197,0 days 00:01:48.753229000,256,10000,auto,0.98,20000,-1.692385118318958,0.0068446847729349515,medium,0.02,512,PRUNED
400,400,808.4432386,2021-03-19 22:37:54.642452,2021-03-19 23:01:35.518562,0 days 00:23:40.876110000,256,10000,auto,0.999,0,-0.7963668872086894,0.004812003728673497,medium,0.01,64,COMPLETE
401,401,-1.1956038000000002,2021-03-19 22:58:20.811659,2021-03-19 23:05:17.615250,0 days 00:06:56.803591000,256,10000,auto,0.999,0,-2.3136666775274928,0.01087368181679133,medium,0.01,64,PRUNED
402,402,-2.1490477999999995,2021-03-19 23:01:35.520589,2021-03-19 23:06:04.466036,0 days 00:04:28.945447000,256,10000,auto,0.995,10000,-2.011071544127953,0.00273590883250458,medium,0.01,16,PRUNED
403,403,382.12355379999997,2021-03-19 23:05:17.616611,2021-03-19 23:09:46.180852,0 days 00:04:28.564241000,256,10000,auto,0.995,10000,-2.481198445375837,0.0029023072221351547,medium,0.02,16,PRUNED
404,404,58.909768599999985,2021-03-19 23:06:04.467015,2021-03-19 23:12:45.574229,0 days 00:06:41.107214000,256,10000,auto,0.98,0,-1.5740674958183951,0.005668308780650121,medium,0.02,8,PRUNED
405,405,-0.49926119999999996,2021-03-19 23:09:46.182176,2021-03-19 23:18:21.934125,0 days 00:08:35.751949000,256,10000,auto,0.98,0,-0.8838813286173082,0.01662047535405884,big,0.02,8,PRUNED
406,406,-0.193547,2021-03-19 23:12:45.575214,2021-03-19 23:20:50.398263,0 days 00:08:04.823049000,256,10000,auto,0.98,1000,-1.8246581388844096,0.015231482736344362,big,0.02,16,PRUNED
407,407,-160.7066464,2021-03-19 23:18:21.935304,2021-03-19 23:28:46.887794,0 days 00:10:24.952490000,2048,10000,auto,0.98,1000,-1.857577822834304,0.008001522075195378,medium,0.02,16,PRUNED
408,408,0.11817499999999999,2021-03-19 23:20:50.399680,2021-03-19 23:29:23.006296,0 days 00:08:32.606616000,2048,10000,auto,0.98,1000,-1.7165245789425003,0.004452096057356289,medium,0.01,16,PRUNED
409,409,-0.2885672,2021-03-19 23:28:46.889085,2021-03-19 23:38:37.983861,0 days 00:09:51.094776000,1024,10000,auto,0.98,0,-3.114299872095469,0.00977733342329606,medium,0.01,16,PRUNED
410,410,70.1056428,2021-03-19 23:29:23.007233,2021-03-19 23:37:20.398804,0 days 00:07:57.391571000,1024,10000,auto,0.995,0,-0.6713062805843317,0.009847004927752636,medium,0.01,8,PRUNED
411,411,185.95029659999997,2021-03-19 23:37:20.400371,2021-03-19 23:44:05.722967,0 days 00:06:45.322596000,256,10000,auto,0.9999,0,-1.0606760843321308,0.0013688222605476822,medium,0.02,16,PRUNED
412,412,535.0727770000001,2021-03-19 23:38:37.985178,2021-03-20 00:04:11.320527,0 days 00:25:33.335349000,256,10000,auto,0.9999,1000,-1.0731234183435157,0.0021116917445368837,medium,0.02,16,COMPLETE
413,413,-0.0226254,2021-03-19 23:44:05.724000,2021-03-19 23:50:44.736197,0 days 00:06:39.012197000,256,10000,auto,0.9999,1000,-2.2032649199834187,0.005906406025326596,medium,0.02,8,PRUNED
414,414,1198.5548286,2021-03-19 23:50:44.737359,2021-03-20 00:14:43.166285,0 days 00:23:58.428926000,256,10000,auto,0.98,0,-2.0677143659265402,0.004321353708441719,medium,0.02,16,COMPLETE
415,415,334.4890338,2021-03-20 00:04:11.322554,2021-03-20 00:11:31.040634,0 days 00:07:19.718080000,256,10000,auto,0.98,0,-2.0490673475567784,0.003750009742333487,medium,0.02,16,PRUNED
416,416,136.3817178,2021-03-20 00:11:31.041941,2021-03-20 00:19:50.064634,0 days 00:08:19.022693000,256,10000,auto,0.99,0,-1.6142573611870066,0.007467454991571163,medium,0.01,8,PRUNED
417,417,839.1940886,2021-03-20 00:14:43.168252,2021-03-20 00:32:15.944493,0 days 00:17:32.776241000,256,10000,auto,0.99,1000,-2.09503687977377,0.004583311908448818,medium,0.01,16,PRUNED
418,418,-79.53089539999999,2021-03-20 00:19:50.065965,2021-03-20 00:26:35.382476,0 days 00:06:45.316511000,256,10000,auto,0.995,1000,-1.9478647113240957,0.005000086570752214,medium,0.02,16,PRUNED
419,419,-0.789991,2021-03-20 00:26:35.383702,2021-03-20 00:33:45.211018,0 days 00:07:09.827316000,256,100000,auto,0.98,0,-2.2757817909957025,0.004435653149681827,medium,0.001,16,PRUNED
420,420,-0.0715314,2021-03-20 00:32:15.945588,2021-03-20 00:36:35.371126,0 days 00:04:19.425538000,256,10000,auto,0.98,10000,-2.2188204278951886,0.006068100177878874,medium,0.001,16,PRUNED
421,421,-2.0228082,2021-03-20 00:33:45.212309,2021-03-20 00:38:59.285455,0 days 00:05:14.073146000,1024,10000,auto,0.9999,10000,-2.0819060776405403,0.006526088806405528,medium,0.02,16,PRUNED
422,422,21.167471799999998,2021-03-20 00:36:35.372394,2021-03-20 00:45:01.732386,0 days 00:08:26.359992000,1024,10000,auto,0.9999,0,-1.9406076308015812,0.012816362186745145,medium,0.02,16,PRUNED
423,423,-1.4831328,2021-03-20 00:38:59.286684,2021-03-20 00:46:21.893938,0 days 00:07:22.607254000,256,10000,auto,0.995,0,-1.9511620335671382,0.011709327849493635,medium,0.005,16,PRUNED
424,424,-399.9130632,2021-03-20 00:45:01.733691,2021-03-20 00:52:04.666468,0 days 00:07:02.932777000,256,10000,auto,0.995,1000,-2.355216728804147,0.008684522985843178,medium,0.01,16,PRUNED
425,425,-0.7836588,2021-03-20 00:46:21.895159,2021-03-20 00:53:33.653353,0 days 00:07:11.758194000,256,10000,auto,0.98,1000,-1.8142727774455003,0.008208944337533474,medium,0.01,16,PRUNED
426,426,69.52768719999999,2021-03-20 00:52:04.667796,2021-03-20 01:01:01.565218,0 days 00:08:56.897422000,2048,10000,auto,0.98,1000,-1.793131259209419,0.003236858056367796,medium,0.02,16,PRUNED
427,427,-0.1516046,2021-03-20 00:53:33.654276,2021-03-20 01:02:55.301528,0 days 00:09:21.647252000,2048,10000,auto,0.9999,0,-2.1530665103296798,0.0036360775509870218,medium,0.02,32,PRUNED
428,428,189.98468459999998,2021-03-20 01:01:01.566434,2021-03-20 01:12:54.485230,0 days 00:11:52.918796000,256,10000,auto,0.9999,0,-0.5325982548985934,0.024523909210398827,medium,0.02,32,PRUNED
429,429,-0.0869828,2021-03-20 01:02:55.302908,2021-03-20 01:09:48.976274,0 days 00:06:53.673366000,256,10000,auto,0.9999,0,-0.577127572034922,0.00544143550458072,medium,0.01,16,PRUNED
430,430,338.5147044,2021-03-20 01:09:48.977567,2021-03-20 01:12:00.102746,0 days 00:02:11.125179000,256,10000,auto,0.98,20000,-2.0241627192774745,0.006768730501233841,medium,0.02,16,PRUNED
431,431,-0.27827919999999995,2021-03-20 01:12:00.104167,2021-03-20 01:19:14.345323,0 days 00:07:14.241156000,256,10000,auto,0.9999,0,-0.8123330330616403,0.00488549322682543,medium,0.02,16,PRUNED
432,432,32.2746112,2021-03-20 01:12:54.486562,2021-03-20 01:27:09.072792,0 days 00:14:14.586230000,256,10000,auto,0.98,1000,-0.7920407384588743,0.004243725223688128,big,0.01,16,PRUNED
433,433,-0.9566772,2021-03-20 01:19:14.346541,2021-03-20 01:26:09.901953,0 days 00:06:55.555412000,256,10000,auto,0.98,1000,-1.7070021379003057,0.0041876972895351664,medium,0.01,64,PRUNED
434,434,-1.8899578000000001,2021-03-20 01:26:09.903170,2021-03-20 01:34:20.141688,0 days 00:08:10.238518000,256,10000,auto,0.98,1000,-3.433992407294279,0.005767546567408022,big,0.02,16,PRUNED
435,435,885.5790384,2021-03-20 01:27:09.073969,2021-03-20 01:54:38.496074,0 days 00:27:29.422105000,1024,10000,auto,0.995,0,-1.8948156380112156,0.007036255600563523,medium,0.02,16,COMPLETE
436,436,912.4321990000001,2021-03-20 01:34:20.142793,2021-03-20 02:01:50.258483,0 days 00:27:30.115690000,1024,10000,auto,0.995,0,-2.5912835085267583,0.0030660596057750667,medium,0.02,16,COMPLETE
437,437,-1.0690636000000002,2021-03-20 01:54:38.498036,2021-03-20 02:01:04.904915,0 days 00:06:26.406879000,256,10000,auto,0.9999,0,-2.471270579030134,0.008749468181746782,medium,0.01,16,PRUNED
438,438,-0.33628480000000005,2021-03-20 02:01:04.906026,2021-03-20 02:08:19.492631,0 days 00:07:14.586605000,256,10000,auto,0.98,1000,-0.7012879670505187,0.003220072617228234,medium,0.02,16,PRUNED
439,439,0.6451774000000001,2021-03-20 02:01:50.260299,2021-03-20 02:09:01.626738,0 days 00:07:11.366439000,256,10000,auto,0.98,1000,-1.494911209249232,5.658492893115408e-05,medium,0.02,16,PRUNED
440,440,-399.920471,2021-03-20 02:08:19.493931,2021-03-20 02:12:52.340830,0 days 00:04:32.846899000,256,10000,auto,0.9999,10000,-1.6142373240348462,0.010141510437156,medium,0.01,16,PRUNED
441,441,2.5324326,2021-03-20 02:09:01.627649,2021-03-20 02:14:10.010563,0 days 00:05:08.382914000,256,1000000,auto,0.9999,10000,-1.6372742612524624,0.0057275898372945505,medium,0.01,16,PRUNED
442,442,1.5259838000000001,2021-03-20 02:12:52.341954,2021-03-20 02:20:10.285851,0 days 00:07:17.943897000,256,1000000,auto,0.9999,0,-2.1040553498088155,0.0052936774707864395,medium,0.01,64,PRUNED
443,443,23.526414999999997,2021-03-20 02:14:10.011422,2021-03-20 02:21:41.125610,0 days 00:07:31.114188000,256,10000,auto,0.98,0,-3.2917769850425236,0.007318308850658565,medium,0.02,64,PRUNED
444,444,-0.264548,2021-03-20 02:20:10.287154,2021-03-20 02:30:28.319285,0 days 00:10:18.032131000,2048,10000,auto,0.98,0,-2.3902162652578833,0.0026331137784453636,medium,0.02,16,PRUNED
445,445,28.8233608,2021-03-20 02:21:41.126390,2021-03-20 02:30:51.887131,0 days 00:09:10.760741000,2048,10000,auto,0.995,1000,-2.2647725617088947,0.002595954233897604,medium,0.02,16,PRUNED
446,446,-0.33908119999999997,2021-03-20 02:30:28.320787,2021-03-20 02:39:20.450207,0 days 00:08:52.129420000,256,10000,auto,0.99,1000,-2.2825085857746896,0.0038407091738130745,medium,0.001,8,PRUNED
447,447,-399.8663626,2021-03-20 02:30:51.887990,2021-03-20 02:37:16.084544,0 days 00:06:24.196554000,256,100000,auto,0.99,1000,-1.9934856605060958,0.013837433606337069,medium,0.001,8,PRUNED
448,448,-1.7155266,2021-03-20 02:37:16.085583,2021-03-20 02:44:10.253411,0 days 00:06:54.167828000,256,10000,auto,0.98,0,-1.7406816772797193,0.003785992803853451,medium,0.02,16,PRUNED
449,449,996.7762832000001,2021-03-20 02:39:20.451325,2021-03-20 03:06:33.478215,0 days 00:27:13.026890000,1024,10000,auto,0.98,0,-1.7521829501200872,0.007732427765491989,medium,0.02,16,COMPLETE
450,450,-0.3716482,2021-03-20 02:44:10.254574,2021-03-20 02:52:11.487930,0 days 00:08:01.233356000,1024,10000,auto,0.9999,0,-1.8966690957161256,0.00737949092714818,medium,0.01,32,PRUNED
451,451,1.0370934,2021-03-20 02:52:11.489318,2021-03-20 03:15:23.986983,0 days 00:23:12.497665000,256,10000,auto,0.98,0,-0.9249289344088437,0.011014700735678604,medium,0.02,16,COMPLETE
452,452,-0.21439819999999998,2021-03-20 03:06:33.480197,2021-03-20 03:13:55.460075,0 days 00:07:21.979878000,1024,10000,auto,0.98,0,-1.7235100773010372,0.009253566922092825,medium,0.02,16,PRUNED
453,453,7.110973199999999,2021-03-20 03:13:55.460998,2021-03-20 03:21:38.283226,0 days 00:07:42.822228000,1024,10000,auto,0.98,0,-1.808921260374141,0.01155217327174636,medium,0.02,16,PRUNED
