,number,value,datetime_start,datetime_complete,duration,params_batch_size,params_buffer_size,params_ent_coef,params_gamma,params_learning_starts,params_log_std_init,params_lr,params_net_arch,params_tau,params_train_freq,state
454,454,905.2348297999999,2021-03-20 03:15:23.988527,2021-03-20 03:41:17.624363,0 days 00:25:53.635836000,1024,10000,auto,0.98,0,-1.8320949294524,0.01895165324143309,medium,0.02,16,COMPLETE
455,455,0.3755782,2021-03-20 03:21:38.284157,2021-03-20 03:29:24.608174,0 days 00:07:46.324017000,1024,10000,auto,0.98,0,-1.5285141320838191,0.006171255732359805,medium,0.02,16,PRUNED
456,456,0.05916700000000001,2021-03-20 03:29:24.609392,2021-03-20 03:37:06.550816,0 days 00:07:41.941424000,1024,10000,auto,0.98,0,-1.8614575858628977,0.00805173461589978,medium,0.02,16,PRUNED
457,457,288.3380784,2021-03-20 03:37:06.551715,2021-03-20 03:44:44.595264,0 days 00:07:38.043549000,1024,10000,auto,0.98,0,-1.6845017715271158,0.004761816744481013,medium,0.02,16,PRUNED
458,458,101.7308084,2021-03-20 03:41:17.626090,2021-03-20 03:49:04.190806,0 days 00:07:46.564716000,1024,10000,auto,0.98,0,-1.6570671058107902,0.005293642766972556,medium,0.02,16,PRUNED
459,459,0.1936988,2021-03-20 03:44:44.596283,2021-03-20 03:52:22.765493,0 days 00:07:38.169210000,1024,10000,auto,0.98,0,-2.1720309186527755,0.006802964208212056,medium,0.02,128,PRUNED
460,460,279.6015874,2021-03-20 03:49:04.192791,2021-03-20 03:55:34.015245,0 days 00:06:29.822454000,256,10000,auto,0.9999,0,-2.0040897371031723,0.007092188825256807,medium,0.02,128,PRUNED
461,461,0.0887724,2021-03-20 03:52:22.766607,2021-03-20 04:00:07.879454,0 days 00:07:45.112847000,256,10000,auto,0.9999,0,-2.023630333090187,0.008916112746777465,big,0.02,16,PRUNED
462,462,44.51537,2021-03-20 03:55:34.016083,2021-03-20 04:02:12.840984,0 days 00:06:38.824901000,256,10000,auto,0.999,0,-2.0887053100994293,0.009306690254046297,medium,0.005,16,PRUNED
463,463,-399.90867739999993,2021-03-20 04:00:07.880381,2021-03-20 04:06:40.214312,0 days 00:06:32.333931000,256,10000,auto,0.999,0,-1.4252286783204593,0.01365652764544469,medium,0.02,8,PRUNED
464,464,-400.2921322,2021-03-20 04:02:12.841949,2021-03-20 04:06:28.165995,0 days 00:04:15.324046000,256,10000,auto,0.98,10000,-1.7582854577533729,0.01409472871801366,medium,0.02,512,PRUNED
465,465,420.73459620000006,2021-03-20 04:06:28.167321,2021-03-20 04:12:49.099153,0 days 00:06:20.931832000,256,10000,auto,0.98,0,-1.4560274014385497,0.00012951685589066768,medium,0.02,8,PRUNED
466,466,-0.300389,2021-03-20 04:06:40.215284,2021-03-20 04:14:55.893388,0 days 00:08:15.678104000,1024,10000,auto,0.98,0,-1.9121932172666964,0.0056117495134865025,medium,0.02,16,PRUNED
467,467,268.15576,2021-03-20 04:12:49.100505,2021-03-20 04:15:10.693450,0 days 00:02:21.592945000,1024,10000,auto,0.9999,20000,-1.9130237786387925,0.0056401107787865555,medium,0.02,16,PRUNED
468,468,370.0024826,2021-03-20 04:14:55.894603,2021-03-20 04:17:11.527533,0 days 00:02:15.632930000,256,10000,auto,0.9999,20000,-2.2172364700033165,0.0042994842661821745,medium,0.02,16,PRUNED
469,469,909.4155582,2021-03-20 04:15:10.694838,2021-03-20 04:40:21.230424,0 days 00:25:10.535586000,256,10000,auto,0.9999,0,-2.1624296931468003,0.004397023603443759,medium,0.02,16,COMPLETE
470,470,2.6904946,2021-03-20 04:17:11.528892,2021-03-20 04:26:17.446773,0 days 00:09:05.917881000,256,1000000,auto,0.98,0,-1.5781399837228207,0.007126266858709847,medium,0.02,16,PRUNED
471,471,0.002624399999999999,2021-03-20 04:26:17.448245,2021-03-20 04:33:22.571867,0 days 00:07:05.123622000,256,10000,auto,0.98,0,-0.657824570341203,0.0008454737705206629,medium,0.02,8,PRUNED
472,472,,2021-03-20 04:33:22.572918,2021-03-20 04:37:50.707344,0 days 00:04:28.134426000,256,10000,auto,0.9999,10000,-2.1313651719212285,0.13692856776585613,medium,0.02,16,PRUNED
473,473,24.210526,2021-03-20 04:37:50.708853,2021-03-20 04:44:36.923175,0 days 00:06:46.214322000,256,10000,auto,0.98,0,-3.046674267013717,0.010214268549297315,medium,0.02,32,PRUNED
474,474,-1.033434,2021-03-20 04:40:21.232460,2021-03-20 04:48:43.308969,0 days 00:08:22.076509000,256,10000,auto,0.98,0,-1.7632092922048703,0.01079155743372214,big,0.02,8,PRUNED
475,475,8.010094200000001,2021-03-20 04:44:36.924303,2021-03-20 04:54:00.310992,0 days 00:09:23.386689000,256,10000,auto,0.98,1000,-1.7144414730661521,0.008291188769387777,big,0.02,8,PRUNED
476,476,0.5305142,2021-03-20 04:48:43.310355,2021-03-20 04:54:57.432367,0 days 00:06:14.122012000,256,100000,auto,0.9999,1000,-1.6086378791617515,0.007882285584405554,medium,0.001,16,PRUNED
477,477,11.6845688,2021-03-20 04:54:00.312015,2021-03-20 05:01:39.448228,0 days 00:07:39.136213000,1024,10000,auto,0.9999,0,-2.4002321423083584,0.006423999955491295,medium,0.001,16,PRUNED
478,478,38.779938599999994,2021-03-20 04:54:57.433682,2021-03-20 05:02:45.571640,0 days 00:07:48.137958000,1024,10000,auto,0.9999,0,-2.402168814280588,0.003482191266765962,medium,0.01,16,PRUNED
479,479,41.7940244,2021-03-20 05:01:39.449613,2021-03-20 05:08:27.850264,0 days 00:06:48.400651000,256,10000,auto,0.98,0,-1.856321205464806,0.003694447346564932,medium,0.01,16,PRUNED
480,480,178.4130926,2021-03-20 05:02:45.572517,2021-03-20 05:07:04.761454,0 days 00:04:19.188937000,256,10000,auto,0.98,10000,-1.9915355899221714,0.00029670099403345847,medium,0.01,64,PRUNED
481,481,-0.47206159999999997,2021-03-20 05:07:04.763159,2021-03-20 05:13:54.585693,0 days 00:06:49.822534000,256,10000,auto,0.99,1000,-2.6459473727412557,0.004979092202198805,medium,0.02,16,PRUNED
482,482,-0.10033220000000001,2021-03-20 05:08:27.851056,2021-03-20 05:15:23.415435,0 days 00:06:55.564379000,256,10000,auto,0.99,1000,-3.2172130903007585,0.004718900582682619,medium,0.02,16,PRUNED
483,483,-1.0852738,2021-03-20 05:13:54.587020,2021-03-20 05:20:58.705834,0 days 00:07:04.118814000,256,10000,auto,0.98,0,-0.6018321306604137,0.005996152330177051,medium,0.02,8,PRUNED
484,484,251.63890679999994,2021-03-20 05:15:23.416624,2021-03-20 05:22:32.056805,0 days 00:07:08.640181000,256,1000000,auto,0.98,0,-2.294068929039721,0.0061429175715983905,medium,0.02,8,PRUNED
485,485,-0.9589283999999999,2021-03-20 05:20:58.706931,2021-03-20 05:28:16.486584,0 days 00:07:17.779653000,256,1000000,auto,0.9999,0,-2.069529912957154,0.01196921974906871,medium,0.005,16,PRUNED
486,486,109.91060499999999,2021-03-20 05:22:32.058094,2021-03-20 05:29:32.451570,0 days 00:07:00.393476000,256,10000,auto,0.9999,1000,-1.8060937418508605,0.001121387538336038,medium,0.005,16,PRUNED
487,487,0.063789,2021-03-20 05:28:16.487798,2021-03-20 05:36:08.618850,0 days 00:07:52.131052000,1024,10000,auto,0.9999,1000,-2.553943732595438,0.0030754724085426057,medium,0.01,32,PRUNED
488,488,-0.044431000000000005,2021-03-20 05:29:32.452629,2021-03-20 05:37:38.346695,0 days 00:08:05.894066000,1024,10000,auto,0.98,0,-0.7038967247618075,0.008716798356347944,medium,0.01,16,PRUNED
489,489,-394.2672792,2021-03-20 05:36:08.620226,2021-03-20 05:42:44.660845,0 days 00:06:36.040619000,256,10000,auto,0.98,0,-1.5243210438115729,0.008484252302569294,medium,0.02,16,PRUNED
490,490,665.7520608,2021-03-20 05:37:38.347675,2021-03-20 06:00:05.680356,0 days 00:22:27.332681000,256,10000,auto,0.98,0,-1.6347889007875371,0.00472470164310568,medium,0.02,16,COMPLETE
491,491,421.10434139999995,2021-03-20 05:42:44.661968,2021-03-20 05:47:05.130870,0 days 00:04:20.468902000,256,10000,auto,0.98,10000,-1.9041802489498645,0.004451808260225905,medium,0.02,8,PRUNED
492,492,0.077885,2021-03-20 05:47:05.132228,2021-03-20 05:53:38.504763,0 days 00:06:33.372535000,256,10000,auto,0.9999,1000,-0.8320715803836389,0.007119253109573148,medium,0.02,512,PRUNED
493,493,194.852423,2021-03-20 05:53:38.505610,2021-03-20 06:00:21.892854,0 days 00:06:43.387244000,256,10000,auto,0.98,0,-1.6786461103369497,0.002025373492063596,medium,0.01,16,PRUNED
494,494,-0.35117319999999996,2021-03-20 06:00:05.682022,2021-03-20 06:07:00.056312,0 days 00:06:54.374290000,256,10000,auto,0.9999,1000,-0.4685538488646844,0.001983694448997072,medium,0.01,16,PRUNED
495,495,0.1930978,2021-03-20 06:00:21.893569,2021-03-20 06:07:22.257861,0 days 00:07:00.364292000,256,10000,auto,0.9999,1000,-0.4864039869995436,0.003354021872393606,medium,0.02,64,PRUNED
496,496,103.4220594,2021-03-20 06:07:00.057711,2021-03-20 06:13:23.313138,0 days 00:06:23.255427000,256,10000,auto,0.9999,0,-1.9722659948420531,0.0034537138327016123,medium,0.02,64,PRUNED
497,497,9.5332738,2021-03-20 06:07:22.259133,2021-03-20 06:17:09.904626,0 days 00:09:47.645493000,1024,10000,auto,0.98,0,-1.9698718575902092,0.016879257254587433,medium,0.02,8,PRUNED
498,498,0.0374888,2021-03-20 06:13:23.314324,2021-03-20 06:21:01.606716,0 days 00:07:38.292392000,1024,10000,auto,0.98,0,-2.1929693797605743,0.0014414507656323905,medium,0.02,8,PRUNED
499,499,0.7585767999999999,2021-03-20 06:17:09.905693,2021-03-20 06:21:18.822534,0 days 00:04:08.916841000,256,10000,auto,0.98,10000,-2.2110903227438823,0.005759923305852986,medium,0.01,16,PRUNED
