,number,value,datetime_start,datetime_complete,duration,params_batch_size,params_buffer_size,params_gamma,params_learning_starts,params_log_std_init,params_lr,params_net_arch,params_tau,params_train_freq,state
232,232,-68.42440300000001,2021-05-09 11:43:23.858284,2021-05-09 12:03:52.905989,0 days 00:20:29.047705000,16,100000,0.99,10000,-0.41473549020514305,0.004657696295175122,big,0.05,16,PRUNED
233,233,-340.27043599999996,2021-05-09 12:00:29.999533,2021-05-09 12:22:43.856240,0 days 00:22:13.856707000,64,100000,0.99,10000,-0.38304182338243475,0.004423962483855821,big,0.02,16,PRUNED
234,234,-387.3057892,2021-05-09 12:03:52.907707,2021-05-09 12:44:51.927976,0 days 00:40:59.020269000,512,100000,0.99,0,-0.33010141712482666,0.016759749448863603,big,0.01,16,PRUNED
235,235,818.5717905999999,2021-05-09 12:22:43.858599,2021-05-09 14:35:47.744223,0 days 02:13:03.885624000,512,100000,0.99,10000,-1.0469002119975244,0.0038505684527383433,big,0.01,64,COMPLETE
236,236,342.05121820000005,2021-05-09 12:44:51.935853,2021-05-09 13:17:40.184953,0 days 00:32:48.249100000,512,100000,0.99,10000,-0.6712404836018795,0.0032624840399352426,big,0.01,64,PRUNED
237,237,-30.333414600000005,2021-05-09 13:17:40.188131,2021-05-09 13:49:40.753394,0 days 00:32:00.565263000,512,100000,0.99,10000,-1.0472309782188385,0.009509592630649497,big,0.01,16,PRUNED
238,238,352.49198420000005,2021-05-09 13:40:38.997009,2021-05-09 14:11:50.542265,0 days 00:31:11.545256000,512,100000,0.99,10000,-1.0708309604398418,0.009708247895030414,big,0.01,16,PRUNED
239,239,-375.7771014,2021-05-09 13:49:40.755349,2021-05-09 14:20:48.038159,0 days 00:31:07.282810000,512,100000,0.99,10000,-1.2341625982550084,0.00699765708862441,big,0.01,16,PRUNED
240,240,910.2240902000001,2021-05-09 14:11:50.545436,2021-05-09 16:20:09.550290,0 days 02:08:19.004854000,512,100000,0.99,10000,-1.2810830283638868,0.006592754704057886,big,0.05,16,COMPLETE
241,241,818.5945752,2021-05-09 14:20:48.040184,2021-05-09 16:28:40.261244,0 days 02:07:52.221060000,512,100000,0.999,10000,-0.7723087018958066,0.005413529881051751,big,0.05,16,COMPLETE
242,242,804.8025181999999,2021-05-09 14:35:47.750611,2021-05-09 16:42:32.499804,0 days 02:06:44.749193000,512,100000,0.999,10000,-0.7898981966306443,0.005448192360135189,big,0.05,16,COMPLETE
243,243,742.3697124,2021-05-09 16:20:09.554182,2021-05-09 18:35:40.402660,0 days 02:15:30.848478000,512,100000,0.999,10000,-1.2946699066536775,0.005722937771642392,big,0.05,16,COMPLETE
244,244,921.7991814,2021-05-09 16:28:40.263209,2021-05-09 19:24:56.554766,0 days 02:56:16.291557000,1024,100000,0.99,10000,-1.1493613938026495,0.007073913529567754,big,0.05,16,COMPLETE
245,245,866.4787254,2021-05-09 16:42:32.503486,2021-05-09 19:02:28.563129,0 days 02:19:56.059643000,512,100000,0.99,10000,-1.283971624957367,0.008008260284199752,big,0.05,16,COMPLETE
246,246,-401.3471858,2021-05-09 18:35:40.404701,2021-05-09 19:07:50.170006,0 days 00:32:09.765305000,512,100000,0.99,10000,0.5009993063340241,0.0041779866940165,big,0.05,16,PRUNED
247,247,-387.8961964,2021-05-09 19:02:28.566042,2021-05-09 19:35:50.710672,0 days 00:33:22.144630000,512,100000,0.99,10000,0.5122528134731641,0.0041523310738986585,big,0.05,16,PRUNED
248,248,340.9526662,2021-05-09 19:07:50.172415,2021-05-09 19:50:02.878331,0 days 00:42:12.705916000,1024,100000,0.99,10000,-1.1419864681519276,0.0069738613306265925,big,0.05,16,PRUNED
249,249,359.2201304,2021-05-09 19:24:56.556802,2021-05-09 20:05:48.281203,0 days 00:40:51.724401000,1024,100000,0.99,10000,-1.192597332546441,0.006235180647284762,big,0.05,16,PRUNED
250,250,305.0349491999999,2021-05-09 19:35:50.713905,2021-05-09 19:58:25.462888,0 days 00:22:34.748983000,1024,100000,0.99,10000,-1.1151353896163947,0.0066474500238700215,small,0.05,16,PRUNED
251,251,951.0225773999998,2021-05-09 19:50:02.880295,2021-05-09 22:34:03.042195,0 days 02:44:00.161900000,1024,100000,0.99,10000,-1.18892533024292,0.011607501333911164,big,0.05,16,COMPLETE
252,252,851.8019449999999,2021-05-09 19:58:25.464256,2021-05-09 22:40:49.105416,0 days 02:42:23.641160000,1024,100000,0.99,10000,-3.5264686757458943,0.010754859971983078,big,0.05,512,COMPLETE
253,253,321.0449008,2021-05-09 20:05:48.284022,2021-05-09 20:38:02.003901,0 days 00:32:13.719879000,512,100000,0.99,10000,-0.9297575140685344,0.010894772178197882,big,0.05,16,PRUNED
254,254,-375.32007519999996,2021-05-09 20:38:02.006966,2021-05-09 21:10:34.298756,0 days 00:32:32.291790000,512,100000,0.99,10000,-3.4341248615581974,0.0030630000468907597,big,0.05,16,PRUNED
255,255,-400.0416786,2021-05-09 21:10:34.301103,2021-05-09 21:48:20.147183,0 days 00:37:45.846080000,1024,100000,0.99,10000,-3.5105534995013663,0.014315444323800537,big,0.05,512,PRUNED
256,256,516.7470892,2021-05-09 21:48:20.149259,2021-05-09 22:25:15.941983,0 days 00:36:55.792724000,1024,100000,0.99,10000,-0.9846692711535593,0.004745353953211707,big,0.001,16,PRUNED
257,257,-119.19540959999999,2021-05-09 22:25:15.943994,2021-05-09 23:05:22.126062,0 days 00:40:06.182068000,512,100000,0.95,1000,-1.3800666778266772,0.010266460976753832,big,0.05,16,PRUNED
258,258,387.077312,2021-05-09 22:34:03.049047,2021-05-09 23:27:10.691254,0 days 00:53:07.642207000,1024,100000,0.95,1000,-1.3108498235646318,0.011300379010898984,big,0.05,16,PRUNED
259,259,152.5332286,2021-05-09 22:40:49.108452,2021-05-09 23:21:24.964958,0 days 00:40:35.856506000,1024,100000,0.95,10000,-1.225503481157854,0.008746952838962754,big,0.05,16,PRUNED
260,260,937.0104762000001,2021-05-09 23:05:22.131116,2021-05-10 01:58:36.572238,0 days 02:53:14.441122000,1024,100000,0.99,10000,-1.240405774776213,0.008436774188898743,big,0.05,16,COMPLETE
261,261,770.422123,2021-05-09 23:21:24.968084,2021-05-10 02:10:50.975603,0 days 02:49:26.007519000,1024,100000,0.99,10000,-1.3364704784152617,0.02128761697813351,big,0.01,16,COMPLETE
262,262,-303.94250180000006,2021-05-09 23:27:10.693617,2021-05-10 00:10:07.934985,0 days 00:42:57.241368000,1024,100000,0.99,10000,-0.606908759221421,0.015462297330846572,big,0.01,16,PRUNED
263,263,-389.0691296,2021-05-10 00:10:07.936469,2021-05-10 00:30:46.412209,0 days 00:20:38.475740000,32,100000,0.99,10000,-1.172996996014669,0.01920779964536072,big,0.05,16,PRUNED
264,264,567.424345,2021-05-10 00:30:46.414469,2021-05-10 00:59:27.431046,0 days 00:28:41.016577000,256,100000,0.99,10000,-0.674966809248318,0.007904012991948477,big,0.01,16,PRUNED
265,265,910.6589742,2021-05-10 00:59:27.432417,2021-05-10 03:17:48.322269,0 days 02:18:20.889852000,512,100000,0.99,10000,-1.3373653587288727,0.0023142566191768953,big,0.05,16,COMPLETE
266,266,464.3732162,2021-05-10 01:58:36.575247,2021-05-10 02:39:20.689361,0 days 00:40:44.114114000,1024,100000,0.99,10000,-1.3711535253003542,0.002254822875461726,big,0.01,16,PRUNED
267,267,314.7370604000001,2021-05-10 02:10:50.978067,2021-05-10 02:50:44.971912,0 days 00:39:53.993845000,1024,100000,0.99,10000,-0.9387137192449074,0.002359258316468598,big,0.05,16,PRUNED
268,268,458.28242179999995,2021-05-10 02:39:20.690813,2021-05-10 03:19:30.127359,0 days 00:40:09.436546000,1024,100000,0.99,10000,-3.328128425149819,0.0033749013219461885,big,0.05,16,PRUNED
269,269,-402.4449348,2021-05-10 02:50:44.974315,2021-05-10 03:29:18.186103,0 days 00:38:33.211788000,1024,100000,0.99,10000,-3.3150895344442963,0.012405764726356124,big,0.05,16,PRUNED
270,270,518.0965960000001,2021-05-10 03:17:48.325001,2021-05-10 03:53:25.300165,0 days 00:35:36.975164000,1024,100000,0.98,10000,-3.6061028578555705,0.00301710795128513,big,0.05,16,PRUNED
271,271,896.5247475999998,2021-05-10 03:19:30.129264,2021-05-10 05:29:09.310282,0 days 02:09:39.181018000,512,100000,0.98,0,-1.1178910241993214,0.007921907107197665,big,0.02,256,COMPLETE
272,272,-53.801191800000005,2021-05-10 03:29:18.189009,2021-05-10 03:49:52.701497,0 days 00:20:34.512488000,16,100000,0.98,10000,-1.142476013631309,0.008641624939866132,big,0.02,256,PRUNED
273,273,408.78553980000004,2021-05-10 03:49:52.703915,2021-05-10 04:26:40.378367,0 days 00:36:47.674452000,512,100000,0.98,0,-0.7942344653825291,0.003073352986521277,big,0.01,16,PRUNED
274,274,961.6931284,2021-05-10 03:53:25.304297,2021-05-10 06:03:55.305238,0 days 02:10:30.000941000,512,100000,0.99,0,-0.22754812483069328,0.0043536706385124465,big,0.01,16,COMPLETE
275,275,-391.82051980000006,2021-05-10 04:26:40.379665,2021-05-10 04:47:48.297027,0 days 00:21:07.917362000,64,100000,0.99,10000,-3.7540855774316895,0.0042739182087387735,big,0.01,16,PRUNED
276,276,981.5107936,2021-05-10 04:47:48.298583,2021-05-10 06:49:17.788231,0 days 02:01:29.489648000,512,100000,0.99,10000,-1.1843750997599234,0.005036549105400668,big,0.01,16,COMPLETE
277,277,325.8195112,2021-05-10 05:29:09.312505,2021-05-10 06:03:30.922317,0 days 00:34:21.609812000,512,100000,0.99,10000,-0.956405054427884,0.005025611190925449,small,0.01,16,PRUNED
278,278,285.6127664,2021-05-10 06:03:30.924523,2021-05-10 08:04:44.904996,0 days 02:01:13.980473000,512,10000,0.99,10000,-0.19366814350588094,0.0035726534754446228,big,0.05,16,COMPLETE
279,279,-380.9512494,2021-05-10 06:03:55.310596,2021-05-10 06:40:47.760306,0 days 00:36:52.449710000,512,10000,0.99,0,0.014094740451133042,0.003993330635572595,big,0.05,16,PRUNED
280,280,-392.4661836,2021-05-10 06:40:47.762719,2021-05-10 07:18:28.137981,0 days 00:37:40.375262000,512,100000,0.99,0,-0.22069219858823436,0.01401167338300399,big,0.05,16,PRUNED
281,281,946.1646639999999,2021-05-10 06:49:17.790736,2021-05-10 08:50:12.408305,0 days 02:00:54.617569000,512,100000,0.99,10000,-0.21935321407220867,0.003351801388974679,big,0.01,16,COMPLETE
282,282,397.4380342,2021-05-10 07:18:28.140678,2021-05-10 07:55:29.484291,0 days 00:37:01.343613000,512,100000,0.99,0,-0.14026648861447255,0.0036513500084297944,big,0.01,16,PRUNED
283,283,138.60606339999998,2021-05-10 07:55:29.486663,2021-05-10 08:31:44.594898,0 days 00:36:15.108235000,512,100000,0.9,0,-0.5007960685568071,0.003087095041589891,big,0.01,16,PRUNED
284,284,410.89884,2021-05-10 08:04:44.909659,2021-05-10 08:41:54.726464,0 days 00:37:09.816805000,512,100000,0.9,0,-0.5197639983845439,0.0027780176323256205,big,0.01,16,PRUNED
285,285,505.10679319999997,2021-05-10 08:31:44.599940,2021-05-10 09:00:51.408768,0 days 00:29:06.808828000,512,100000,0.98,10000,-1.2175789249584246,0.0018513856845578805,big,0.01,16,PRUNED
286,286,536.8081574,2021-05-10 08:41:54.731414,2021-05-10 09:11:54.858111,0 days 00:30:00.126697000,512,100000,0.98,10000,-1.2265455661694467,0.004664367296949427,big,0.01,16,PRUNED
287,287,439.1600036,2021-05-10 08:50:12.410422,2021-05-10 09:15:23.958080,0 days 00:25:11.547658000,512,100000,0.98,10000,-1.2225571477449877,0.0018834630187656517,medium,0.01,16,PRUNED
288,288,1045.374629,2021-05-10 09:00:51.412090,2021-05-10 10:48:47.735277,0 days 01:47:56.323187000,512,100000,0.99,10000,0.28193960397378826,0.0043083778754093955,medium,0.01,32,COMPLETE
289,289,305.2611152,2021-05-10 09:11:54.859518,2021-05-10 09:36:56.382058,0 days 00:25:01.522540000,512,100000,0.99,10000,-1.0161761386624704,0.002283945235150694,medium,0.01,16,PRUNED
290,290,836.0451135999999,2021-05-10 09:15:23.959950,2021-05-10 11:24:01.942199,0 days 02:08:37.982249000,512,100000,0.99,10000,-1.450071310834433,0.002399494650778947,big,0.01,16,COMPLETE
291,291,764.4547462,2021-05-10 09:36:56.383293,2021-05-10 11:45:55.420292,0 days 02:08:59.036999000,512,100000,0.99,10000,0.14428576636319645,0.004014935116495348,big,0.01,16,COMPLETE
292,292,533.6913379999999,2021-05-10 10:48:47.738434,2021-05-10 11:14:03.390729,0 days 00:25:15.652295000,512,100000,0.99,10000,-1.4402550654999438,0.0037587395806301578,medium,0.01,32,PRUNED
293,293,1068.3620626,2021-05-10 11:14:03.392026,2021-05-10 12:57:41.559477,0 days 01:43:38.167451000,512,100000,0.99,10000,0.3962994653519284,0.00262751255307964,medium,0.01,32,COMPLETE
294,294,999.6599699999999,2021-05-10 11:24:01.946532,2021-05-10 13:06:44.729138,0 days 01:42:42.782606000,512,100000,0.99,10000,0.3944939912848898,0.003120916888503897,medium,0.01,32,COMPLETE
295,295,405.3248716,2021-05-10 11:45:55.424848,2021-05-10 12:10:34.918501,0 days 00:24:39.493653000,512,100000,0.99,10000,0.37364619145750744,0.0030146681646577404,medium,0.01,32,PRUNED
296,296,501.71650520000003,2021-05-10 12:10:34.920675,2021-05-10 13:18:17.078552,0 days 01:07:42.157877000,256,100000,0.99,10000,-0.8895609749456377,0.005483440377397296,medium,0.01,32,PRUNED
297,297,927.4047891999999,2021-05-10 12:57:41.564799,2021-05-10 14:40:24.580202,0 days 01:42:43.015403000,512,100000,0.99,10000,0.3992140630582014,0.005394748491094538,medium,0.01,32,COMPLETE
298,298,645.0571816,2021-05-10 13:06:44.733563,2021-05-10 13:42:00.325678,0 days 00:35:15.592115000,512,100000,0.99,10000,0.8199861703132861,0.002964575614965897,medium,0.01,32,PRUNED
299,299,1004.4930682,2021-05-10 13:18:17.082899,2021-05-10 14:57:23.774368,0 days 01:39:06.691469000,512,100000,0.99,10000,0.19859583399523134,0.003057014850353555,medium,0.01,32,COMPLETE
300,300,635.0360704,2021-05-10 13:42:00.329605,2021-05-10 14:05:41.129055,0 days 00:23:40.799450000,512,100000,0.99,10000,0.393967711736107,0.0025407327325149562,medium,0.01,32,PRUNED
301,301,109.2644068,2021-05-10 14:05:41.131283,2021-05-10 14:29:04.287534,0 days 00:23:23.156251000,512,100000,0.99,10000,0.4550122852725158,0.0035797509979539474,medium,0.001,32,PRUNED
302,302,556.5890149999999,2021-05-10 14:29:04.289552,2021-05-10 14:53:21.819413,0 days 00:24:17.529861000,512,100000,0.99,10000,0.6060896156445662,0.0026847292297950756,medium,0.01,32,PRUNED
303,303,-183.3468126,2021-05-10 14:40:24.585418,2021-05-10 14:56:08.987736,0 days 00:15:44.402318000,32,100000,0.99,10000,0.8269366657302875,0.0026036598702443184,medium,0.01,32,PRUNED
304,304,331.5704698,2021-05-10 14:53:21.821422,2021-05-10 15:09:12.892460,0 days 00:15:51.071038000,32,100000,0.99,10000,0.11863986343651223,0.003405437608556261,medium,0.01,32,PRUNED
305,305,341.5772744,2021-05-10 14:56:08.988969,2021-05-10 15:20:35.486156,0 days 00:24:26.497187000,512,100000,0.99,10000,0.5891968690598408,0.0019863995958345746,medium,0.01,32,PRUNED
306,306,989.5335136,2021-05-10 14:57:23.784971,2021-05-10 16:34:26.788634,0 days 01:37:03.003663000,512,100000,0.99,10000,0.20348509312480684,0.003345277174583882,medium,0.01,32,COMPLETE
307,307,617.2892012,2021-05-10 15:09:12.894584,2021-05-10 15:32:51.972376,0 days 00:23:39.077792000,512,100000,0.99,10000,0.26542991727416154,0.0017545829754278199,medium,0.01,32,PRUNED
308,308,230.81201879999998,2021-05-10 15:20:35.487614,2021-05-10 15:44:38.496548,0 days 00:24:03.008934000,512,100000,0.99,10000,-0.007399639364183308,0.004090723362773437,medium,0.01,32,PRUNED
309,309,974.6837478,2021-05-10 15:32:51.975285,2021-05-10 17:12:28.644169,0 days 01:39:36.668884000,512,100000,0.99,10000,0.020533625057171268,0.00430464072461612,medium,0.01,32,COMPLETE
310,310,1023.3251323999999,2021-05-10 15:44:38.498745,2021-05-10 17:24:19.674232,0 days 01:39:41.175487000,512,100000,0.99,10000,0.36515257740600204,0.002950750760351144,medium,0.01,32,COMPLETE
311,311,547.4130922,2021-05-10 16:34:26.792621,2021-05-10 16:57:05.500191,0 days 00:22:38.707570000,512,100000,0.99,10000,-0.10191888359702739,0.002932774458093119,medium,0.01,32,PRUNED
312,312,447.31258020000007,2021-05-10 16:57:05.505154,2021-05-10 17:25:39.536507,0 days 00:28:34.031353000,512,10000,0.99,1000,0.20156245452157814,0.0021563657597628003,medium,0.01,32,PRUNED
313,313,300.80855959999997,2021-05-10 17:12:28.647858,2021-05-10 17:36:19.155613,0 days 00:23:50.507755000,512,10000,0.99,10000,0.19723220220741974,0.00208853118958638,medium,0.01,32,PRUNED
314,314,790.1629347999999,2021-05-10 17:24:19.677829,2021-05-10 19:12:22.542905,0 days 01:48:02.865076000,512,10000,0.99,1000,0.249998049630125,0.00218862619671652,medium,0.01,32,COMPLETE
315,315,951.7816546,2021-05-10 17:25:39.539200,2021-05-10 19:01:47.626732,0 days 01:36:08.087532000,512,100000,0.99,10000,0.2712864975424131,0.0025520643930419342,medium,0.01,32,COMPLETE
316,316,598.3600968000001,2021-05-10 17:36:19.157231,2021-05-10 18:07:03.757207,0 days 00:30:44.599976000,512,100000,0.99,0,0.21404565059510125,0.002537787926882653,medium,0.01,32,PRUNED
317,317,348.3977224,2021-05-10 18:07:03.760878,2021-05-10 18:30:54.745772,0 days 00:23:50.984894000,512,100000,0.99,10000,0.05325351650807125,0.003043559143265679,medium,0.01,32,PRUNED
318,318,-378.59851080000004,2021-05-10 18:30:54.747509,2021-05-10 18:46:01.501196,0 days 00:15:06.753687000,16,100000,0.99,10000,0.34800019076934585,0.0754255546996018,medium,0.01,32,PRUNED
319,319,499.87170940000004,2021-05-10 18:46:01.504012,2021-05-10 19:20:16.547077,0 days 00:34:15.043065000,512,100000,0.99,10000,0.281029947223911,0.0034886937659343578,medium,0.01,64,PRUNED
320,320,578.3745577999999,2021-05-10 19:01:47.631631,2021-05-10 19:26:00.787034,0 days 00:24:13.155403000,512,100000,0.99,10000,0.32769340111577094,0.0023772364484493844,medium,0.01,32,PRUNED
321,321,980.5871638000001,2021-05-10 19:12:22.545032,2021-05-10 20:56:54.045429,0 days 01:44:31.500397000,512,100000,0.99,10000,0.3096903250337785,0.0015656793110375166,medium,0.01,32,COMPLETE
322,322,540.5764780000001,2021-05-10 19:20:16.548501,2021-05-10 19:37:37.214457,0 days 00:17:20.665956000,64,100000,0.99,10000,0.3605254238903328,0.0014822357443008533,medium,0.01,32,PRUNED
323,323,361.7124264,2021-05-10 19:26:00.788990,2021-05-10 19:42:54.851643,0 days 00:16:54.062653000,64,100000,0.99,10000,0.6243148361965986,0.0014894087500406414,medium,0.01,32,PRUNED
324,324,135.7145846,2021-05-10 19:37:37.216522,2021-05-10 20:12:45.851778,0 days 00:35:08.635256000,512,100000,0.98,10000,0.6105836993317223,0.002818006507909873,medium,0.01,32,PRUNED
325,325,976.7918456,2021-05-10 19:42:54.854445,2021-05-10 21:26:40.983813,0 days 01:43:46.129368000,512,100000,0.98,10000,0.12698262985396586,0.002982247855663767,medium,0.01,32,COMPLETE
326,326,974.0118524,2021-05-10 20:12:45.854694,2021-05-10 21:56:09.296963,0 days 01:43:23.442269000,512,100000,0.99,10000,0.14184510610992054,0.003468140589828199,medium,0.01,32,COMPLETE
327,327,560.4268036,2021-05-10 20:56:54.049481,2021-05-10 21:20:59.859067,0 days 00:24:05.809586000,512,100000,0.99,10000,0.12504347128893548,0.001958979391972724,medium,0.01,32,PRUNED
328,328,-385.26336999999995,2021-05-10 21:20:59.869924,2021-05-10 21:39:06.243092,0 days 00:18:06.373168000,512,100000,0.99,20000,0.2749187906485379,0.029631550781801245,medium,0.01,32,PRUNED
329,329,479.3317736,2021-05-10 21:26:40.987438,2021-05-10 21:44:34.640964,0 days 00:17:53.653526000,512,100000,0.98,20000,0.2688984345215231,0.0016849408015741777,medium,0.01,32,PRUNED
330,330,624.2166961999999,2021-05-10 21:39:06.245903,2021-05-10 22:04:14.149577,0 days 00:25:07.903674000,512,100000,0.98,10000,0.15814131047040744,0.0017385523231290996,medium,0.01,32,PRUNED
331,331,676.6980013999998,2021-05-10 21:44:34.642873,2021-05-10 22:35:25.225809,0 days 00:50:50.582936000,512,100000,0.98,10000,-0.010586156971878202,0.0018110886191313553,medium,0.01,32,PRUNED
332,332,563.8169542,2021-05-10 21:56:09.302212,2021-05-10 22:28:18.331924,0 days 00:32:09.029712000,512,100000,0.98,0,0.14547022326015585,0.00420633551670709,medium,0.01,32,PRUNED
333,333,-400.8426178,2021-05-10 22:04:14.150909,2021-05-10 22:36:11.070850,0 days 00:31:56.919941000,512,100000,0.98,0,0.4659383895376352,0.004167383700214767,medium,0.01,32,PRUNED
334,334,270.54747640000005,2021-05-10 22:28:18.333833,2021-05-10 22:48:39.688546,0 days 00:20:21.354713000,128,100000,0.98,10000,0.4894420794755519,0.002805517863233569,medium,0.01,32,PRUNED
335,335,67.55511840000001,2021-05-10 22:35:25.227904,2021-05-10 22:56:00.581771,0 days 00:20:35.353867000,128,100000,0.98,10000,0.4197174422558377,0.0028837991857195537,medium,0.01,32,PRUNED
336,336,336.8509292,2021-05-10 22:36:11.073693,2021-05-10 23:10:08.225255,0 days 00:33:57.151562000,128,100000,0.98,10000,0.3570590562700433,0.0027350845620802886,medium,0.01,32,PRUNED
337,337,673.9372856,2021-05-10 22:48:39.693547,2021-05-10 23:24:03.455502,0 days 00:35:23.761955000,512,100000,0.98,10000,0.3285350203988745,0.0033509287122993805,medium,0.01,32,PRUNED
338,338,815.3484804000001,2021-05-10 22:56:00.583933,2021-05-11 00:37:11.531527,0 days 01:41:10.947594000,512,100000,0.98,10000,0.07108220205286248,0.004792101408601369,medium,0.01,32,COMPLETE
339,339,631.7490716,2021-05-10 23:10:08.230247,2021-05-10 23:34:57.333533,0 days 00:24:49.103286000,512,100000,0.999,10000,0.05123317908531863,0.0036357064929128774,medium,0.01,32,PRUNED
340,340,775.840397,2021-05-10 23:24:03.458937,2021-05-11 01:02:54.917625,0 days 01:38:51.458688000,512,100000,0.999,10000,0.10776663471624327,0.004218763494392839,medium,0.01,32,COMPLETE
341,341,880.4131621999999,2021-05-10 23:34:57.344302,2021-05-11 01:13:50.866046,0 days 01:38:53.521744000,512,100000,0.99,10000,-0.06958772892684562,0.0044167486257927525,medium,0.01,32,COMPLETE
342,342,621.9830514000001,2021-05-11 00:37:11.534566,2021-05-11 01:00:02.057610,0 days 00:22:50.523044000,512,100000,0.995,10000,0.23980642692788326,0.0012553558789551327,medium,0.01,32,PRUNED
343,343,563.2598216,2021-05-11 01:00:02.059702,2021-05-11 01:48:07.517047,0 days 00:48:05.457345000,256,100000,0.99,10000,-0.060480941311360004,0.004583493077803788,medium,0.01,32,PRUNED
344,344,76.39260499999999,2021-05-11 01:02:54.920928,2021-05-11 01:25:45.160607,0 days 00:22:50.239679000,512,100000,0.99,10000,0.7254657114425551,4.7911893753967444e-05,medium,0.01,32,PRUNED
345,345,890.3958330000002,2021-05-11 01:13:50.870413,2021-05-11 02:43:46.237880,0 days 01:29:55.367467000,256,100000,0.99,10000,0.22990422553170772,0.002434579543015878,medium,0.01,32,COMPLETE
346,346,-403.62823740000005,2021-05-11 01:25:45.163892,2021-05-11 01:47:09.110633,0 days 00:21:23.946741000,256,100000,0.99,10000,0.17302819742152756,0.0024184719796646673,medium,0.001,32,PRUNED
347,347,311.8271968,2021-05-11 01:47:09.112570,2021-05-11 02:04:25.824877,0 days 00:17:16.712307000,512,100000,0.99,20000,0.21058590364771151,0.0032724382726212154,medium,0.01,32,PRUNED
