,number,value,datetime_start,datetime_complete,duration,params_batch_size,params_buffer_size,params_gamma,params_learning_starts,params_log_std_init,params_lr,params_net_arch,params_tau,params_train_freq,state
348,348,77.71898039999999,2021-05-11 01:48:07.518057,2021-05-11 02:04:40.525569,0 days 00:16:33.007512000,512,100000,0.95,20000,0.4211136733728731,0.0033719862151476406,medium,0.01,256,PRUNED
349,349,428.553686,2021-05-11 02:04:25.829042,2021-05-11 02:38:16.102866,0 days 00:33:50.273824000,512,100000,0.99,10000,0.3309324078681671,0.002396650752023879,medium,0.01,32,PRUNED
350,350,949.1774558,2021-05-11 02:04:40.526722,2021-05-11 03:41:32.374769,0 days 01:36:51.848047000,512,100000,0.99,10000,0.3169602482328617,0.0022679161551457834,medium,0.01,32,COMPLETE
351,351,477.99884380000003,2021-05-11 02:38:16.104612,2021-05-11 02:54:20.117253,0 days 00:16:04.012641000,16,100000,0.99,10000,0.2406476559444807,0.0057014157210405324,medium,0.01,32,PRUNED
352,352,-389.17837640000005,2021-05-11 02:43:46.241744,2021-05-11 02:59:20.553682,0 days 00:15:34.311938000,16,100000,0.9,10000,0.517546917965922,0.005598772428729151,medium,0.01,32,PRUNED
353,353,517.7101862000001,2021-05-11 02:54:20.119086,2021-05-11 03:18:26.832194,0 days 00:24:06.713108000,512,100000,0.98,10000,0.561389051271542,0.0032875629053903442,medium,0.01,512,PRUNED
354,354,343.7866822,2021-05-11 02:59:20.555816,2021-05-11 03:23:01.986694,0 days 00:23:41.430878000,512,100000,0.98,10000,0.08921116748080277,0.003540908674637068,medium,0.02,512,PRUNED
355,355,502.69654979999996,2021-05-11 03:18:26.833757,2021-05-11 03:42:59.987626,0 days 00:24:33.153869000,512,100000,0.99,10000,0.42329834199525274,0.003948499812358663,medium,0.02,32,PRUNED
356,356,575.2091814,2021-05-11 03:23:01.988933,2021-05-11 03:55:49.434473,0 days 00:32:47.445540000,512,100000,0.99,10000,0.3204891130782439,0.0020893936043303338,small,0.01,32,PRUNED
357,357,319.2882994,2021-05-11 03:41:32.378477,2021-05-11 03:57:40.652581,0 days 00:16:08.274104000,512,100000,0.99,10000,0.2992464643894135,0.001590135838692752,small,0.01,256,PRUNED
358,358,266.6067062,2021-05-11 03:42:59.989281,2021-05-11 03:59:46.381839,0 days 00:16:46.392558000,512,100000,0.99,10000,-3.8271793707235053,0.0012646090052132175,small,0.01,256,PRUNED
359,359,489.56218179999996,2021-05-11 03:55:49.435757,2021-05-11 04:19:59.656823,0 days 00:24:10.221066000,512,100000,0.99,10000,-3.8145531935808994,0.001411022487812259,medium,0.01,256,PRUNED
360,360,964.0053357999999,2021-05-11 03:57:40.656246,2021-05-11 05:49:01.060488,0 days 01:51:20.404242000,512,100000,0.99,0,0.13797932980750263,0.002835466735010911,medium,0.01,32,COMPLETE
361,361,656.595926,2021-05-11 03:59:46.384555,2021-05-11 06:31:24.068707,0 days 02:31:37.684152000,2048,100000,0.99,10000,-0.006661566713703271,0.002867139746022194,medium,0.01,32,COMPLETE
362,362,-387.9455454,2021-05-11 04:19:59.659145,2021-05-11 05:07:33.793393,0 days 00:47:34.134248000,2048,100000,0.98,0,0.16421356803302328,0.005104383971367147,medium,0.01,32,PRUNED
363,363,592.78616,2021-05-11 05:07:33.797968,2021-05-11 05:32:18.744249,0 days 00:24:44.946281000,512,100000,0.99,10000,0.012575590021708882,0.0027449312630872884,medium,0.01,32,PRUNED
364,364,1053.745679,2021-05-11 05:32:18.747479,2021-05-11 07:15:38.352956,0 days 01:43:19.605477000,512,100000,0.99,10000,0.701326079962016,0.004581519751894292,medium,0.01,32,COMPLETE
365,365,914.5008454000001,2021-05-11 05:49:01.063581,2021-05-11 07:33:28.859217,0 days 01:44:27.795636000,512,100000,0.99,0,0.15065942719836836,0.0028717812174787415,medium,0.01,32,COMPLETE
366,366,532.4592868,2021-05-11 06:31:24.072669,2021-05-11 07:02:20.984568,0 days 00:30:56.911899000,512,100000,0.98,0,0.1847564469339593,0.00385507227206852,medium,0.01,32,PRUNED
367,367,452.0229843999999,2021-05-11 07:02:20.990277,2021-05-11 07:33:20.402469,0 days 00:30:59.412192000,512,100000,0.99,0,0.09701565710314572,0.001891372438312058,medium,0.01,32,PRUNED
368,368,746.9652262000001,2021-05-11 07:15:38.356532,2021-05-11 09:06:33.761694,0 days 01:50:55.405162000,512,100000,0.99,0,0.08540948369235823,0.0048758077564304125,medium,0.01,32,COMPLETE
369,369,-400.48842479999996,2021-05-11 07:33:20.404530,2021-05-11 08:03:44.323380,0 days 00:30:23.918850000,512,100000,0.99,0,0.7342798583265144,0.004943369041363499,medium,0.01,32,PRUNED
370,370,-363.68375100000003,2021-05-11 07:33:28.863382,2021-05-11 07:49:46.133663,0 days 00:16:17.270281000,512,100000,0.98,20000,0.744421334433903,0.004921456717050745,medium,0.01,32,PRUNED
371,371,463.4890958,2021-05-11 07:49:46.135530,2021-05-11 08:20:03.151086,0 days 00:30:17.015556000,512,100000,0.99,0,-3.6873785493063025,0.004764814280902722,medium,0.01,64,PRUNED
372,372,633.4123648000001,2021-05-11 08:03:44.325196,2021-05-11 08:35:22.798236,0 days 00:31:38.473040000,512,100000,0.99,0,0.4273459866896358,0.0038078617200779613,medium,0.01,64,PRUNED
373,373,902.4595786000002,2021-05-11 08:20:03.154212,2021-05-11 10:07:35.954345,0 days 01:47:32.800133000,512,100000,0.995,1000,0.46262714925539195,0.0037966381852226174,medium,0.01,32,COMPLETE
374,374,-389.268618,2021-05-11 08:35:22.800600,2021-05-11 09:06:47.449800,0 days 00:31:24.649200000,512,100000,0.995,0,0.9494404496968358,0.006138829719092158,medium,0.01,32,PRUNED
375,375,578.0243323999999,2021-05-11 09:06:33.765349,2021-05-11 09:24:15.956470,0 days 00:17:42.191121000,512,100000,0.98,20000,-3.2291527123510724,0.0035644344535236587,medium,0.001,32,PRUNED
376,376,878.8729159999999,2021-05-11 09:06:47.451267,2021-05-11 10:55:09.313083,0 days 01:48:21.861816000,512,100000,0.98,1000,-3.4120333330996866,0.00348284776594127,medium,0.01,32,COMPLETE
377,377,951.2231960000001,2021-05-11 09:24:15.958059,2021-05-11 11:06:53.144469,0 days 01:42:37.186410000,512,100000,0.99,10000,-0.04398995367398503,0.0038492698730945977,medium,0.01,8,COMPLETE
378,378,805.7964746,2021-05-11 10:07:35.956508,2021-05-11 11:51:33.473915,0 days 01:43:57.517407000,512,100000,0.99,10000,-3.3726807470521623,0.0028569328236437543,medium,0.01,8,COMPLETE
379,379,470.379378,2021-05-11 10:55:09.317162,2021-05-11 11:19:53.178576,0 days 00:24:43.861414000,512,100000,0.99,10000,-0.05991658530133245,0.006244433774187625,medium,0.01,8,PRUNED
380,380,-383.24348,2021-05-11 11:06:53.148236,2021-05-11 11:31:49.503589,0 days 00:24:56.355353000,512,100000,0.99,10000,0.6474574786759361,0.006227043242410601,medium,0.01,32,PRUNED
381,381,-381.9540304,2021-05-11 11:19:53.180443,2021-05-11 11:36:19.035771,0 days 00:16:25.855328000,32,100000,0.95,10000,-3.9189348327738376,0.0028709435178159433,medium,0.01,32,PRUNED
382,382,-190.9470158,2021-05-11 11:31:49.506190,2021-05-11 11:48:17.727358,0 days 00:16:28.221168000,32,100000,0.99,10000,-3.9991786485949907,0.0029313829280634813,medium,0.01,32,PRUNED
383,383,499.8643968,2021-05-11 11:36:19.037086,2021-05-11 12:01:16.855207,0 days 00:24:57.818121000,512,100000,0.99,10000,0.19324547966319844,0.0021039802161977837,medium,0.01,32,PRUNED
384,384,212.77001439999998,2021-05-11 11:48:17.730656,2021-05-11 12:13:10.819232,0 days 00:24:53.088576000,512,100000,0.9,10000,0.21073594960376169,0.0021606522106484903,medium,0.01,32,PRUNED
385,385,186.1134088,2021-05-11 11:51:33.479968,2021-05-11 12:15:57.496866,0 days 00:24:24.016898000,512,100000,0.9,10000,0.18054303854919623,0.0010069126085180244,medium,0.01,32,PRUNED
386,386,-26.427785200000006,2021-05-11 12:01:16.857308,2021-05-11 12:26:31.108575,0 days 00:25:14.251267000,512,100000,0.9,10000,0.5108221743373492,0.004851148492694141,medium,0.01,32,PRUNED
387,387,790.1355316,2021-05-11 12:13:10.822212,2021-05-11 14:30:46.115544,0 days 02:17:35.293332000,2048,100000,0.98,20000,-3.607274494566363,0.0044897823414347055,medium,0.01,32,COMPLETE
388,388,1071.0469096000002,2021-05-11 12:15:57.499800,2021-05-11 14:45:40.744563,0 days 02:29:43.244763000,2048,100000,0.98,10000,0.536833486032809,0.004780014482509229,medium,0.01,32,COMPLETE
389,389,368.34801780000004,2021-05-11 12:26:31.109973,2021-05-11 12:54:16.972731,0 days 00:27:45.862758000,2048,100000,0.98,20000,0.10378974812916479,0.004280651809161875,medium,0.01,256,PRUNED
390,390,-379.70807279999997,2021-05-11 12:54:16.978852,2021-05-11 13:18:00.574339,0 days 00:23:43.595487000,512,100000,0.99,10000,0.9860580073925549,0.003204931363356503,medium,0.01,32,PRUNED
391,391,,2021-05-11 13:18:00.579670,,,512,100000,0.99,10000,0.29586685845232896,0.0016337484649004623,medium,0.01,32,RUNNING
392,392,,2021-05-11 14:30:46.118278,,,512,100000,0.99,10000,0.3186275234887947,0.0017187345302451253,medium,0.01,32,RUNNING
