,number,value,datetime_start,datetime_complete,duration,params_batch_size,params_buffer_size,params_gamma,params_learning_starts,params_log_std_init,params_lr,params_net_arch,params_tau,params_train_freq,state
473,473,819.5775788000001,2021-05-04 07:13:27.579868,2021-05-04 07:57:39.368835,0 days 00:44:11.788967000,2048,10000,0.98,0,-1.2475036484456183,0.002184147771404027,big,0.02,16,PRUNED
474,474,,2021-05-04 07:57:39.370274,,,2048,10000,0.98,0,-0.974592396838492,0.0032737335684794736,big,0.02,16,RUNNING
475,475,432.17883680000006,2021-05-04 08:11:47.366202,2021-05-04 09:24:08.350975,0 days 01:12:20.984773000,2048,10000,0.98,0,-0.973760679104092,0.0034019923531629407,big,0.02,8,PRUNED
476,476,,2021-05-04 08:15:13.919631,,,2048,10000,0.98,1000,-0.7071802161594567,0.0033627499142729863,big,0.02,16,RUNNING
477,477,,2021-05-04 09:24:08.357177,,,2048,10000,0.95,1000,-0.696040637918321,3.8319860805010344e-05,big,0.02,16,RUNNING
