,number,value,datetime_start,datetime_complete,duration,params_batch_size,params_buffer_size,params_gamma,params_learning_starts,params_log_std_init,params_lr,params_net_arch,params_tau,params_train_freq,state
116,116,844.3302104000002,2021-05-07 07:28:14.157721,2021-05-07 09:44:12.877494,0 days 02:15:58.719773000,512,1000000,0.98,10000,-3.4123085710875443,0.005185841326441587,big,0.01,8,COMPLETE
117,117,724.5194602,2021-05-07 08:04:28.583862,2021-05-07 11:45:37.890597,0 days 03:41:09.306735000,2048,100000,0.98,20000,-1.702935003637512,0.0016240138008097832,big,0.005,128,COMPLETE
118,118,699.8187836,2021-05-07 08:41:17.442578,2021-05-07 12:21:03.750599,0 days 03:39:46.308021000,2048,100000,0.98,20000,-1.725618819381157,0.0016632195517529026,big,0.005,128,COMPLETE
119,119,411.1989164,2021-05-07 09:44:12.883400,2021-05-07 10:26:53.050588,0 days 00:42:40.167188000,2048,100000,0.98,20000,-1.747913796349246,0.0016557188484674216,big,0.005,128,PRUNED
120,120,809.0980344,2021-05-07 10:26:53.053421,2021-05-07 13:15:21.024131,0 days 02:48:27.970710000,2048,100000,0.98,20000,-1.5399811840012807,0.002779183252161431,medium,0.005,128,COMPLETE
121,121,875.2480429999999,2021-05-07 11:45:37.895199,2021-05-07 14:07:28.612140,0 days 02:21:50.716941000,2048,100000,0.99,20000,-1.2510184762511725,0.002817300447891039,medium,0.005,128,COMPLETE
122,122,103.079621,2021-05-07 12:21:03.753274,2021-05-07 12:35:05.790643,0 days 00:14:02.037369000,128,100000,0.99,20000,-1.3464810876373403,0.0026621423157546483,medium,0.005,128,PRUNED
123,123,930.8126087999999,2021-05-07 12:35:05.794257,2021-05-07 15:02:44.821011,0 days 02:27:39.026754000,2048,100000,0.9999,10000,-1.2162764177370067,0.001204444382559215,medium,0.05,16,COMPLETE
124,124,656.1203026000001,2021-05-07 13:15:21.029798,2021-05-07 15:02:07.471606,0 days 01:46:46.441808000,512,100000,0.9999,10000,-0.6719690637628573,0.0011367944279652986,big,0.05,16,PRUNED
125,125,866.0349106,2021-05-07 14:07:28.615009,2021-05-07 16:29:40.260033,0 days 02:22:11.645024000,2048,100000,0.9999,20000,-1.3962972930112467,0.0011833057762711536,medium,0.005,128,COMPLETE
126,126,295.28944,2021-05-07 15:02:07.474132,2021-05-07 15:28:49.743618,0 days 00:26:42.269486000,2048,100000,0.99,20000,-1.2068844231551497,0.002153437517312245,medium,0.005,128,PRUNED
127,127,563.7040656,2021-05-07 15:02:44.825256,2021-05-07 17:44:53.528139,0 days 02:42:08.702883000,2048,100000,0.99,10000,-3.748193132189951,0.0006431534963004213,medium,0.05,16,COMPLETE
128,128,561.9194292,2021-05-07 15:28:49.745483,2021-05-07 17:19:31.100735,0 days 01:50:41.355252000,2048,100000,0.9999,10000,-0.9871882668101908,0.0006636779691192673,medium,0.05,16,PRUNED
129,129,485.2270906,2021-05-07 16:29:40.264317,2021-05-07 17:43:42.488511,0 days 01:14:02.224194000,2048,100000,0.9999,20000,-1.0140896315459926,0.00067882499756956,medium,0.05,16,PRUNED
130,130,720.3352821999999,2021-05-07 17:19:31.104920,2021-05-07 19:55:41.075456,0 days 02:36:09.970536000,2048,100000,0.9999,20000,-1.2161308033216416,0.004071916434073906,medium,0.05,16,COMPLETE
131,131,449.4652144,2021-05-07 17:43:42.491142,2021-05-07 20:40:02.161197,0 days 02:56:19.670055000,2048,100000,0.9999,0,-1.1898339252594092,0.0034830155497106645,medium,0.05,16,COMPLETE
132,132,422.5668224,2021-05-07 17:44:53.534223,2021-05-07 18:38:05.679573,0 days 00:53:12.145350000,2048,100000,0.9999,0,-1.1306371562058335,0.0012836417370205495,medium,0.005,16,PRUNED
133,133,668.0810572,2021-05-07 18:38:05.680618,2021-05-07 20:33:37.903159,0 days 01:55:32.222541000,1024,100000,0.9999,20000,-1.1889972404108162,0.003511200270430876,medium,0.05,128,COMPLETE
134,134,325.93353379999996,2021-05-07 19:55:41.080010,2021-05-07 20:09:46.861763,0 days 00:14:05.781753000,128,10000,0.9999,20000,-0.9077356814930531,0.0010809877837378923,medium,0.05,128,PRUNED
135,135,674.4205178,2021-05-07 20:09:46.863070,2021-05-07 22:04:09.485458,0 days 01:54:22.622388000,1024,100000,0.9999,10000,-1.3610951583382032,0.003152760387131075,medium,0.01,256,COMPLETE
136,136,578.0636710000001,2021-05-07 20:33:37.905160,2021-05-07 21:17:39.154394,0 days 00:44:01.249234000,512,100000,0.99,10000,-1.5947871089216834,0.002313253520406615,medium,0.01,256,PRUNED
137,137,823.0289491999999,2021-05-07 20:40:02.164556,2021-05-07 22:19:07.847879,0 days 01:39:05.683323000,512,100000,0.99,10000,-1.8443232296725456,0.0024853318213023724,medium,0.01,256,COMPLETE
138,138,96.28487559999999,2021-05-07 21:17:39.156913,2021-05-07 21:40:58.643296,0 days 00:23:19.486383000,512,100000,0.9,10000,-1.4270870524206942,0.00045947863951164295,medium,0.01,256,PRUNED
139,139,-387.4316928,2021-05-07 21:40:58.644989,2021-05-07 21:56:10.342478,0 days 00:15:11.697489000,32,100000,0.99,10000,-3.5782572232499894,0.0013997941466553142,medium,0.01,8,PRUNED
140,140,205.9112772,2021-05-07 21:56:10.344311,2021-05-07 22:41:02.593048,0 days 00:44:52.248737000,512,100000,0.995,10000,-3.8214162290933147,0.0026904558244438747,medium,0.001,8,PRUNED
141,141,863.8632299999999,2021-05-07 22:04:09.489300,2021-05-07 23:52:13.349388,0 days 01:48:03.860088000,512,100000,0.995,10000,-1.5832928383592608,0.002666419824626902,medium,0.005,8,COMPLETE
142,142,-368.3153766,2021-05-07 22:19:07.851556,2021-05-07 22:54:37.610748,0 days 00:35:29.759192000,2048,100000,0.9999,10000,-1.6270308402010611,0.4876110142197242,medium,0.001,8,PRUNED
143,143,506.47790679999997,2021-05-07 22:41:02.596026,2021-05-07 23:07:19.930977,0 days 00:26:17.334951000,2048,100000,0.9999,10000,-3.6574960521424975,0.004866700612478393,small,0.005,128,PRUNED
144,144,332.9870126,2021-05-07 22:54:37.614171,2021-05-07 23:11:09.689179,0 days 00:16:32.075008000,512,100000,0.98,10000,-0.7848465271481502,0.004492367193958144,small,0.005,128,PRUNED
145,145,549.6151007999999,2021-05-07 23:07:19.932560,2021-05-07 23:49:26.270271,0 days 00:42:06.337711000,2048,100000,0.98,20000,-3.885476878508347,0.0018855132817254198,big,0.005,128,PRUNED
146,146,460.97054660000003,2021-05-07 23:11:09.690516,2021-05-07 23:53:41.986337,0 days 00:42:32.295821000,2048,100000,0.98,20000,-1.3732096001040819,0.0019777218652061177,big,0.005,128,PRUNED
147,147,889.6775739999999,2021-05-07 23:49:26.273505,2021-05-08 03:23:55.529971,0 days 03:34:29.256466000,2048,100000,0.98,20000,-1.4857237303134379,0.002047744346253233,big,0.005,128,COMPLETE
148,148,177.3721332,2021-05-07 23:52:13.356513,2021-05-08 00:19:37.562025,0 days 00:27:24.205512000,512,100000,0.995,10000,-2.1610675985815164,0.001046002264530516,medium,0.005,8,PRUNED
149,149,683.7655268000001,2021-05-07 23:53:41.988734,2021-05-08 01:44:05.109697,0 days 01:50:23.120963000,512,100000,0.995,10000,-1.536606247273485,0.0009788830468098534,medium,0.005,8,COMPLETE
150,150,433.2038848,2021-05-08 00:19:37.565499,2021-05-08 00:45:42.526351,0 days 00:26:04.960852000,512,1000000,0.995,10000,-3.464084430559501,0.0013067344464306849,medium,0.01,8,PRUNED
151,151,713.7543494,2021-05-08 00:45:42.534702,2021-05-08 02:37:10.347178,0 days 01:51:27.812476000,512,10000,0.995,1000,-1.293129930882561,0.0008573554895109766,medium,0.02,8,COMPLETE
152,152,508.03466,2021-05-08 01:44:05.118715,2021-05-08 03:46:24.271900,0 days 02:02:19.153185000,512,10000,0.995,1000,-2.4210420269321213,0.003948642407847567,medium,0.01,8,COMPLETE
153,153,215.1046866,2021-05-08 02:37:10.352577,2021-05-08 02:53:17.243930,0 days 00:16:06.891353000,16,100000,0.98,10000,-3.1659368762590856,0.00365970521473868,medium,0.01,512,PRUNED
154,154,-367.2240954,2021-05-08 02:53:17.245216,2021-05-08 03:10:22.097263,0 days 00:17:04.852047000,64,1000000,0.999,10000,-3.6097008983496828,0.0030429889579614146,medium,0.01,8,PRUNED
155,155,287.0685372,2021-05-08 03:10:22.099235,2021-05-08 03:53:25.656918,0 days 00:43:03.557683000,2048,100000,0.98,20000,-1.894165764810018,0.0019584545900709336,big,0.005,128,PRUNED
156,156,521.9127579999999,2021-05-08 03:23:55.535037,2021-05-08 04:05:46.469811,0 days 00:41:50.934774000,2048,100000,0.98,20000,-1.935040710486222,0.0016291076985266986,big,0.005,128,PRUNED
157,157,356.159376,2021-05-08 03:46:24.278201,2021-05-08 04:23:44.521893,0 days 00:37:20.243692000,2048,100000,0.98,20000,-1.9831485417317931,0.002179620987452346,big,0.005,128,PRUNED
158,158,715.350915,2021-05-08 03:53:25.658116,2021-05-08 07:04:38.896846,0 days 03:11:13.238730000,2048,100000,0.98,20000,-1.4639492106136274,0.0015058294671544787,big,0.005,32,COMPLETE
159,159,80.492359,2021-05-08 04:05:46.473957,2021-05-08 04:25:12.348035,0 days 00:19:25.874078000,128,100000,0.98,20000,-1.1139516803536618,0.006142933502241728,big,0.005,32,PRUNED
160,160,532.9674118,2021-05-08 04:23:44.525813,2021-05-08 05:10:42.980250,0 days 00:46:58.454437000,128,100000,0.98,20000,-1.4758515286373766,0.005956474442552252,big,0.005,32,PRUNED
161,161,874.2361456000001,2021-05-08 04:25:12.348820,2021-05-08 06:24:43.235570,0 days 01:59:30.886750000,512,100000,0.99,10000,-1.6315256180363895,0.002775424892855279,big,0.01,16,COMPLETE
162,162,640.9372510000001,2021-05-08 05:10:42.984545,2021-05-08 06:54:22.334706,0 days 01:43:39.350161000,512,100000,0.99,10000,-1.647648628485066,0.00280385796145771,medium,0.01,16,COMPLETE
163,163,813.0399848,2021-05-08 06:24:43.237772,2021-05-08 08:03:56.666183,0 days 01:39:13.428411000,512,100000,0.99,10000,-1.6154049209761372,0.0014362432261187507,medium,0.01,8,COMPLETE
164,164,257.597449,2021-05-08 06:54:22.337259,2021-05-08 07:43:52.147284,0 days 00:49:29.810025000,2048,1000000,0.99,10000,-1.4959825103876727,0.001516486111322391,big,0.01,16,PRUNED
165,165,704.008705,2021-05-08 07:04:38.899313,2021-05-08 09:02:05.686741,0 days 01:57:26.787428000,512,100000,0.99,10000,-1.2630657537588954,0.00263994408767127,big,0.01,16,COMPLETE
166,166,845.1982737999999,2021-05-08 07:43:52.154192,2021-05-08 09:41:08.422523,0 days 01:57:16.268331000,512,100000,0.99,10000,-1.3591777553040902,0.0027837735255230355,big,0.01,16,COMPLETE
167,167,875.6440104,2021-05-08 08:03:56.669847,2021-05-08 10:00:59.728612,0 days 01:57:03.058765000,512,100000,0.99,10000,-1.335113789593585,0.0024062424215762646,big,0.01,16,COMPLETE
168,168,942.6348620000001,2021-05-08 09:02:05.689988,2021-05-08 10:59:23.202422,0 days 01:57:17.512434000,512,100000,0.99,10000,-1.308158395920617,0.004556840129532296,big,0.01,16,COMPLETE
169,169,400.3052096,2021-05-08 09:41:08.426466,2021-05-08 10:08:42.194188,0 days 00:27:33.767722000,512,100000,0.98,10000,-3.720309601014214,0.004714317413826,big,0.01,16,PRUNED
170,170,936.8161378000001,2021-05-08 10:00:59.730286,2021-05-08 11:58:52.162431,0 days 01:57:52.432145000,512,100000,0.99,10000,-1.3211208625924176,0.004305214102626736,big,0.01,16,COMPLETE
171,171,950.316502,2021-05-08 10:08:42.196540,2021-05-08 12:02:48.995550,0 days 01:54:06.799010000,512,100000,0.99,10000,-0.9343686201730592,0.0020962894913148654,big,0.05,16,COMPLETE
172,172,973.2345004000001,2021-05-08 10:59:23.206166,2021-05-08 12:55:07.200777,0 days 01:55:43.994611000,512,100000,0.99,10000,-1.1099781718494712,0.0035997135605334444,big,0.01,16,COMPLETE
173,173,-394.24225,2021-05-08 11:58:52.166290,2021-05-08 12:26:24.014474,0 days 00:27:31.848184000,512,1000000,0.99,10000,-0.9544577288977126,0.007377027925195131,big,0.01,16,PRUNED
174,174,368.08014,2021-05-08 12:02:48.999487,2021-05-08 12:29:20.839263,0 days 00:26:31.839776000,512,100000,0.99,10000,-0.924410018517239,0.0040561896426173595,big,0.05,16,PRUNED
175,175,499.14305759999996,2021-05-08 12:26:24.018094,2021-05-08 12:54:09.734638,0 days 00:27:45.716544000,512,100000,0.99,10000,-0.6158869883634266,0.00392019233470988,big,0.05,16,PRUNED
176,176,891.1803706000001,2021-05-08 12:29:20.842629,2021-05-08 14:24:50.967350,0 days 01:55:30.124721000,512,100000,0.99,10000,-1.0570664722038772,0.0035121521003679723,big,0.05,16,COMPLETE
177,177,921.3297064000001,2021-05-08 12:54:09.737245,2021-05-08 14:53:24.334640,0 days 01:59:14.597395000,512,100000,0.99,10000,-0.7761531751800599,0.005216145037968435,big,0.01,16,COMPLETE
178,178,1131.1858981999999,2021-05-08 12:55:07.202537,2021-05-08 14:51:12.339254,0 days 01:56:05.136717000,512,100000,0.99,10000,-0.8553237075917042,0.005097005125862557,big,0.05,16,COMPLETE
179,179,544.9221486,2021-05-08 14:24:50.971528,2021-05-08 16:32:09.301495,0 days 02:07:18.329967000,512,100000,0.99,10000,-1.1101431274395408,0.005162552592631997,big,0.05,16,COMPLETE
180,180,907.1808714000001,2021-05-08 14:51:12.342479,2021-05-08 17:02:49.033488,0 days 02:11:36.691009000,512,100000,0.99,10000,-1.0350742888174378,0.005299088809698718,big,0.05,16,COMPLETE
181,181,213.87496860000002,2021-05-08 14:53:24.336498,2021-05-08 15:23:20.644753,0 days 00:29:56.308255000,512,100000,0.99,10000,-0.40387277326726245,0.009715476682291594,big,0.05,16,PRUNED
182,182,588.327398,2021-05-08 15:23:20.648901,2021-05-08 15:54:46.125472,0 days 00:31:25.476571000,512,100000,0.99,10000,-0.8703573629498129,0.00472517222848662,big,0.05,16,PRUNED
183,183,943.3840112,2021-05-08 15:54:46.130296,2021-05-08 18:06:29.986510,0 days 02:11:43.856214000,512,100000,0.99,10000,-0.5067514934975514,0.008304260044676083,big,0.05,16,COMPLETE
184,184,185.4282346,2021-05-08 16:32:09.307307,2021-05-08 17:04:34.935032,0 days 00:32:25.627725000,512,100000,0.99,10000,-0.8032503789929512,0.006925312524227061,big,0.05,16,PRUNED
185,185,839.8812544,2021-05-08 17:02:49.037705,2021-05-08 19:10:45.000905,0 days 02:07:55.963200000,512,100000,0.99,10000,-0.7263773984481331,0.01206150613501524,big,0.05,16,COMPLETE
186,186,-65.4684154,2021-05-08 17:04:34.936581,2021-05-08 17:36:26.062740,0 days 00:31:51.126159000,512,100000,0.99,10000,-0.9952528900419222,0.012044404888570406,big,0.05,16,PRUNED
187,187,347.65938800000004,2021-05-08 17:36:26.066260,2021-05-08 18:07:17.922490,0 days 00:30:51.856230000,512,100000,0.99,10000,-1.0816769425086288,0.005917143565019767,big,0.05,16,PRUNED
188,188,619.9962198000001,2021-05-08 18:06:29.989675,2021-05-08 19:01:26.005831,0 days 00:54:56.016156000,512,100000,0.99,10000,-0.5241461625665016,0.008011145746160644,big,0.05,16,PRUNED
189,189,-379.12833820000003,2021-05-08 18:07:17.924122,2021-05-08 18:37:01.026693,0 days 00:29:43.102571000,512,100000,0.99,10000,-0.5123343481261999,0.014771332707974393,big,0.05,16,PRUNED
190,190,-394.5968566,2021-05-08 18:37:01.038401,2021-05-08 19:06:29.834068,0 days 00:29:28.795667000,512,100000,0.99,10000,-0.12761249291891302,0.009520003227316018,big,0.05,16,PRUNED
191,191,959.7861879999998,2021-05-08 19:01:26.010193,2021-05-08 21:11:03.385551,0 days 02:09:37.375358000,512,100000,0.99,10000,-1.1659012974392091,0.009670398025140154,big,0.05,16,COMPLETE
192,192,875.7265,2021-05-08 19:06:29.835796,2021-05-08 21:15:12.546391,0 days 02:08:42.710595000,512,100000,0.99,10000,-0.7726017037419078,0.005533148344254395,big,0.05,16,COMPLETE
193,193,405.0040028,2021-05-08 19:10:45.006519,2021-05-08 19:40:32.297763,0 days 00:29:47.291244000,512,100000,0.99,10000,-0.35231502848455554,0.0034591981434762367,big,0.05,16,PRUNED
194,194,831.9843989999999,2021-05-08 19:40:32.299941,2021-05-08 21:51:35.433078,0 days 02:11:03.133137000,512,100000,0.99,10000,-0.8525563617015071,0.005134368499045193,big,0.05,16,COMPLETE
195,195,992.5991504000001,2021-05-08 21:11:03.387949,2021-05-08 23:24:19.602480,0 days 02:13:16.214531000,512,100000,0.99,10000,-0.8257258200700719,0.005377708689310336,big,0.05,16,COMPLETE
196,196,314.9783798,2021-05-08 21:15:12.550035,2021-05-08 21:46:21.367521,0 days 00:31:08.817486000,512,100000,0.99,10000,-1.1764963055846633,0.00506806391907357,big,0.05,16,PRUNED
197,197,925.3102216,2021-05-08 21:46:21.371250,2021-05-08 23:59:16.441739,0 days 02:12:55.070489000,512,100000,0.99,10000,-0.3060524100249535,0.007354582506298236,big,0.05,16,COMPLETE
198,198,867.689507,2021-05-08 21:51:35.435503,2021-05-09 00:02:51.258899,0 days 02:11:15.823396000,512,100000,0.99,10000,-0.636193352320126,0.006527733136172494,big,0.05,16,COMPLETE
199,199,-394.5203808,2021-05-08 23:24:19.611675,2021-05-08 23:55:28.272597,0 days 00:31:08.660922000,512,100000,0.99,10000,-1.0047666579445564,0.007319463141292671,big,0.05,16,PRUNED
200,200,-382.8040804,2021-05-08 23:55:28.275661,2021-05-09 00:26:57.811284,0 days 00:31:29.535623000,512,100000,0.99,10000,-0.6332031231088862,0.02109979221650173,big,0.05,16,PRUNED
201,201,680.1810823999999,2021-05-08 23:59:16.450759,2021-05-09 02:05:48.773727,0 days 02:06:32.322968000,512,10000,0.99,10000,-0.27901862175416664,0.006079168952971094,big,0.05,16,COMPLETE
202,202,949.8878113999999,2021-05-09 00:02:51.263406,2021-05-09 02:06:32.604545,0 days 02:03:41.341139000,512,10000,0.99,10000,-0.5707177610560581,0.010360254544682238,big,0.05,16,COMPLETE
203,203,-39.3816748,2021-05-09 00:26:57.812764,2021-05-09 00:56:33.519677,0 days 00:29:35.706913000,512,10000,0.99,10000,-0.13262229301186282,0.004236793910150408,big,0.05,16,PRUNED
204,204,-390.2270869999999,2021-05-09 00:56:33.521713,2021-05-09 01:25:21.796752,0 days 00:28:48.275039000,512,100000,0.99,10000,-0.2728285557908066,0.01136686504627431,big,0.05,16,PRUNED
205,205,-400.867841,2021-05-09 01:25:21.800380,2021-05-09 01:54:25.071146,0 days 00:29:03.270766000,512,100000,0.99,10000,-1.0503602252019126,0.009726042124578454,big,0.05,16,PRUNED
206,206,983.5017318,2021-05-09 01:54:25.073485,2021-05-09 03:55:54.671142,0 days 02:01:29.597657000,512,100000,0.99,10000,-0.927750587774167,0.003511469833219713,big,0.05,16,COMPLETE
207,207,943.2697622,2021-05-09 02:05:48.775461,2021-05-09 04:10:04.184003,0 days 02:04:15.408542000,512,100000,0.99,10000,-1.1728587620039692,0.003529737150753836,big,0.05,16,COMPLETE
208,208,-377.6947566,2021-05-09 02:06:32.607728,2021-05-09 02:35:08.816436,0 days 00:28:36.208708000,512,10000,0.99,10000,-0.44335716762080446,0.01760878221417161,big,0.05,16,PRUNED
209,209,285.12299459999997,2021-05-09 02:35:08.821513,2021-05-09 04:36:59.192674,0 days 02:01:50.371161000,512,10000,0.99,10000,-0.7408493695199544,0.008184298365175943,big,0.05,16,COMPLETE
210,210,-389.9042422,2021-05-09 03:55:54.672906,2021-05-09 04:24:13.383332,0 days 00:28:18.710426000,512,100000,0.99,10000,0.049815573960585,0.007981988519820663,big,0.05,16,PRUNED
211,211,843.209145,2021-05-09 04:10:04.187704,2021-05-09 06:13:42.431746,0 days 02:03:38.244042000,512,100000,0.99,10000,-0.7312550854325575,0.008343655754253089,big,0.05,16,COMPLETE
212,212,270.34250959999997,2021-05-09 04:24:13.385270,2021-05-09 04:52:16.554684,0 days 00:28:03.169414000,512,100000,0.99,10000,-0.8628919153508559,0.008082573833984745,big,0.05,16,PRUNED
213,213,817.4559776,2021-05-09 04:36:59.196725,2021-05-09 06:35:52.296197,0 days 01:58:53.099472000,512,100000,0.99,10000,-0.8941512975500189,0.004227692803925831,big,0.05,16,COMPLETE
214,214,783.3533113999999,2021-05-09 04:52:16.556413,2021-05-09 06:52:48.014341,0 days 02:00:31.457928000,512,100000,0.99,10000,-0.9301697447957669,0.005063433454640397,big,0.05,16,COMPLETE
215,215,839.0975874,2021-05-09 06:13:42.435139,2021-05-09 08:18:39.539452,0 days 02:04:57.104313000,512,100000,0.99,10000,-0.5622539658542125,0.004317732089355746,big,0.05,16,COMPLETE
216,216,446.7180298,2021-05-09 06:35:52.300328,2021-05-09 07:03:21.962309,0 days 00:27:29.661981000,512,100000,0.99,10000,-0.5764955050713401,0.004967764953130768,big,0.05,16,PRUNED
217,217,904.7847256000001,2021-05-09 06:52:48.016437,2021-05-09 08:55:09.830325,0 days 02:02:21.813888000,512,100000,0.99,10000,-1.157576386901686,0.0060014303995009535,big,0.05,16,COMPLETE
218,218,24.108091000000005,2021-05-09 07:03:21.965543,2021-05-09 07:23:50.793330,0 days 00:20:28.827787000,32,100000,0.99,10000,-1.2315814947182417,0.003607977698733758,big,0.05,16,PRUNED
219,219,207.2026508,2021-05-09 07:23:50.796135,2021-05-09 07:51:38.800658,0 days 00:27:48.004523000,512,100000,0.95,10000,-1.144423539327334,0.00616757546956584,big,0.05,16,PRUNED
220,220,-381.7543274,2021-05-09 07:51:38.805543,2021-05-09 08:15:32.349903,0 days 00:23:53.544360000,256,100000,0.99,10000,-0.545662425990851,0.01336859849247619,big,0.05,16,PRUNED
221,221,549.7496596,2021-05-09 08:15:32.351394,2021-05-09 08:42:37.440940,0 days 00:27:05.089546000,512,100000,0.99,10000,-0.9643831903454665,0.0034217219789509264,big,0.01,16,PRUNED
222,222,349.14813300000003,2021-05-09 08:18:39.542720,2021-05-09 08:48:02.366452,0 days 00:29:22.823732000,512,100000,0.9,10000,-1.0101960296147479,0.0038355816284159822,big,0.01,16,PRUNED
223,223,402.0913936,2021-05-09 08:42:37.443387,2021-05-09 09:10:06.397865,0 days 00:27:28.954478000,512,100000,0.9,10000,-0.69763926704532,0.006708841389782562,big,0.01,16,PRUNED
224,224,944.5648712,2021-05-09 08:48:02.368509,2021-05-09 10:54:02.291720,0 days 02:05:59.923211000,512,100000,0.99,10000,-0.6822604664265752,0.006635588885595726,big,0.01,16,COMPLETE
225,225,-389.67593819999996,2021-05-09 08:55:09.832196,2021-05-09 09:23:19.775095,0 days 00:28:09.942899000,512,100000,0.99,10000,-1.2720419972682084,0.006894762908132567,big,0.05,16,PRUNED
226,226,364.7917124,2021-05-09 09:10:06.400230,2021-05-09 09:38:07.414445,0 days 00:28:01.014215000,512,100000,0.99,10000,-1.122658084540871,0.005658993062854352,big,0.05,16,PRUNED
227,227,1036.8686292,2021-05-09 09:23:19.779047,2021-05-09 11:28:26.756584,0 days 02:05:06.977537000,512,100000,0.99,10000,-1.172574684688367,0.00992086788600814,big,0.05,16,COMPLETE
228,228,839.5041204000001,2021-05-09 09:38:07.416713,2021-05-09 11:43:23.851683,0 days 02:05:16.434970000,512,100000,0.99,10000,-0.8646198225866608,0.010938409451088866,big,0.05,16,COMPLETE
229,229,503.65378019999997,2021-05-09 10:54:02.294972,2021-05-09 11:25:49.283708,0 days 00:31:46.988736000,512,100000,0.99,10000,-0.8036586416370725,0.009281298370269496,big,0.01,16,PRUNED
230,230,750.7718648000001,2021-05-09 11:25:49.285706,2021-05-09 13:40:38.994315,0 days 02:14:49.708609000,512,100000,0.99,10000,-0.4643819413585232,0.0031448158984822725,big,0.01,16,COMPLETE
231,231,463.91803799999997,2021-05-09 11:28:26.758434,2021-05-09 12:00:29.996750,0 days 00:32:03.238316000,512,100000,0.99,10000,-0.890359547189534,0.012888053683459917,big,0.05,16,PRUNED
