,number,value,datetime_start,datetime_complete,duration,params_batch_size,params_buffer_size,params_exploration_final_eps,params_exploration_fraction,params_gamma,params_learning_starts,params_lr,params_net_arch,params_subsample_steps,params_target_update_interval,params_train_freq,state
306,306,4.0603784,2021-05-05 05:38:19.030194,2021-05-05 05:43:03.633544,0 days 00:04:44.603350000,512,10000,0.003706847373585797,0.29034235415162785,0.98,10000,0.0014965548265218672,small,2,1,16,PRUNED
307,307,246.4678374,2021-05-05 05:43:03.637133,2021-05-05 05:55:40.068391,0 days 00:12:36.431258000,512,100000,0.018706542966781262,0.3063589252393338,0.98,10000,0.0020974471204441097,small,2,15000,1000,PRUNED
308,308,-361.7474142,2021-05-05 05:44:43.946029,2021-05-05 05:46:51.437438,0 days 00:02:07.491409000,64,100000,0.007153575602941758,0.3029282340394305,0.98,10000,0.001724738229581227,small,2,15000,1000,PRUNED
309,309,-73.0581044,2021-05-05 05:46:51.452618,2021-05-05 06:04:33.887314,0 days 00:17:42.434696000,512,10000,0.004749405141862774,0.27208871575813093,0.98,10000,0.0029709950533856164,small,2,1,1000,COMPLETE
310,310,774.2525810000001,2021-05-05 05:55:32.384751,2021-05-05 06:12:39.060101,0 days 00:17:06.675350000,512,100000,0.018823387175178705,0.2655326717660116,0.95,10000,0.003279116110321271,small,2,1,1000,COMPLETE
311,311,252.83972139999997,2021-05-05 05:55:40.069551,2021-05-05 06:05:45.035247,0 days 00:10:04.965696000,512,100000,0.011692239805135018,0.26357961685871195,0.95,10000,0.0032209707405646847,tiny,2,1,1000,COMPLETE
312,312,95.3973422,2021-05-05 06:04:33.907858,2021-05-05 06:21:29.472979,0 days 00:16:55.565121000,512,100000,0.010517235640487507,0.2551785391438243,0.95,10000,0.0013805796726873885,small,2,1,1000,COMPLETE
313,313,680.2620906,2021-05-05 06:05:45.037452,2021-05-05 06:22:38.354903,0 days 00:16:53.317451000,512,100000,0.00025324188940732857,0.2540880524883058,0.95,10000,0.0014390833478335379,small,2,1,1000,COMPLETE
314,314,800.0871305999999,2021-05-05 06:12:39.079378,2021-05-05 06:28:42.031341,0 days 00:16:02.951963000,512,100000,0.007880413937627413,0.25372703707132566,0.95,10000,0.0016900234739410033,small,2,1,1000,COMPLETE
315,315,759.1212522,2021-05-05 06:21:29.482736,2021-05-05 06:38:18.936283,0 days 00:16:49.453547000,512,100000,0.00019248448724243708,0.2764042047801838,0.95,10000,0.0015755431260038347,small,2,1,1000,COMPLETE
316,316,696.3170530000001,2021-05-05 06:22:38.364815,2021-05-05 06:38:59.439501,0 days 00:16:21.074686000,512,100000,0.0075725216533161655,0.274668760048774,0.95,10000,0.0017237614200245374,small,2,1,1000,COMPLETE
317,317,-33.4493568,2021-05-05 06:28:42.040911,2021-05-05 06:41:35.045749,0 days 00:12:53.004838000,64,1000000,0.0031122887951648475,0.28170350296255775,0.95,10000,0.002441929847968523,small,2,1,1000,COMPLETE
318,318,33.120948399999996,2021-05-05 06:38:18.946554,2021-05-05 06:51:27.324798,0 days 00:13:08.378244000,64,1000000,0.0034582488614206515,0.28707634648641434,0.95,0,0.004135783872119209,small,2,1,1000,COMPLETE
319,319,323.91487459999996,2021-05-05 06:38:59.441495,2021-05-05 06:52:15.145892,0 days 00:13:15.704397000,64,1000000,3.098371489320068e-05,0.3228405996470476,0.95,0,0.002663657545613012,small,2,1,1000,COMPLETE
320,320,91.8454682,2021-05-05 06:41:35.048781,2021-05-05 06:53:04.300475,0 days 00:11:29.251694000,16,1000000,1.6118774960069455e-05,0.2931084396704036,0.95,0,0.003915913111923713,small,2,1,1000,COMPLETE
321,321,421.02636259999997,2021-05-05 06:51:27.334199,2021-05-05 07:01:55.204170,0 days 00:10:27.869971000,16,1000000,0.012501553872572312,0.32610925465542845,0.95,5000,0.0011361385352865424,small,2,1,256,COMPLETE
322,322,-166.3323186,2021-05-05 06:52:15.147248,2021-05-05 06:55:04.564571,0 days 00:02:49.417323000,16,100000,0.012573100885455584,0.23783503797818265,0.95,5000,0.0007506355070118228,small,2,1,256,PRUNED
323,323,273.3226573999999,2021-05-05 06:53:04.302646,2021-05-05 07:04:03.580329,0 days 00:10:59.277683000,32,100000,0.013239475274134074,0.23898659774761716,0.95,5000,0.0007728548312965318,small,2,1,256,COMPLETE
324,324,247.64244360000004,2021-05-05 06:55:04.565899,2021-05-05 07:05:22.631323,0 days 00:10:18.065424000,32,100000,0.0074569494756431265,0.22760303866543988,0.98,10000,0.0011189754883103363,small,2,1,1000,COMPLETE
325,325,-275.9284546,2021-05-05 07:01:55.206534,2021-05-05 07:11:50.640565,0 days 00:09:55.434031000,32,100000,0.006927117405294602,0.22649688684560576,0.98,10000,0.002087260473136112,small,2,1,1000,COMPLETE
326,326,279.4866454,2021-05-05 07:04:03.581425,2021-05-05 07:20:16.925959,0 days 00:16:13.344534000,512,100000,0.006973433519012996,0.22654121147318568,0.98,10000,0.0021251195467432973,small,2,1,1000,COMPLETE
327,327,545.329437,2021-05-05 07:05:22.633303,2021-05-05 07:22:21.917068,0 days 00:16:59.283765000,512,100000,0.003916649991946208,0.30536633480149034,0.95,10000,0.0019782264493519545,small,2,1,1000,COMPLETE
328,328,245.9831628,2021-05-05 07:11:50.644443,2021-05-05 07:29:00.870272,0 days 00:17:10.225829000,512,1000000,0.0041192751065917185,0.3050542086414074,0.95,10000,0.0027979344387819116,small,2,1,1000,COMPLETE
329,329,352.894156,2021-05-05 07:20:16.927864,2021-05-05 07:38:29.005024,0 days 00:18:12.077160000,512,1000000,0.0035598397361715386,0.3078108794991564,0.95,10000,0.006303631465208842,small,2,1,1000,COMPLETE
330,330,212.2296166,2021-05-05 07:22:21.935445,2021-05-05 07:40:27.192555,0 days 00:18:05.257110000,512,1000000,0.01641468169236724,0.2665962752983518,0.95,10000,0.005170676252153357,small,2,1,1000,COMPLETE
331,331,-113.87606000000001,2021-05-05 07:29:00.877240,2021-05-05 07:46:27.861257,0 days 00:17:26.984017000,512,10000,0.01709931578029491,0.26640497384772105,0.995,10000,0.005041343061451557,small,2,1,1000,COMPLETE
332,332,-37.00481579999999,2021-05-05 07:38:29.007357,2021-05-05 07:56:16.324618,0 days 00:17:47.317261000,512,10000,0.025626703455110835,0.2493629033166771,0.995,10000,0.004625638819750524,small,2,1,1000,COMPLETE
333,333,644.8506456000001,2021-05-05 07:40:27.199436,2021-05-05 07:57:46.441411,0 days 00:17:19.241975000,512,10000,0.01005711869165156,0.24873363877912769,0.995,10000,0.003487192165927652,small,2,1,1000,COMPLETE
334,334,430.16671759999997,2021-05-05 07:46:27.870200,2021-05-05 08:04:00.841631,0 days 00:17:32.971431000,512,100000,0.010178069460693792,0.2493311734729112,0.999,10000,0.0033851492034825863,small,2,1,1000,COMPLETE
335,335,-85.3200996,2021-05-05 07:56:16.329210,2021-05-05 08:14:48.549911,0 days 00:18:32.220701000,512,100000,0.08386936692165657,0.25645800085217785,0.999,10000,0.0033695685878262515,small,2,1,1000,COMPLETE
336,336,860.6955532,2021-05-05 07:57:46.453675,2021-05-05 08:16:20.895953,0 days 00:18:34.442278000,512,100000,0.009638449163926494,0.205447971283383,0.999,10000,0.002850720160388199,small,2,1,1000,COMPLETE
337,337,-178.75638519999998,2021-05-05 08:04:00.854896,2021-05-05 08:08:46.281662,0 days 00:04:45.426766000,512,1000000,0.08130788391290154,0.2057874604295699,0.95,10000,0.0013124236952037562,small,2,1,4,PRUNED
338,338,935.1800956000001,2021-05-05 08:08:46.284851,2021-05-05 08:19:20.036568,0 days 00:10:33.751717000,512,100000,5.4513878369904546e-05,0.2956445279942568,0.95,10000,0.0009177466737503888,tiny,2,1,1000,COMPLETE
339,339,-160.2286274,2021-05-05 08:14:48.553076,2021-05-05 08:26:48.679827,0 days 00:12:00.126751000,512,1000000,0.0007507697879762516,0.2949850863907932,0.95,10000,0.0010052969859619437,tiny,2,1,8,COMPLETE
340,340,158.65741559999998,2021-05-05 08:16:20.897359,2021-05-05 08:28:01.617954,0 days 00:11:40.720595000,512,1000000,0.11853592476777434,0.294271425046592,0.95,10000,0.0009288934000615022,small,8,1,8,COMPLETE
341,341,468.126444,2021-05-05 08:19:20.046444,2021-05-05 08:38:58.668983,0 days 00:19:38.622539000,512,1000000,0.003283924294081705,0.2762399965193714,0.95,10000,0.0014334380898093045,small,2,1,8,COMPLETE
342,342,-108.51633999999999,2021-05-05 08:26:48.692205,2021-05-05 08:36:29.036345,0 days 00:09:40.344140000,512,1000000,7.533453900637186e-05,0.2779682373955066,0.95,10000,0.001622406510445951,small,8,1,1000,COMPLETE
343,343,789.8732026,2021-05-05 08:28:01.629111,2021-05-05 08:46:17.878943,0 days 00:18:16.249832000,512,100000,0.003552208256831884,0.2731818918117669,0.95,10000,0.00174307829726073,small,2,1,1000,COMPLETE
344,344,991.9127954000002,2021-05-05 08:36:29.050622,2021-05-05 08:54:55.170639,0 days 00:18:26.120017000,512,100000,0.005991700984576618,0.26197643117222186,0.95,10000,0.0024561778559593268,small,2,1,1000,COMPLETE
345,345,102.40253460000001,2021-05-05 08:38:58.676328,2021-05-05 08:53:04.928613,0 days 00:14:06.252285000,128,100000,0.0072054418530611815,0.18489580093900776,0.95,10000,0.0022693552880363958,small,2,1,1000,COMPLETE
346,346,136.1785854,2021-05-05 08:46:17.880298,2021-05-05 09:00:03.853443,0 days 00:13:45.973145000,128,100000,0.006804729890449064,0.1735707624954611,0.95,10000,0.0024761469960207618,small,2,1,1000,COMPLETE
347,347,701.9140338,2021-05-05 08:53:04.935041,2021-05-05 09:11:52.568889,0 days 00:18:47.633848000,512,100000,0.013549306116887684,0.2595235302256472,0.98,10000,0.0025830857018238024,small,2,1,1000,COMPLETE
348,348,701.6100726000001,2021-05-05 08:54:55.176736,2021-05-05 09:12:55.836738,0 days 00:18:00.660002000,512,1000000,0.013401671414415603,0.21753540259511375,0.98,10000,0.001969992849212341,small,2,1,1000,COMPLETE
349,349,1098.6574294,2021-05-05 09:00:03.866423,2021-05-05 09:18:09.541831,0 days 00:18:05.675408000,512,1000000,0.021293552240467507,0.2353423544389515,0.95,10000,0.001304101880655952,small,2,1,1000,COMPLETE
350,350,45.50826739999999,2021-05-05 09:11:52.571422,2021-05-05 09:13:04.965125,0 days 00:01:12.393703000,512,1000000,0.010647163179891107,0.23814812651568718,0.95,20000,0.001312235755656325,small,2,5000,1000,PRUNED
351,351,614.3839326,2021-05-05 09:12:55.852471,2021-05-05 09:25:22.347949,0 days 00:12:26.495478000,64,1000000,0.01910311614523068,0.23718124724655593,0.95,20000,0.0013588654287111526,small,2,1,1000,COMPLETE
352,352,-276.282519,2021-05-05 09:13:04.966019,2021-05-05 09:16:05.883777,0 days 00:03:00.917758000,64,1000000,5.670616026635326e-05,0.28973232922658904,0.95,10000,0.0005963417370766467,small,2,1,1000,PRUNED
353,353,-356.7984128,2021-05-05 09:16:05.886403,2021-05-05 09:18:07.355201,0 days 00:02:01.468798000,256,100000,0.01993166180517418,0.2845261355150041,0.95,10000,0.003630398799038365,small,2,20000,1000,PRUNED
354,354,195.3819254,2021-05-05 09:18:07.357073,2021-05-05 09:36:42.503660,0 days 00:18:35.146587000,512,1000000,0.00021755300606830091,0.24276127183953214,0.95,10000,0.0012741039115704675,small,2,1,1000,COMPLETE
355,355,1126.3995564000002,2021-05-05 09:18:09.547617,2021-05-05 09:35:41.778742,0 days 00:17:32.231125000,512,1000000,0.02133657906774416,0.2317916355060449,0.95,10000,0.001850483753720598,small,2,1,1000,COMPLETE
356,356,1243.8058578,2021-05-05 09:25:22.349692,2021-05-05 09:43:25.603422,0 days 00:18:03.253730000,512,1000000,0.01701626517480789,0.24328099709464934,0.95,10000,0.0018478414453407782,small,2,1,1000,COMPLETE
357,357,1340.3694831999999,2021-05-05 09:35:41.791142,2021-05-05 09:52:59.065749,0 days 00:17:17.274607000,512,1000000,0.029371190913915296,0.23129167117810467,0.95,10000,0.0019482215143987976,small,2,1,1000,COMPLETE
358,358,1485.1098034,2021-05-05 09:36:42.522308,2021-05-05 09:54:45.933152,0 days 00:18:03.410844000,512,1000000,0.02633362231811897,0.22175283117941602,0.95,10000,0.0018307754257612685,small,2,1,1000,COMPLETE
359,359,656.3232228,2021-05-05 09:43:25.610773,2021-05-05 10:00:45.009885,0 days 00:17:19.399112000,512,1000000,0.0312663237218715,0.22929117563578078,0.98,10000,0.0018945678891764725,small,2,1,1000,COMPLETE
360,360,554.5966708,2021-05-05 09:52:59.076874,2021-05-05 10:09:56.401587,0 days 00:16:57.324713000,512,1000000,0.017188777296611907,0.2215078658231351,0.98,10000,0.0017896568189484426,small,2,1,1000,COMPLETE
361,361,622.0143688,2021-05-05 09:54:45.935538,2021-05-05 10:12:07.162350,0 days 00:17:21.226812000,512,1000000,0.02635071695669621,0.2171520992060867,0.95,10000,0.0018323434606628533,small,2,1,1000,COMPLETE
362,362,803.5745290000001,2021-05-05 10:00:45.017333,2021-05-05 10:17:30.083271,0 days 00:16:45.065938000,512,1000000,0.02451134670353757,0.22073790668947374,0.95,10000,0.0017364707358549644,small,2,1,1000,COMPLETE
363,363,642.2844046,2021-05-05 10:09:56.403834,2021-05-05 10:27:17.092969,0 days 00:17:20.689135000,512,1000000,0.024942451643227278,0.21467572410027447,0.95,10000,0.0019759410767290556,small,2,1,1000,COMPLETE
364,364,-287.5316672,2021-05-05 10:12:07.174047,2021-05-05 10:16:09.123553,0 days 00:04:01.949506000,512,1000000,0.02637406112775443,0.23518844562526894,0.95,0,0.0021222858348397522,small,2,15000,1000,PRUNED
365,365,811.4765176,2021-05-05 10:16:09.126722,2021-05-05 10:33:17.445213,0 days 00:17:08.318491000,512,1000000,0.030051230475882873,0.24314523146848468,0.95,10000,0.0015995387255243925,small,2,1,1000,COMPLETE
366,366,523.4205144,2021-05-05 10:17:30.087097,2021-05-05 10:35:15.341009,0 days 00:17:45.253912000,512,1000000,0.023758157849528085,0.24632362646639333,0.95,10000,0.0015396038374138248,small,2,1,1000,COMPLETE
367,367,1165.5628437999999,2021-05-05 10:27:17.094660,2021-05-05 10:45:55.388302,0 days 00:18:38.293642000,512,1000000,0.029502030218610257,0.24613007485311406,0.95,10000,0.001589453212651653,small,2,1,1000,COMPLETE
368,368,116.164926,2021-05-05 10:33:17.449698,2021-05-05 10:52:32.267228,0 days 00:19:14.817530000,512,1000000,0.020472473494578314,0.24951051887032527,0.95,10000,0.0024493884419266115,small,2,1,16,COMPLETE
369,369,59.5375914,2021-05-05 10:35:15.352152,2021-05-05 10:39:51.338111,0 days 00:04:35.985959000,512,1000000,0.028131026835848755,0.23043077130547535,0.95,10000,0.002342752263912526,small,2,1,16,PRUNED
370,370,1045.6613160000002,2021-05-05 10:39:51.340881,2021-05-05 10:58:40.860931,0 days 00:18:49.520050000,512,1000000,0.021639488191659766,0.2558668379521051,0.95,10000,0.00247228720408278,small,2,1,1000,COMPLETE
371,371,506.90984879999996,2021-05-05 10:45:55.391289,2021-05-05 11:06:42.344086,0 days 00:20:46.952797000,512,1000000,0.02971648290007497,0.2571257244160605,0.95,10000,0.0027168504789507283,small,2,1,4,COMPLETE
372,372,1461.9220376,2021-05-05 10:52:32.277286,2021-05-05 11:12:46.616230,0 days 00:20:14.338944000,512,1000000,0.03862770407528371,0.264558641975372,0.95,10000,0.0029300490231619937,small,2,1,4,COMPLETE
373,373,695.3820726,2021-05-05 10:58:40.870872,2021-05-05 11:17:05.262253,0 days 00:18:24.391381000,512,1000000,0.03212401057479691,0.2654826922688162,0.95,10000,0.0028368447102876827,small,2,1,1000,COMPLETE
374,374,1118.2221718,2021-05-05 11:06:42.351978,2021-05-05 11:20:57.659687,0 days 00:14:15.307709000,256,1000000,0.03508741432867807,0.26424600077721694,0.95,10000,0.001966097864632016,small,2,1,1000,COMPLETE
375,375,527.2550441999999,2021-05-05 11:12:46.636405,2021-05-05 11:28:13.313150,0 days 00:15:26.676745000,256,1000000,0.03240800712526666,0.2724706721297124,0.95,10000,0.004161817249448702,small,2,1,4,COMPLETE
376,376,144.37292859999997,2021-05-05 11:17:05.265191,2021-05-05 11:31:22.767783,0 days 00:14:17.502592000,256,1000000,0.03530456599155187,0.2693582230587257,0.95,10000,0.00708188689012496,small,2,1,1000,COMPLETE
377,377,134.440015,2021-05-05 11:20:57.671338,2021-05-05 11:24:32.850401,0 days 00:03:35.179063000,256,1000000,0.037026484936451616,0.2677716328642522,0.95,10000,0.004143602378674226,small,2,1,4,PRUNED
378,378,612.4048570000001,2021-05-05 11:24:32.854374,2021-05-05 11:40:04.648845,0 days 00:15:31.794471000,256,1000000,0.022704144329383592,0.2618725069160558,0.95,0,0.001991833435147023,small,2,1,1000,COMPLETE
379,379,180.256831,2021-05-05 11:28:13.319455,2021-05-05 11:33:10.941156,0 days 00:04:57.621701000,256,1000000,0.027787957660596486,0.20295330789407356,0.99,0,0.001961595729553678,small,2,1,4,PRUNED
380,380,-52.144218,2021-05-05 11:31:22.770002,2021-05-05 11:52:58.864188,0 days 00:21:36.094186000,512,1000000,0.039899835303557514,0.25164022359369237,0.99,0,0.0020052110406518606,small,2,1,4,COMPLETE
381,381,754.4435159999999,2021-05-05 11:33:10.942261,2021-05-05 11:47:28.071743,0 days 00:14:17.129482000,256,1000000,0.037106858252843655,0.2452170158041177,0.95,10000,0.002046131843790716,small,2,1,1000,COMPLETE
382,382,-369.0295596,2021-05-05 11:40:04.652416,2021-05-05 11:42:18.272169,0 days 00:02:13.619753000,256,1000000,0.03642800279021858,0.25132780557787837,0.95,10000,0.0030861514939667925,small,2,5000,4,PRUNED
383,383,1365.0751037999999,2021-05-05 11:42:18.284104,2021-05-05 11:58:32.687527,0 days 00:16:14.403423000,256,1000000,0.03844407051745051,0.24202595943299957,0.95,10000,0.0033073118452624805,small,2,1,4,COMPLETE
384,384,835.6233478,2021-05-05 11:47:28.084934,2021-05-05 12:08:23.039025,0 days 00:20:54.954091000,512,1000000,0.04364013841243482,0.22956512474615018,0.95,10000,0.003072634957032094,small,2,1,4,COMPLETE
385,385,-241.07182859999998,2021-05-05 11:52:58.887679,2021-05-05 11:55:47.690962,0 days 00:02:48.803283000,512,10000,0.02951762091708146,0.2244373447973682,0.95,10000,0.0031750760004118587,small,2,20000,4,PRUNED
386,386,1381.808339,2021-05-05 11:55:47.700365,2021-05-05 12:15:41.605305,0 days 00:19:53.904940000,512,1000000,0.02819767433885906,0.23505927022998369,0.95,10000,0.0016149219347492262,small,2,1,1000,COMPLETE
387,387,271.970952,2021-05-05 11:58:32.695801,2021-05-05 12:14:48.503346,0 days 00:16:15.807545000,256,1000000,0.04548583271135698,0.23891347317633246,0.95,10000,0.0015779642042252939,small,2,1,4,COMPLETE
388,388,594.6270722,2021-05-05 12:08:23.051803,2021-05-05 12:23:55.163721,0 days 00:15:32.111918000,256,1000000,0.046724089567919125,0.23571256427288245,0.95,10000,0.0015845830778088471,small,2,1,4,COMPLETE
389,389,330.38673,2021-05-05 12:14:48.507166,2021-05-05 12:30:40.663801,0 days 00:15:52.156635000,256,1000000,0.033503546780677254,0.2594955595495589,0.95,10000,0.0026465072058560915,small,2,1,4,COMPLETE
390,390,923.7006011999999,2021-05-05 12:15:41.613640,2021-05-05 12:30:57.261394,0 days 00:15:15.647754000,256,1000000,0.04079541814702548,0.23882818556121738,0.95,10000,0.0025348344864403204,small,2,1,1000,COMPLETE
391,391,539.3385316,2021-05-05 12:23:55.168080,2021-05-05 12:44:59.196081,0 days 00:21:04.028001000,512,1000000,0.03931269174829529,0.24454732072001972,0.95,10000,0.002551927113853443,small,2,1,4,COMPLETE
392,392,1422.1393166,2021-05-05 12:30:40.673882,2021-05-05 12:53:52.536113,0 days 00:23:11.862231000,256,1000000,0.039649323400270386,0.2440959309869104,0.95,10000,0.0011402154020401375,small,1,1,4,COMPLETE
393,393,950.1712688,2021-05-05 12:30:57.262738,2021-05-05 12:45:47.731235,0 days 00:14:50.468497000,256,1000000,0.028377765681572447,0.24643024150635828,0.95,10000,0.0010980585659074627,small,2,1,1000,COMPLETE
394,394,319.4454226,2021-05-05 12:44:59.199596,2021-05-05 13:08:04.374140,0 days 00:23:05.174544000,256,1000000,0.032451924927055606,0.22677897937192812,0.95,10000,0.0012803788699860912,small,1,1,4,COMPLETE
395,395,617.3066277999999,2021-05-05 12:45:47.744063,2021-05-05 13:08:06.688132,0 days 00:22:18.944069000,256,1000000,0.03277297450061897,0.22379225884397166,0.95,10000,0.003639655176898518,small,1,1,128,COMPLETE
396,396,-289.1087528,2021-05-05 12:53:52.554885,2021-05-05 12:57:38.613488,0 days 00:03:46.058603000,256,1000000,0.03241251510685654,0.25564908005701154,0.95,10000,0.0013373501697817906,small,1,15000,4,PRUNED
397,397,49.34175120000001,2021-05-05 12:57:38.637294,2021-05-05 13:02:48.868863,0 days 00:05:10.231569000,256,1000000,0.04033851005371923,0.26115670039337596,0.95,10000,0.0012289157847603619,small,1,1,4,PRUNED
398,398,12.507139599999999,2021-05-05 13:02:48.873746,2021-05-05 13:04:44.588918,0 days 00:01:55.715172000,256,1000000,0.03448160751946246,0.23041028371550581,0.95,10000,0.0011536061005120038,tiny,8,1,4,PRUNED
399,399,-58.886947,2021-05-05 13:04:44.592328,2021-05-05 13:08:38.785340,0 days 00:03:54.193012000,256,1000000,0.03149754598791121,0.24200347330341324,0.95,10000,0.0016766076409220245,small,2,1,4,PRUNED
400,400,-299.3354582,2021-05-05 13:08:04.386703,2021-05-05 13:11:47.179703,0 days 00:03:42.793000000,256,1000000,0.05063530940573622,0.24896134922565202,0.95,10000,0.001633387414559046,small,1,10000,4,PRUNED
401,401,120.6928064,2021-05-05 13:08:06.690639,2021-05-05 13:27:01.425975,0 days 00:18:54.735336000,256,1000000,0.027239255963680983,0.24999458797103585,0.95,10000,0.0017827229102125972,small,1,10000,4,COMPLETE
402,402,255.08417719999997,2021-05-05 13:08:38.786334,2021-05-05 13:33:02.063643,0 days 00:24:23.277309000,256,1000000,0.04267104193738814,0.2506557008780948,0.95,10000,0.0020735729321997645,small,1,1,4,COMPLETE
403,403,536.3765786,2021-05-05 13:11:47.181519,2021-05-05 13:35:37.423720,0 days 00:23:50.242201000,256,1000000,0.037949346612062895,0.2597937488700498,0.95,10000,0.0020815753496330755,small,1,1,4,COMPLETE
404,404,289.8881392,2021-05-05 13:27:01.452748,2021-05-05 13:45:34.090660,0 days 00:18:32.637912000,512,1000000,0.04284971855019093,0.2163605555231231,0.95,10000,0.002193506318351833,small,2,1,1000,COMPLETE
405,405,443.53541340000004,2021-05-05 13:33:02.070113,2021-05-05 13:51:07.420567,0 days 00:18:05.350454000,512,1000000,0.025753644929522687,0.26274267317558936,0.95,10000,0.0022081725074754818,small,2,1,1000,COMPLETE
406,406,66.7017202,2021-05-05 13:35:37.432366,2021-05-05 13:53:09.210398,0 days 00:17:31.778032000,512,1000000,0.05353267437974127,0.21463610390257526,0.95,10000,0.003727917347482123,small,2,1,1000,COMPLETE
407,407,1333.8516794000002,2021-05-05 13:45:34.093158,2021-05-05 14:03:41.406696,0 days 00:18:07.313538000,512,100000,0.05559049030913281,0.26851131661725824,0.95,5000,0.003642995612095331,small,2,1,1000,COMPLETE
408,408,-127.4321196,2021-05-05 13:51:07.430945,2021-05-05 14:09:10.272227,0 days 00:18:02.841282000,512,100000,0.03491447021931824,0.23613428588716587,0.95,5000,0.000990410827933759,small,2,1,1000,COMPLETE
