,number,value,datetime_start,datetime_complete,duration,params_batch_size,params_buffer_size,params_exploration_final_eps,params_exploration_fraction,params_gamma,params_learning_starts,params_lr,params_net_arch,params_subsample_steps,params_target_update_interval,params_train_freq,state
0,0,-178.7478976,2021-05-04 09:42:14.714521,2021-05-04 09:48:44.871928,0 days 00:06:30.157407000,32,1000000,0.15105600352333182,0.2464011362516333,0.9999,20000,0.0003890387888190584,tiny,2,1,128,COMPLETE
1,1,59.945844199999996,2021-05-04 09:42:14.715949,2021-05-04 09:51:26.058606,0 days 00:09:11.342657000,128,50000,0.17830840096106124,0.3528774910543685,0.9,20000,0.0008012552561197343,tiny,1,1,256,COMPLETE
2,2,-347.5667004,2021-05-04 09:42:14.718286,2021-05-04 09:48:06.860527,0 days 00:05:52.142241000,100,1000000,0.11098603937716572,0.45856892580937086,0.9,5000,2.5715238337862057e-05,small,4,15000,16,COMPLETE
3,3,-264.89268219999997,2021-05-04 09:48:06.866260,2021-05-04 09:57:58.396151,0 days 00:09:51.529891000,128,1000000,0.14720556669655122,0.4886929124511701,0.999,20000,0.04480567057545413,small,2,1000,1,COMPLETE
4,4,-189.9091742,2021-05-04 09:48:44.874026,2021-05-04 09:55:42.984460,0 days 00:06:58.110434000,64,100000,0.10736828136300913,0.1342583129759536,0.999,1000,0.003924837363127294,tiny,1,10000,1000,COMPLETE
5,5,-376.5365484,2021-05-04 09:51:26.066151,2021-05-04 10:16:42.195909,0 days 00:25:16.129758000,512,50000,0.1565255310016026,0.19599486891221268,0.99,1000,0.3506551907394858,medium,1,5000,1000,PRUNED
6,6,-13.429060799999997,2021-05-04 09:55:42.986967,2021-05-04 10:03:29.567369,0 days 00:07:46.580402000,128,10000,0.14454110882543156,0.33168126806800297,0.98,20000,0.01054785695635049,medium,8,1,128,COMPLETE
7,7,-237.30490440000003,2021-05-04 09:57:58.397775,2021-05-04 10:08:29.997745,0 days 00:10:31.599970000,512,10000,0.08140619105843845,0.24882151277293285,0.98,0,0.00014234465575515247,small,2,10000,256,COMPLETE
8,8,-24.399012999999975,2021-05-04 10:03:29.570011,2021-05-04 10:12:05.889391,0 days 00:08:36.319380000,64,1000000,0.11464245137416017,0.2993437431559662,0.98,5000,2.7211422864046558e-05,medium,2,5000,256,COMPLETE
9,9,-270.1895908,2021-05-04 10:08:30.000481,2021-05-04 10:14:43.788554,0 days 00:06:13.788073000,32,100000,0.12943200376336003,0.09091601597375171,0.9,1000,0.0005641251909920557,medium,8,15000,4,COMPLETE
10,10,-200.7829726,2021-05-04 10:12:05.890955,2021-05-04 10:14:29.640127,0 days 00:02:23.749172000,64,10000,0.06988468051641837,0.43058008365084977,0.99,10000,0.044162531730132876,tiny,4,5000,256,COMPLETE
11,11,-370.89294340000004,2021-05-04 10:14:29.644804,2021-05-04 10:20:19.712481,0 days 00:05:50.067677000,32,50000,0.0521467158167257,0.3247001059236852,0.995,5000,0.08464566396371924,small,2,15000,1000,COMPLETE
12,12,-382.2998748,2021-05-04 10:14:43.790915,2021-05-04 10:22:02.684283,0 days 00:07:18.893368000,16,50000,0.19309526399257185,0.37634410755411873,0.95,10000,0.35151199652552434,tiny,1,20000,8,COMPLETE
13,13,-255.01126720000002,2021-05-04 10:16:42.198108,2021-05-04 10:17:41.133752,0 days 00:00:58.935644000,128,50000,0.19714321714254812,0.3647393629225868,0.995,20000,0.005110596667578258,tiny,8,1,128,PRUNED
14,14,-202.23309079999999,2021-05-04 10:17:41.134931,2021-05-04 10:20:19.331530,0 days 00:02:38.196599000,128,10000,0.003707046861675986,0.3818465577344906,0.95,20000,0.023183626307325483,medium,1,1,8,PRUNED
15,15,-337.16205659999997,2021-05-04 10:20:19.332672,2021-05-04 10:20:46.464143,0 days 00:00:27.131471000,256,50000,0.19635735714573474,0.32820088783639284,0.98,20000,0.0012252129233678516,tiny,8,20000,128,PRUNED
16,16,237.56182799999996,2021-05-04 10:20:19.722058,2021-05-04 10:25:34.869647,0 days 00:05:15.147589000,256,10000,0.19633524988274567,0.40216754538189065,0.9,20000,0.0014825779859078962,medium,8,20000,128,COMPLETE
17,17,-364.01113640000005,2021-05-04 10:20:46.465619,2021-05-04 10:28:28.794325,0 days 00:07:42.328706000,16,10000,0.17879045079679906,0.0019674333105290376,0.9,20000,0.008558920694149453,medium,8,1,128,COMPLETE
18,18,60.39069059999999,2021-05-04 10:22:02.686031,2021-05-04 10:30:18.966165,0 days 00:08:16.280134000,128,10000,0.17408811015389267,0.0037843169664908693,0.9,0,0.00904290158928006,medium,8,1,128,COMPLETE
19,19,293.8140224,2021-05-04 10:25:34.872183,2021-05-04 10:47:30.758698,0 days 00:21:55.886515000,256,10000,0.17472431896782895,0.4307133266263729,0.9,0,9.604374727072878e-05,medium,1,20000,256,COMPLETE
20,20,106.4359626,2021-05-04 10:28:28.796223,2021-05-04 10:34:49.836831,0 days 00:06:21.040608000,256,50000,0.1693993062324331,0.4146776629955362,0.9,0,0.0001629044129809685,tiny,1,20000,256,COMPLETE
21,21,107.9377708,2021-05-04 10:30:18.967350,2021-05-04 10:34:52.233892,0 days 00:04:33.266542000,256,10000,0.17355311972035997,0.04646527918619549,0.9,0,0.00017330679989527157,medium,8,20000,16,COMPLETE
22,22,228.76291940000002,2021-05-04 10:34:49.839490,2021-05-04 10:42:05.607739,0 days 00:07:15.768249000,256,100000,0.03428542270633192,0.4994415827315489,0.9,0,0.00011803903071369618,medium,4,20000,16,COMPLETE
23,23,-263.6228716,2021-05-04 10:34:52.237181,2021-05-04 10:35:51.686537,0 days 00:00:59.449356000,256,10000,0.17518963236544596,0.42085756541324837,0.9,0,9.312971333334452e-05,medium,8,20000,16,PRUNED
24,24,11.581457399999982,2021-05-04 10:35:51.688577,2021-05-04 10:39:57.703388,0 days 00:04:06.014811000,256,10000,0.19972535207560585,0.4959971775903527,0.9,0,7.369256479090678e-05,medium,8,20000,16,COMPLETE
25,25,-307.10052939999997,2021-05-04 10:39:57.706786,2021-05-04 10:41:14.263507,0 days 00:01:16.556721000,256,10000,0.16297977945364583,0.07962121759369277,0.9,0,1.1225084225556766e-05,medium,8,20000,16,PRUNED
26,26,-262.4813286,2021-05-04 10:41:14.264631,2021-05-04 10:59:46.591439,0 days 00:18:32.326808000,256,100000,0.12332702191986632,0.19444764248788715,0.9999,0,0.0002803054754308808,medium,1,20000,4,COMPLETE
27,27,-80.35273600000001,2021-05-04 10:42:05.609970,2021-05-04 10:49:28.166557,0 days 00:07:22.556587000,256,100000,0.006788080677217246,0.4934543054610151,0.9999,0,0.001926889093345805,medium,4,20000,16,COMPLETE
28,28,-337.99134319999996,2021-05-04 10:47:30.760568,2021-05-04 10:49:15.284081,0 days 00:01:44.523513000,256,100000,0.018236890314256664,0.4993621730822592,0.9999,0,0.002120310553064089,medium,4,20000,4,PRUNED
29,29,-341.5130828,2021-05-04 10:49:15.285395,2021-05-04 10:51:53.321299,0 days 00:02:38.035904000,100,100000,0.03127385439032308,0.46757827639376237,0.9,10000,3.2542334627224985e-05,medium,4,1000,1,PRUNED
30,30,374.084713,2021-05-04 10:49:28.167960,2021-05-04 11:04:57.053606,0 days 00:15:28.885646000,100,100000,0.031688098265769266,0.4570466517944393,0.9,10000,4.731150713608725e-05,medium,4,1000,1,COMPLETE
31,31,94.3968076,2021-05-04 10:51:53.325027,2021-05-04 10:58:30.698951,0 days 00:06:37.373924000,256,100000,0.0373221475867461,0.2744480961307364,0.9,0,0.00028181171847807725,medium,4,20000,4,COMPLETE
32,32,-339.6622532,2021-05-04 10:58:30.700445,2021-05-04 11:08:39.258749,0 days 00:10:08.558304000,256,100000,0.08710449150078046,0.45451338212636333,0.995,0,0.0003259215644277514,medium,1,20000,256,PRUNED
33,33,-289.9389304,2021-05-04 10:59:46.593342,2021-05-04 11:03:48.595147,0 days 00:04:02.001805000,256,10000,0.08681375245812284,0.45193762037400304,0.9,0,1.3700479283694498e-05,medium,8,20000,16,COMPLETE
34,34,18.3764792,2021-05-04 11:03:48.598011,2021-05-04 11:09:41.983282,0 days 00:05:53.385271000,256,10000,0.1845759585699919,0.39911893574909535,0.9,0,5.729208537193136e-05,medium,4,20000,16,COMPLETE
35,35,341.7049934,2021-05-04 11:04:57.060105,2021-05-04 11:17:03.077490,0 days 00:12:06.017385000,100,100000,0.05709724052196617,0.40102321686749626,0.9,10000,5.1435567013917004e-05,medium,4,1000,1,COMPLETE
36,36,422.7664576,2021-05-04 11:08:39.260537,2021-05-04 11:21:13.806146,0 days 00:12:34.545609000,100,100000,0.059248530518565504,0.40436682862449036,0.9,10000,4.944174055567811e-05,medium,4,1000,1,COMPLETE
37,37,340.5594302,2021-05-04 11:09:41.992594,2021-05-04 11:24:27.613504,0 days 00:14:45.620910000,100,100000,0.05901152357468344,0.4390439856204248,0.999,10000,0.0008527572652298972,medium,4,1000,1,COMPLETE
38,38,-341.008761,2021-05-04 11:17:03.081603,2021-05-04 11:26:56.960082,0 days 00:09:53.878479000,100,1000000,0.07026262294514063,0.4381519660031529,0.999,10000,4.479964592446989e-05,small,4,1000,1,COMPLETE
39,39,-243.6106246,2021-05-04 11:21:13.811812,2021-05-04 11:31:19.291594,0 days 00:10:05.479782000,100,100000,0.05225217092476511,0.44832337082458834,0.999,10000,3.8253961788750226e-05,small,4,1000,1,COMPLETE
40,40,-131.0881506,2021-05-04 11:24:27.618062,2021-05-04 11:34:41.592046,0 days 00:10:13.973984000,100,100000,0.06199080174445041,0.4569845256500578,0.999,10000,1.8133108115614464e-05,small,4,1000,1,COMPLETE
41,41,-125.50546360000001,2021-05-04 11:26:56.962267,2021-05-04 11:37:19.813788,0 days 00:10:22.851521000,100,100000,0.05761732454685922,0.3504767758045998,0.999,10000,1.605885610864148e-05,small,4,1000,1,COMPLETE
42,42,-356.35291100000006,2021-05-04 11:31:19.301306,2021-05-04 11:44:58.599998,0 days 00:13:39.298692000,100,100000,0.051722413607726246,0.35107411091790525,0.999,10000,1.9167198480940706e-05,medium,4,1000,1,COMPLETE
43,43,-49.6953228,2021-05-04 11:34:41.599268,2021-05-04 11:49:33.140749,0 days 00:14:51.541481000,100,100000,0.045271135187259184,0.3572530782995863,0.999,10000,0.000538713874171048,medium,4,1000,1,COMPLETE
44,44,473.57618940000003,2021-05-04 11:37:19.817817,2021-05-04 11:51:23.324183,0 days 00:14:03.506366000,100,100000,0.041610104038397565,0.47409013815235046,0.99,10000,6.657549107624756e-05,medium,4,1000,1,COMPLETE
45,45,-293.9574226000001,2021-05-04 11:44:58.603415,2021-05-04 11:47:48.512234,0 days 00:02:49.908819000,100,100000,0.09870296457120013,0.3944742175035897,0.99,10000,0.0006304019040184892,medium,4,1000,1,PRUNED
46,46,332.76801579999994,2021-05-04 11:47:48.517678,2021-05-04 12:00:38.724829,0 days 00:12:50.207151000,100,100000,0.02020078175323793,0.4691849064136047,0.95,10000,6.972157857734198e-05,medium,4,1000,1,COMPLETE
47,47,408.8445206,2021-05-04 11:49:33.142505,2021-05-04 12:02:58.208991,0 days 00:13:25.066486000,100,100000,0.01687066495278447,0.4669399019210802,0.95,10000,8.340223934767857e-05,medium,4,10000,1,COMPLETE
48,48,-352.12297739999997,2021-05-04 11:51:23.327201,2021-05-04 11:54:07.188994,0 days 00:02:43.861793000,100,100000,0.02293399177268371,0.4780941990622006,0.99,10000,6.128108855352568e-05,medium,4,1000,1,PRUNED
49,49,-174.4709702,2021-05-04 11:54:07.191889,2021-05-04 11:57:01.480654,0 days 00:02:54.288765000,100,100000,0.07144213234130325,0.4743351799097034,0.99,10000,2.838319661512269e-05,medium,4,1000,1,PRUNED
50,50,-367.3013278,2021-05-04 11:57:01.482209,2021-05-04 12:16:15.914876,0 days 00:19:14.432667000,512,100000,0.01688716566940414,0.41075594863329845,0.99,10000,1.0593225601109291e-05,medium,2,10000,1,COMPLETE
51,51,229.7315634,2021-05-04 12:00:38.728581,2021-05-04 12:25:24.779068,0 days 00:24:46.050487000,512,1000000,0.04286079569535406,0.30676807069826006,0.99,1000,1.0429104029219702e-05,medium,2,10000,1,COMPLETE
52,52,-304.3764956,2021-05-04 12:02:58.211942,2021-05-04 12:15:38.823456,0 days 00:12:40.611514000,512,1000000,0.011422116704612914,0.29726023698985865,0.95,1000,0.00018185742359710155,medium,2,10000,1000,COMPLETE
53,53,198.5099068,2021-05-04 12:15:38.827345,2021-05-04 12:28:03.906974,0 days 00:12:25.079629000,100,100000,0.042194006669198376,0.4162224214233491,0.95,10000,4.018655303287953e-05,medium,4,10000,1,COMPLETE
54,54,25.604891199999997,2021-05-04 12:16:15.916691,2021-05-04 12:29:54.838217,0 days 00:13:38.921526000,100,100000,0.039377798703056376,0.37966963538320025,0.95,10000,0.0009314951654818794,medium,4,10000,1,COMPLETE
55,55,-382.2855012,2021-05-04 12:25:24.782584,2021-05-04 12:40:58.165619,0 days 00:15:33.383035000,100,100000,0.027430665491334605,0.3752344612107053,0.95,10000,0.8824933035730514,medium,4,1000,1,COMPLETE
56,56,-339.4869702,2021-05-04 12:28:03.910748,2021-05-04 12:42:45.899293,0 days 00:14:41.988545000,100,100000,0.027243069054598355,0.38424560593816987,0.95,5000,2.4330092529714687e-05,medium,4,1000,1,COMPLETE
57,57,111.54492059999998,2021-05-04 12:29:54.843333,2021-05-04 12:34:34.387794,0 days 00:04:39.544461000,32,100000,0.026848567477785946,0.4415192680406998,0.98,5000,0.0001938039353792174,medium,4,15000,8,COMPLETE
58,58,-252.439093,2021-05-04 12:34:34.390390,2021-05-04 12:35:48.498263,0 days 00:01:14.107873000,64,100000,0.0643940972566496,0.2034128089992527,0.995,10000,2.1723479509642173e-05,tiny,4,5000,1,PRUNED
59,59,-303.1441818,2021-05-04 12:35:48.499353,2021-05-04 12:38:21.965443,0 days 00:02:33.466090000,100,100000,0.07554473573535948,0.47694038033625963,0.95,10000,9.993322329414142e-05,medium,4,1000,1,PRUNED
60,60,-303.4630598,2021-05-04 12:38:21.966718,2021-05-04 12:41:19.411790,0 days 00:02:57.445072000,16,100000,0.04938625120328692,0.39170492133609086,0.99,10000,0.0004612085563135118,medium,4,1000,1,PRUNED
61,61,295.7531282,2021-05-04 12:40:58.183433,2021-05-04 12:56:04.287202,0 days 00:15:06.103769000,16,100000,0.05305513450723837,0.4352206761591574,0.9,10000,5.37471130586121e-05,medium,4,1000,1,COMPLETE
62,62,-319.794954,2021-05-04 12:41:19.414181,2021-05-04 12:47:44.018143,0 days 00:06:24.603962000,100,100000,0.001661651181251049,0.43488293465454814,0.9,10000,5.224846060186075e-05,medium,4,1000,1000,COMPLETE
63,63,368.04879539999996,2021-05-04 12:42:45.904388,2021-05-04 13:00:08.846999,0 days 00:17:22.942611000,100,100000,0.001065174190582649,0.42729608860564233,0.95,10000,7.599541512517823e-05,medium,4,1000,1,COMPLETE
64,64,300.6211254,2021-05-04 12:47:44.027099,2021-05-04 13:03:11.894102,0 days 00:15:27.867003000,100,100000,0.010151059398625033,0.465876453515894,0.95,10000,7.441077029699943e-05,medium,4,1000,1,COMPLETE
65,65,414.8867508,2021-05-04 12:56:04.292843,2021-05-04 13:11:06.617680,0 days 00:15:02.324837000,100,100000,0.011402545197881347,0.48650941493614885,0.95,10000,7.948686319250625e-05,medium,4,1000,1,COMPLETE
66,66,495.23507559999996,2021-05-04 13:00:08.851340,2021-05-04 13:15:25.160724,0 days 00:15:16.309384000,100,100000,0.06086259450133696,0.4201623783812272,0.95,10000,0.00012961358453517178,medium,4,1000,1,COMPLETE
67,67,369.0885568,2021-05-04 13:03:11.897558,2021-05-04 13:08:38.610780,0 days 00:05:26.713222000,100,50000,0.034336237769116526,0.42053551997800853,0.98,10000,0.0002319179343790914,medium,4,1000,8,COMPLETE
68,68,-191.7899814,2021-05-04 13:08:38.614501,2021-05-04 13:11:55.761676,0 days 00:03:17.147175000,100,50000,0.0006864115934930746,0.4864846626148729,0.98,10000,0.00013446162391910838,tiny,4,15000,8,COMPLETE
69,69,-242.77708360000003,2021-05-04 13:11:06.620777,2021-05-04 13:14:15.164582,0 days 00:03:08.543805000,100,50000,0.013819109333077905,0.4891757657122573,0.98,10000,0.00013474105040209584,tiny,4,15000,8,COMPLETE
70,70,-317.740887,2021-05-04 13:11:55.765355,2021-05-04 13:13:06.403923,0 days 00:01:10.638568000,32,50000,0.012675561812768054,0.4191901400640947,0.98,10000,0.00011829527451635845,medium,4,5000,8,PRUNED
71,71,201.32560320000002,2021-05-04 13:13:06.405196,2021-05-04 13:19:40.198286,0 days 00:06:33.793090000,128,50000,0.03305778696359943,0.4837285261219902,0.95,10000,0.00025117356337228127,medium,4,1000,8,COMPLETE
72,72,-369.5011986,2021-05-04 13:14:15.170724,2021-05-04 13:14:57.920294,0 days 00:00:42.749570000,128,50000,0.03102756873132273,0.45868076588321066,0.95,20000,0.00025557420192824653,medium,4,1000,8,PRUNED
73,73,-356.9816022,2021-05-04 13:14:57.921778,2021-05-04 13:17:56.751795,0 days 00:02:58.830017000,100,100000,0.032694722407785336,0.4078981652921892,0.95,10000,8.80315978619414e-05,medium,4,1000,1,PRUNED
74,74,-247.24028040000002,2021-05-04 13:15:25.163044,2021-05-04 13:29:43.324278,0 days 00:14:18.161234000,100,50000,0.03412759178517136,0.42490321484659793,0.95,10000,9.508538309399322e-05,medium,4,1000,1,COMPLETE
75,75,432.11323039999996,2021-05-04 13:17:56.754378,2021-05-04 13:32:28.244593,0 days 00:14:31.490215000,100,50000,0.005972044393421021,0.41927226315002264,0.95,10000,0.00023005755866789435,medium,4,1000,1,COMPLETE
76,76,-248.7090052,2021-05-04 13:19:40.202393,2021-05-04 13:35:46.773860,0 days 00:16:06.571467000,100,100000,0.00634843515489585,0.42592671480894995,0.95,10000,3.1905101756835e-05,medium,4,1,1,COMPLETE
77,77,-69.40962499999999,2021-05-04 13:29:43.326869,2021-05-04 13:38:39.909750,0 days 00:08:56.582881000,64,100000,0.02135086223435327,0.44990003385392074,0.95,10000,3.6453586703990056e-05,medium,4,1,128,COMPLETE
78,78,387.448812,2021-05-04 13:32:28.247957,2021-05-04 13:42:13.752196,0 days 00:09:45.504239000,64,50000,0.022427732786281997,0.4528957288937462,0.95,10000,0.0003967813330139924,medium,4,1,128,COMPLETE
79,79,-263.177801,2021-05-04 13:35:46.777602,2021-05-04 13:37:16.858547,0 days 00:01:30.080945000,64,50000,0.020373044018149395,0.4507900905813707,0.98,1000,0.0004202463733505505,medium,4,1000,128,PRUNED
80,80,420.35154759999995,2021-05-04 13:37:16.861229,2021-05-04 13:53:18.050674,0 days 00:16:01.189445000,100,50000,0.045348660169865,0.3626618274433942,0.9999,10000,0.00015735366100005346,medium,1,10000,4,COMPLETE
81,81,188.640308,2021-05-04 13:38:39.914421,2021-05-04 13:55:14.047227,0 days 00:16:34.132806000,100,50000,0.048063029029360924,0.46282493284401793,0.995,5000,0.00012978207260082157,medium,1,10000,4,COMPLETE
82,82,757.2683762,2021-05-04 13:42:13.755865,2021-05-04 14:01:53.876542,0 days 00:19:40.120677000,64,50000,0.007488165014642017,0.46598356875637115,0.95,5000,0.000353345296653587,medium,1,1,128,COMPLETE
83,83,288.28967819999997,2021-05-04 13:53:18.055807,2021-05-04 14:07:16.669767,0 days 00:13:58.613960000,64,50000,0.0447121690742263,0.3677164289457954,0.9999,10000,0.00013509915613734653,medium,1,10000,4,COMPLETE
84,84,-124.8435964,2021-05-04 13:55:14.051444,2021-05-04 14:13:51.102584,0 days 00:18:37.051140000,64,50000,0.04122200014907727,0.4995357933828573,0.9999,10000,0.00017686542059379713,medium,1,1,4,COMPLETE
85,85,-41.076939599999996,2021-05-04 14:01:53.881762,2021-05-04 14:09:53.233168,0 days 00:07:59.351406000,64,50000,0.0092595236711504,0.4952887295728693,0.9999,5000,0.0003596710922186349,medium,1,1,128,PRUNED
86,86,11.263124399999999,2021-05-04 14:07:16.672147,2021-05-04 14:24:49.673516,0 days 00:17:33.001369000,64,50000,0.008657494728296508,0.498411658374024,0.9999,5000,0.0007121393695564852,medium,1,1,128,COMPLETE
87,87,126.7082576,2021-05-04 14:09:53.235449,2021-05-04 14:28:20.765458,0 days 00:18:27.530009000,64,50000,0.015605618379086503,0.4737838208097775,0.9999,5000,0.00020189708039793886,medium,1,1,128,COMPLETE
88,88,324.358234,2021-05-04 14:13:51.105834,2021-05-04 14:34:07.836581,0 days 00:20:16.730747000,64,50000,0.07786085707594471,0.3386884172423123,0.95,5000,0.0003431179410386518,medium,1,1,128,COMPLETE
89,89,-116.47382499999999,2021-05-04 14:24:49.679912,2021-05-04 14:37:48.611056,0 days 00:12:58.931144000,64,50000,0.01573675998466601,0.40179510301914123,0.95,5000,0.003320612937433685,small,1,1,128,COMPLETE
90,90,7.437932799999999,2021-05-04 14:28:20.770453,2021-05-04 14:38:02.049155,0 days 00:09:41.278702000,64,50000,0.06511325822519426,0.39163299063673757,0.95,20000,0.00034324697144474036,small,1,10000,128,COMPLETE
91,91,142.98328120000002,2021-05-04 14:34:07.840369,2021-05-04 14:43:11.613336,0 days 00:09:03.772967000,100,50000,0.06633040571460708,0.40415579895283604,0.95,20000,0.0011133945501627855,small,1,10000,256,COMPLETE
92,92,-366.75466259999996,2021-05-04 14:37:48.612602,2021-05-04 14:39:23.956126,0 days 00:01:35.343524000,100,50000,0.06433511614326913,0.44883560752250834,0.95,20000,0.000969117133502618,medium,1,10000,256,PRUNED
93,93,-366.997249,2021-05-04 14:38:02.054261,2021-05-04 14:39:07.823954,0 days 00:01:05.769693000,100,50000,0.026640491736746902,0.44490040257393215,0.95,10000,6.555037172827262e-05,medium,4,10000,256,PRUNED
94,94,-352.12011920000003,2021-05-04 14:39:07.826994,2021-05-04 14:45:01.277393,0 days 00:05:53.450399000,100,1000000,0.02391071293412858,0.4614446978138098,0.95,10000,0.0011901539979536884,medium,4,10000,4,COMPLETE
95,95,-365.4754004,2021-05-04 14:39:23.958126,2021-05-04 14:45:35.753186,0 days 00:06:11.795060000,100,1000000,0.03782323503807986,0.46518297409882364,0.95,10000,4.501512253491841e-05,medium,4,5000,4,COMPLETE
96,96,167.379187,2021-05-04 14:43:11.615322,2021-05-04 14:49:28.712634,0 days 00:06:17.097312000,100,1000000,0.024398476859447977,0.46920439121168367,0.99,10000,4.492730108771688e-05,medium,4,1000,4,COMPLETE
97,97,600.2367372000001,2021-05-04 14:45:01.282641,2021-05-04 14:58:33.519155,0 days 00:13:32.236514000,100,100000,0.00507606204808512,0.23397981455961245,0.99,10000,9.658573731743001e-05,medium,2,1000,1,COMPLETE
98,98,122.8199828,2021-05-04 14:45:35.755811,2021-05-04 15:01:29.617674,0 days 00:15:53.861863000,100,100000,0.004580649432405171,0.48537015647163595,0.99,10000,0.00011375918179792518,medium,2,1000,1,COMPLETE
99,99,314.73959460000003,2021-05-04 14:49:28.716340,2021-05-04 15:02:45.847957,0 days 00:13:17.131617000,32,100000,0.004992245251985784,0.43657752317804205,0.9,10000,0.0001042503260704513,medium,4,1000,1,COMPLETE
100,100,332.23311040000004,2021-05-04 14:58:33.524242,2021-05-04 15:15:47.336411,0 days 00:17:13.812169000,100,100000,0.004656479508527253,0.2124938236460212,0.99,10000,0.0001014367405177946,medium,2,1,1,COMPLETE
101,101,-172.557552,2021-05-04 15:01:29.623384,2021-05-04 15:19:20.388694,0 days 00:17:50.765310000,16,100000,0.056580262271001304,0.2693070335614305,0.99,10000,0.00048069170164407904,medium,2,1,1,COMPLETE
