,number,value,datetime_start,datetime_complete,duration,params_batch_size,params_buffer_size,params_exploration_final_eps,params_exploration_fraction,params_gamma,params_learning_starts,params_lr,params_net_arch,params_subsample_steps,params_target_update_interval,params_train_freq,state
204,204,148.81908300000003,2021-05-04 22:18:16.206401,2021-05-04 22:35:47.073571,0 days 00:17:30.867170000,512,100000,0.005027180225669357,0.2884239876909292,0.95,0,0.004441184873313231,small,2,1,1000,COMPLETE
205,205,754.7075936000001,2021-05-04 22:32:34.656721,2021-05-04 22:49:38.041447,0 days 00:17:03.384726000,512,100000,0.004637182512039036,0.2813495266775686,0.95,0,0.003978093994957562,small,2,1,1000,COMPLETE
206,206,47.330186600000005,2021-05-04 22:34:22.326420,2021-05-04 22:51:05.653172,0 days 00:16:43.326752000,512,100000,0.005487735968417945,0.2433775018677608,0.95,0,0.004567109179399103,small,2,1,1000,COMPLETE
207,207,465.099668,2021-05-04 22:35:47.077365,2021-05-04 22:52:37.196593,0 days 00:16:50.119228000,512,100000,0.004794250262958365,0.24206842053532437,0.95,0,0.0030581613457998885,small,2,1,1000,COMPLETE
208,208,634.9825588,2021-05-04 22:49:38.043876,2021-05-04 23:07:05.229839,0 days 00:17:27.185963000,512,100000,0.004233791402625103,0.27114656730232084,0.95,0,0.0031151175681249383,small,2,1,1000,COMPLETE
209,209,577.409856,2021-05-04 22:51:05.660907,2021-05-04 23:07:47.653256,0 days 00:16:41.992349000,512,100000,0.009399883209391531,0.2697970337474535,0.95,0,0.0031151035840412352,small,2,1,1000,COMPLETE
210,210,417.564048,2021-05-04 22:52:37.201223,2021-05-04 23:10:39.089914,0 days 00:18:01.888691000,512,100000,0.010856195684162646,0.27094601465712875,0.95,0,0.006701679212201217,small,2,1,1000,COMPLETE
211,211,166.2962914,2021-05-04 23:07:05.234286,2021-05-04 23:22:28.436557,0 days 00:15:23.202271000,512,100000,7.2386219079657865e-06,0.3004462001723567,0.95,10000,0.0011638199372924682,small,2,1,1000,COMPLETE
212,212,-29.2212024,2021-05-04 23:07:47.657268,2021-05-04 23:22:47.198161,0 days 00:14:59.540893000,512,100000,0.00023734554509141108,0.2519497155677021,0.95,20000,0.0011084704784461085,small,2,1,1000,COMPLETE
213,213,1187.6037164,2021-05-04 23:10:39.102665,2021-05-04 23:26:37.267471,0 days 00:15:58.164806000,512,100000,0.0004453709064811819,0.2956646824372785,0.95,10000,0.0017340372993019356,small,2,1,1000,COMPLETE
214,214,898.8653357999999,2021-05-04 23:22:28.438950,2021-05-04 23:38:46.255566,0 days 00:16:17.816616000,512,100000,0.002938302920496567,0.25294732699094824,0.95,10000,0.0018650879591384957,small,2,1,1000,COMPLETE
215,215,819.4024844000002,2021-05-04 23:22:47.200809,2021-05-04 23:38:52.905693,0 days 00:16:05.704884000,512,100000,3.511517092647245e-05,0.2646709246293638,0.95,10000,0.0018186055870042467,small,2,1,1000,COMPLETE
216,216,683.7683408,2021-05-04 23:26:37.273259,2021-05-04 23:42:53.803712,0 days 00:16:16.530453000,512,100000,0.0001733217470263834,0.2946632194035122,0.95,10000,0.0019168700195612888,small,2,1,1000,COMPLETE
217,217,555.951626,2021-05-04 23:38:46.258155,2021-05-04 23:50:34.309571,0 days 00:11:48.051416000,512,100000,0.007832144967578258,0.31737795584105266,0.95,10000,0.001948643326884854,small,2,1,1000,COMPLETE
218,218,639.5055684,2021-05-04 23:38:52.907170,2021-05-04 23:51:03.882204,0 days 00:12:10.975034000,512,1000000,0.0082860668005128,0.2938668353382656,0.95,10000,0.0020899032499218637,small,2,1,1000,COMPLETE
219,219,778.9302418,2021-05-04 23:42:53.806667,2021-05-04 23:54:12.030202,0 days 00:11:18.223535000,512,100000,0.007989721348128828,0.31732969389906157,0.95,10000,0.001433090623449254,small,2,1,1000,COMPLETE
220,220,1102.1554184000001,2021-05-04 23:50:34.326816,2021-05-05 00:02:15.363557,0 days 00:11:41.036741000,512,1000000,0.004297058061275313,0.28035781950586725,0.95,10000,0.0013993195485482812,small,2,1,1000,COMPLETE
221,221,1013.0050911999999,2021-05-04 23:51:03.885649,2021-05-05 00:03:15.247143,0 days 00:12:11.361494000,512,100000,0.00409962433831599,0.28309202306682935,0.95,10000,0.0014209046585428567,small,2,1,1000,COMPLETE
222,222,783.5974834000001,2021-05-04 23:54:12.036933,2021-05-05 00:07:41.981737,0 days 00:13:29.944804000,512,100000,0.012896768710915682,0.2812123191350386,0.95,10000,0.0037756256974414036,small,2,1,1000,COMPLETE
223,223,383.5161208,2021-05-05 00:02:15.374630,2021-05-05 00:18:50.591718,0 days 00:16:35.217088000,512,1000000,0.0037629909839016033,0.28258006328399377,0.95,10000,0.0009352711377450126,small,2,1,1000,COMPLETE
224,224,936.0587985999998,2021-05-05 00:03:15.248831,2021-05-05 00:19:50.805960,0 days 00:16:35.557129000,512,1000000,0.0037116734024329905,0.2457803449866517,0.95,10000,0.0013032753520478208,small,2,1,1000,COMPLETE
225,225,731.6402132,2021-05-05 00:07:41.983608,2021-05-05 00:23:32.454752,0 days 00:15:50.471144000,512,1000000,0.003710903638755058,0.24761420247837496,0.95,10000,0.0013779658220877276,small,2,1,1000,COMPLETE
226,226,-116.49514000000002,2021-05-05 00:18:50.595215,2021-05-05 00:34:42.588467,0 days 00:15:51.993252000,512,1000000,0.0031610625665569065,0.25222445970704094,0.95,10000,0.001318833991453904,small,2,1,1000,COMPLETE
227,227,12.450200599999981,2021-05-05 00:19:50.815672,2021-05-05 00:36:11.302567,0 days 00:16:20.486895000,512,100000,0.0001692839377877304,0.24978040774677335,0.95,10000,0.001304579847718507,small,2,1,1000,COMPLETE
228,228,797.2855446000001,2021-05-05 00:23:32.467179,2021-05-05 00:40:15.830746,0 days 00:16:43.363567000,512,1000000,0.012847035299574951,0.23614828465374343,0.95,10000,0.0023244214870954136,small,2,1,1000,COMPLETE
229,229,727.7593870000001,2021-05-05 00:34:42.599633,2021-05-05 00:49:39.136987,0 days 00:14:56.537354000,512,1000000,5.655897766104182e-06,0.23156769892612616,0.95,10000,0.0024374272314646047,small,2,1,1000,COMPLETE
230,230,1110.4261437999999,2021-05-05 00:36:11.306310,2021-05-05 00:51:05.196928,0 days 00:14:53.890618000,512,1000000,0.01219393399614918,0.23298267017905605,0.95,10000,0.002569909916219476,small,2,1,1000,COMPLETE
231,231,437.0493818,2021-05-05 00:40:15.835676,2021-05-05 00:54:41.483375,0 days 00:14:25.647699000,512,1000000,0.010710381994112228,0.30813043651954886,0.95,10000,0.001010508868408461,small,2,1,1000,COMPLETE
232,232,1051.957968,2021-05-05 00:49:39.143318,2021-05-05 01:02:10.360409,0 days 00:12:31.217091000,512,1000000,0.009562216829795266,0.30635684887677084,0.95,10000,0.00098106071280365,small,2,1,1000,COMPLETE
233,233,580.6311102,2021-05-05 00:51:05.204119,2021-05-05 01:02:45.023153,0 days 00:11:39.819034000,512,1000000,0.010457256001246548,0.2758384603127789,0.95,10000,0.0028106815032422007,small,2,1,1000,COMPLETE
234,234,828.7021452000001,2021-05-05 00:54:41.486278,2021-05-05 01:06:46.760334,0 days 00:12:05.274056000,512,1000000,0.004263450997556965,0.27209253365952857,0.95,10000,0.0027836959233947006,small,2,1,1000,COMPLETE
235,235,258.39225360000006,2021-05-05 01:02:10.366900,2021-05-05 01:13:49.466659,0 days 00:11:39.099759000,512,1000000,0.003983261866412784,0.2694421407213008,0.95,10000,0.0020273923350465893,small,2,1,1000,COMPLETE
236,236,837.5814741999999,2021-05-05 01:02:45.027897,2021-05-05 01:14:07.346582,0 days 00:11:22.318685000,512,1000000,0.0039051880146399364,0.3042474172673091,0.95,10000,0.0018583139166073969,small,2,1,1000,COMPLETE
237,237,861.0342598,2021-05-05 01:06:46.762340,2021-05-05 01:18:25.630284,0 days 00:11:38.867944000,512,1000000,9.166426961922537e-06,0.2941084284992081,0.95,10000,0.0017669914832760933,small,2,1,1000,COMPLETE
238,238,970.1579003999999,2021-05-05 01:13:49.469382,2021-05-05 01:25:19.368722,0 days 00:11:29.899340000,512,1000000,0.0002844723910020559,0.30352984768616653,0.95,10000,0.0017809969920035541,small,2,1,1000,COMPLETE
239,239,515.873422,2021-05-05 01:14:07.348125,2021-05-05 01:25:06.005556,0 days 00:10:58.657431000,512,1000000,0.013378490335748007,0.2897106296818099,0.95,10000,0.0008816729367194749,small,2,1,1000,COMPLETE
240,240,336.09614619999996,2021-05-05 01:18:25.632648,2021-05-05 01:29:55.549548,0 days 00:11:29.916900000,512,1000000,0.013568497810139213,0.22443673357225338,0.95,10000,0.003469348568802866,small,2,1,1000,COMPLETE
241,241,1052.7133678000002,2021-05-05 01:25:06.008310,2021-05-05 01:36:44.203733,0 days 00:11:38.195423000,512,1000000,0.00770317004373028,0.24273199841918255,0.95,10000,0.003341902402380426,small,2,1,1000,COMPLETE
242,242,1275.6106054,2021-05-05 01:25:19.373983,2021-05-05 01:36:30.860651,0 days 00:11:11.486668000,512,1000000,4.1806778909116594e-05,0.24273836133703075,0.95,10000,0.0034485842149894353,small,2,1,1000,COMPLETE
243,243,725.415781,2021-05-05 01:29:55.551452,2021-05-05 01:41:17.340731,0 days 00:11:21.789279000,512,1000000,0.00016135101011805197,0.25688744471578734,0.95,10000,0.0015482379247151409,small,2,1,1000,COMPLETE
244,244,1011.6099113999999,2021-05-05 01:36:30.862409,2021-05-05 01:48:04.196636,0 days 00:11:33.334227000,512,1000000,0.0008046380132082226,0.24032726475481275,0.95,10000,0.0011609342630917526,small,2,1,1000,COMPLETE
245,245,186.75000640000002,2021-05-05 01:36:44.206331,2021-05-05 01:48:14.227582,0 days 00:11:30.021251000,512,1000000,0.008535247687563521,0.2424029231575214,0.95,10000,0.003749656727740974,small,2,1,1000,COMPLETE
246,246,814.2661513999999,2021-05-05 01:41:17.342593,2021-05-05 01:52:42.711330,0 days 00:11:25.368737000,512,1000000,0.00815726424210026,0.2417972391469005,0.95,10000,0.0036978977924154123,small,2,1,1000,COMPLETE
247,247,273.5647946,2021-05-05 01:48:04.199621,2021-05-05 01:59:27.044457,0 days 00:11:22.844836000,512,1000000,0.008568179695400342,0.23966094538280008,0.95,10000,0.0039032499474009716,small,2,1,1000,COMPLETE
248,248,970.8822597999999,2021-05-05 01:48:14.229165,2021-05-05 01:59:51.713098,0 days 00:11:37.483933000,512,1000000,0.0003895726234759405,0.3134913659042385,0.95,10000,0.002473275431653995,small,2,1,1000,COMPLETE
249,249,1294.4462834,2021-05-05 01:52:42.713619,2021-05-05 02:04:16.755381,0 days 00:11:34.041762000,512,1000000,0.0003093765157666656,0.30833277766760764,0.95,10000,0.00244705333303316,small,2,1,1000,COMPLETE
250,250,648.188437,2021-05-05 01:59:27.049289,2021-05-05 02:10:44.596619,0 days 00:11:17.547330000,512,1000000,0.00034991049189294645,0.22862779796212476,0.95,10000,0.002505481915923437,small,2,1,1000,COMPLETE
251,251,1075.2455318,2021-05-05 01:59:51.723770,2021-05-05 02:11:27.471769,0 days 00:11:35.747999000,512,1000000,0.0004392224283274505,0.22757948084400798,0.98,10000,0.0027993605912080867,small,2,1,1000,COMPLETE
252,252,10.000867400000004,2021-05-05 02:04:16.757201,2021-05-05 02:15:24.770154,0 days 00:11:08.012953000,512,1000000,3.968591493738261e-05,0.3171040024479891,0.98,10000,0.0010343224830881082,small,2,1,1000,COMPLETE
253,253,-170.564703,2021-05-05 02:10:44.598983,2021-05-05 02:21:58.569610,0 days 00:11:13.970627000,512,1000000,0.0001052332727549578,0.3132134669017189,0.98,10000,0.0009743559476405621,small,2,1,1000,COMPLETE
254,254,585.4268357999999,2021-05-05 02:11:27.473814,2021-05-05 02:22:49.896645,0 days 00:11:22.422831000,512,1000000,0.0050919659953226675,0.3118757621085237,0.98,10000,0.001001965700865644,small,2,1,1000,COMPLETE
255,255,253.4404708,2021-05-05 02:15:24.772420,2021-05-05 02:27:26.405080,0 days 00:12:01.632660000,512,1000000,0.0056480938301306524,0.3004893363681842,0.98,10000,0.0072851700596937,small,2,1,1000,COMPLETE
256,256,383.93788820000003,2021-05-05 02:21:58.573644,2021-05-05 02:33:53.583043,0 days 00:11:55.009399000,512,1000000,0.00620850667639072,0.32711838973919555,0.95,10000,0.005135126038865304,small,2,1,1000,COMPLETE
257,257,1190.3051828,2021-05-05 02:22:49.899084,2021-05-05 02:34:34.433337,0 days 00:11:44.534253000,512,1000000,0.012342834238471634,0.2163039465596605,0.98,10000,0.003324095721325313,small,2,1,1000,COMPLETE
258,258,1009.2954748,2021-05-05 02:27:26.409904,2021-05-05 02:39:15.456473,0 days 00:11:49.046569000,512,1000000,0.011144426829127772,0.21934887704147044,0.95,10000,0.004965216959769118,small,2,1,1000,COMPLETE
259,259,727.4088204,2021-05-05 02:33:53.586876,2021-05-05 02:45:55.942708,0 days 00:12:02.355832000,512,1000000,0.012249431823828108,0.301074475559541,0.95,10000,0.003123111546173057,small,2,1,1000,COMPLETE
260,260,128.29681079999997,2021-05-05 02:34:34.435154,2021-05-05 02:46:40.312533,0 days 00:12:05.877379000,512,1000000,0.01499233091948407,0.22037367370145777,0.98,10000,0.0031509868165064815,small,2,1,256,COMPLETE
261,261,-337.6873836,2021-05-05 02:39:15.458421,2021-05-05 02:41:14.553471,0 days 00:01:59.095050000,16,1000000,0.01402876309949174,0.2144467403983148,0.98,10000,0.004822494719779137,small,2,1,256,PRUNED
262,262,-278.41396619999995,2021-05-05 02:41:14.563712,2021-05-05 02:50:15.096531,0 days 00:09:00.532819000,32,1000000,0.019019672778288935,0.22067855614663434,0.98,10000,0.003045108482659749,small,2,1,1000,COMPLETE
263,263,-300.21255120000006,2021-05-05 02:45:55.954186,2021-05-05 02:46:37.837030,0 days 00:00:41.882844000,32,1000000,0.010596499329155674,0.22120010255007724,0.98,20000,0.0031940084248697487,small,2,20000,1000,PRUNED
264,264,9.924184799999997,2021-05-05 02:46:37.837951,2021-05-05 02:58:29.766736,0 days 00:11:51.928785000,512,1000000,0.018552474678309092,0.20944836354015595,0.98,10000,0.0045643438067655626,small,2,1,1000,COMPLETE
265,265,561.3658788,2021-05-05 02:46:40.313826,2021-05-05 02:56:46.269693,0 days 00:10:05.955867000,256,1000000,0.0184609519710148,0.19601224170070217,0.98,10000,0.008194515810103109,small,2,1,1000,COMPLETE
266,266,408.30436280000004,2021-05-05 02:50:15.099789,2021-05-05 03:01:56.706971,0 days 00:11:41.607182000,512,1000000,0.017861620631491517,0.2091550958289607,0.995,10000,0.0044030461534707846,small,2,1,1000,COMPLETE
267,267,1103.6394398,2021-05-05 02:56:46.271477,2021-05-05 03:08:18.648618,0 days 00:11:32.377141000,512,1000000,0.00924768034220307,0.20242960316186648,0.95,10000,0.004546792284113201,small,2,1,1000,COMPLETE
268,268,783.0298138,2021-05-05 02:58:29.770640,2021-05-05 03:09:59.733537,0 days 00:11:29.962897000,512,1000000,0.00999297493165595,0.2880947416763939,0.95,10000,0.0013798600634269912,small,2,1,1000,COMPLETE
269,269,540.8135936000001,2021-05-05 03:01:56.709384,2021-05-05 03:13:29.810802,0 days 00:11:33.101418000,512,1000000,0.010004608192393096,0.22980070409705283,0.95,10000,0.001520964381210378,small,2,1,1000,COMPLETE
270,270,158.9169584,2021-05-05 03:08:18.655029,2021-05-05 03:20:15.854983,0 days 00:11:57.199954000,512,1000000,0.011745228410979051,0.20066162741860927,0.95,10000,0.005797044803910515,small,2,1,1000,COMPLETE
271,271,525.3189466,2021-05-05 03:09:59.735520,2021-05-05 03:21:31.339881,0 days 00:11:31.604361000,512,1000000,0.011393972445926335,0.19966344389290236,0.95,10000,0.0037767646286895884,small,2,1,1000,COMPLETE
272,272,859.8058912,2021-05-05 03:13:29.813157,2021-05-05 03:24:58.393506,0 days 00:11:28.580349000,512,1000000,0.012809187124935301,0.19580642963948566,0.95,10000,0.005555996122020196,small,2,1,1000,COMPLETE
273,273,-40.56462959999998,2021-05-05 03:20:15.866228,2021-05-05 03:29:33.253890,0 days 00:09:17.387662000,512,1000000,0.007985534198095648,0.18974064590644285,0.95,10000,0.0020913332542216094,small,2,15000,1000,COMPLETE
274,274,322.46626719999995,2021-05-05 03:21:31.342551,2021-05-05 03:32:31.435829,0 days 00:11:00.093278000,512,1000000,0.006769368863401976,0.1896071663246105,0.999,10000,0.010766253973701111,small,2,1,16,COMPLETE
275,275,841.9811348000001,2021-05-05 03:24:58.397518,2021-05-05 03:36:48.100874,0 days 00:11:49.703356000,512,1000000,0.006966586395232047,0.2282422434731173,0.999,10000,0.0008425324604236147,small,2,1,1000,COMPLETE
276,276,1243.642597,2021-05-05 03:29:33.258176,2021-05-05 03:41:33.897668,0 days 00:12:00.639492000,512,1000000,0.006445054783542221,0.23261105684144678,0.95,10000,0.0012737844087318615,small,2,1,1000,COMPLETE
277,277,14.984818600000017,2021-05-05 03:32:31.437547,2021-05-05 03:45:06.867379,0 days 00:12:35.429832000,512,10000,0.004412340414871183,0.22850386491861746,0.95,10000,0.0007193806273275473,small,2,1,1000,COMPLETE
278,278,439.3008218,2021-05-05 03:36:48.102728,2021-05-05 03:53:21.865634,0 days 00:16:33.762906000,512,1000000,0.015196810729314659,0.23621816719598923,0.95,10000,0.0012210934451484807,small,2,1,8,COMPLETE
279,279,520.6423941999999,2021-05-05 03:41:33.904696,2021-05-05 04:00:03.382758,0 days 00:18:29.478062000,512,1000000,0.015481708780978425,0.2333309790528839,0.95,10000,0.0012572338589390906,small,2,1,8,COMPLETE
280,280,369.07986320000003,2021-05-05 03:45:06.874959,2021-05-05 04:02:56.565359,0 days 00:17:49.690400000,512,1000000,0.01403962803953238,0.23542425397609604,0.95,10000,0.0011756795555187501,small,2,1,1000,COMPLETE
281,281,588.7704754,2021-05-05 03:53:21.874390,2021-05-05 04:10:13.317390,0 days 00:16:51.443000000,512,1000000,0.016070277721575744,0.28016673553183596,0.95,10000,0.0011859487546327448,small,2,1,1000,COMPLETE
282,282,107.5514072,2021-05-05 04:00:03.384831,2021-05-05 04:17:06.704105,0 days 00:17:03.319274000,512,1000000,0.0044048854064682435,0.2832884125651753,0.95,10000,0.0015630637511160428,small,2,1,1000,COMPLETE
283,283,74.0368702,2021-05-05 04:02:56.574768,2021-05-05 04:11:55.882258,0 days 00:08:59.307490000,512,1000000,0.008006082077637285,0.2837497140679507,0.95,10000,0.001591998794570188,small,8,1,1000,COMPLETE
284,284,-291.353784,2021-05-05 04:10:13.326584,2021-05-05 04:12:22.665199,0 days 00:02:09.338615000,512,1000000,0.00441532618449632,0.2127510797270754,0.95,10000,0.001629648397797454,small,8,1,1000,PRUNED
285,285,980.8421548,2021-05-05 04:11:55.885029,2021-05-05 04:27:31.028629,0 days 00:15:35.143600000,512,1000000,0.005719282304779249,0.21014429814529273,0.95,10000,0.0020792982836026473,small,2,1,1000,COMPLETE
286,286,87.3632854,2021-05-05 04:12:22.666386,2021-05-05 04:28:56.367437,0 days 00:16:33.701051000,512,1000000,0.004307961650153956,0.2707035204530137,0.95,10000,0.0022296533037974393,small,2,1,1000,COMPLETE
287,287,-387.3934154,2021-05-05 04:17:06.709529,2021-05-05 04:27:05.207068,0 days 00:09:58.497539000,16,1000000,0.00929907294249071,0.26917473547314863,0.95,10000,0.01061386004106046,small,2,1,1000,COMPLETE
288,288,131.574996,2021-05-05 04:27:05.209217,2021-05-05 04:43:30.637188,0 days 00:16:25.427971000,512,1000000,0.0036932513167734294,0.2473534687107727,0.95,10000,0.002104513974391632,small,2,1,1000,COMPLETE
289,289,994.434015,2021-05-05 04:27:31.030680,2021-05-05 04:44:29.982124,0 days 00:16:58.951444000,512,1000000,0.022654463911785445,0.2444368708090186,0.95,10000,0.0008002977352543712,small,2,1,1000,COMPLETE
290,290,582.6154268,2021-05-05 04:28:56.378684,2021-05-05 04:46:02.752081,0 days 00:17:06.373397000,512,1000000,0.010204113466290552,0.2453853908968679,0.95,10000,0.00371371720903606,small,2,1,1000,COMPLETE
291,291,354.4650318,2021-05-05 04:43:30.646077,2021-05-05 05:00:26.351087,0 days 00:16:55.705010000,512,1000000,0.021518061904310624,0.2957336154363334,0.95,10000,0.003796739751875124,small,2,1,1000,COMPLETE
292,292,-340.9350742,2021-05-05 04:44:29.990545,2021-05-05 04:54:41.222648,0 days 00:10:11.232103000,512,1000000,0.010244959422110102,0.29385264013999907,0.95,20000,0.003286897638401084,small,2,5000,1000,PRUNED
293,293,-271.307371,2021-05-05 04:46:02.757078,2021-05-05 04:47:12.937628,0 days 00:01:10.180550000,512,1000000,0.008486969123881971,0.1833712347693552,0.95,20000,0.0026000575596767444,small,2,5000,1000,PRUNED
294,294,1125.5144496,2021-05-05 04:47:12.940278,2021-05-05 05:00:11.104077,0 days 00:12:58.163799000,256,1000000,0.01260585533827161,0.293449998442524,0.98,10000,0.0029692785603695026,small,2,1,1000,COMPLETE
295,295,583.7415734,2021-05-05 04:54:41.224042,2021-05-05 05:08:09.477878,0 days 00:13:28.253836000,256,1000000,0.0001805638315459879,0.2158497411166832,0.98,10000,0.004398964889554827,small,2,1,1000,COMPLETE
296,296,-387.17445719999995,2021-05-05 05:00:11.115702,2021-05-05 05:03:38.284658,0 days 00:03:27.168956000,512,1000000,1.704598472613704e-05,0.29596558408234513,0.98,10000,0.2526876948611055,small,2,1,1000,PRUNED
297,297,-219.47933519999998,2021-05-05 05:00:26.354832,2021-05-05 05:10:16.787599,0 days 00:09:50.432767000,256,10000,0.002810025968113728,0.2668415845420801,0.98,10000,0.0018868363263195287,small,2,20000,1000,COMPLETE
298,298,-324.830754,2021-05-05 05:03:38.287748,2021-05-05 05:13:14.320109,0 days 00:09:36.032361000,256,10000,4.52712081726859e-05,0.26672926804824726,0.98,10000,0.0018318843847602855,small,2,20000,1000,COMPLETE
299,299,1106.5910414,2021-05-05 05:08:09.483125,2021-05-05 05:24:51.891865,0 days 00:16:42.408740000,512,10000,0.0035412328404345354,0.27532531201674065,0.98,10000,0.0017691529912947973,small,2,1,1000,COMPLETE
300,300,-57.7843452,2021-05-05 05:10:16.793837,2021-05-05 05:23:27.626014,0 days 00:13:10.832177000,256,1000000,0.006792610524899043,0.1652715799394878,0.98,10000,0.002781368709834763,small,2,1,1000,COMPLETE
301,301,367.3951868,2021-05-05 05:13:14.322345,2021-05-05 05:26:33.977054,0 days 00:13:19.654709000,256,1000000,0.007744470927215262,0.27813226811150144,0.98,10000,0.0027564652933410685,small,2,1,1000,COMPLETE
302,302,801.9326934000001,2021-05-05 05:23:27.628289,2021-05-05 05:36:45.391350,0 days 00:13:17.763061000,256,1000000,0.013203088680681539,0.2815111412251233,0.995,10000,0.0009782857478438645,small,2,1,1000,COMPLETE
303,303,43.110026399999995,2021-05-05 05:24:51.898032,2021-05-05 05:38:19.027240,0 days 00:13:27.129208000,256,10000,0.014646868526503902,0.2802881407112493,0.98,10000,0.0024551555224322425,small,2,1,1000,COMPLETE
304,304,255.83380079999998,2021-05-05 05:26:33.985382,2021-05-05 05:44:43.938546,0 days 00:18:09.953164000,512,10000,0.01571299363917301,0.2848874660568632,0.98,10000,0.0022098655866602864,small,2,1,1000,COMPLETE
305,305,-137.2417696,2021-05-05 05:36:45.399918,2021-05-05 05:55:32.373045,0 days 00:18:46.973127000,512,10000,0.004154069030594564,0.291442219701523,0.98,10000,0.002249094665609997,small,2,1,16,COMPLETE
