,number,value,datetime_start,datetime_complete,duration,params_batch_size,params_buffer_size,params_exploration_final_eps,params_exploration_fraction,params_gamma,params_learning_starts,params_lr,params_net_arch,params_subsample_steps,params_target_update_interval,params_train_freq,state
409,409,1004.4619096,2021-05-05 13:53:09.213573,2021-05-05 14:10:10.129698,0 days 00:17:00.916125000,512,100000,0.03664740691697541,0.23537562482315275,0.95,5000,0.0014388832898309981,small,2,1,1000,COMPLETE
410,410,639.2796930000001,2021-05-05 14:03:41.413392,2021-05-05 14:22:30.628237,0 days 00:18:49.214845000,512,100000,0.02338338576882687,0.2726336230786994,0.95,5000,0.005209720150762023,small,2,1,1000,COMPLETE
411,411,397.5974556,2021-05-05 14:09:10.278931,2021-05-05 14:27:53.890688,0 days 00:18:43.611757000,512,100000,0.048096028781465384,0.27258904575114473,0.95,5000,0.005375766308015832,small,2,1,1000,COMPLETE
412,412,800.6478674000001,2021-05-05 14:10:10.131208,2021-05-05 14:28:22.517776,0 days 00:18:12.386568000,512,100000,0.023086362174017234,0.2744900708579106,0.95,5000,0.005049427109187468,small,2,1,1000,COMPLETE
413,413,782.1887734,2021-05-05 14:22:30.630512,2021-05-05 14:40:59.511096,0 days 00:18:28.880584000,512,100000,0.02853764121020078,0.2887525744158811,0.95,5000,0.004310902393899485,small,2,1,256,COMPLETE
414,414,1335.9555978,2021-05-05 14:27:53.898972,2021-05-05 14:44:40.732261,0 days 00:16:46.833289000,512,100000,0.054722243160897244,0.286969585949953,0.95,10000,0.004103046115145042,small,2,1,1000,COMPLETE
415,415,1113.2862289999998,2021-05-05 14:28:22.521181,2021-05-05 14:45:43.991121,0 days 00:17:21.469940000,512,100000,0.061654707693765826,0.2848745745372408,0.95,5000,0.0031995494081321608,small,2,1,256,COMPLETE
416,416,-77.8131784,2021-05-05 14:40:59.518801,2021-05-05 14:49:02.784820,0 days 00:08:03.266019000,128,100000,0.026798404627055447,0.24193993965627494,0.95,1000,0.003231444025447475,small,2,5000,1000,COMPLETE
417,417,-228.21571699999998,2021-05-05 14:44:40.736923,2021-05-05 14:47:12.360218,0 days 00:02:31.623295000,512,100000,0.05904616424661425,0.2537145929692086,0.95,5000,0.0036642005017114287,small,2,5000,1000,PRUNED
418,418,-379.7470228,2021-05-05 14:45:43.998358,2021-05-05 14:56:45.018374,0 days 00:11:01.020016000,512,100000,0.05661405089800489,0.24210525682537243,0.95,1000,0.007723511878035039,small,2,20000,1000,COMPLETE
419,419,318.94116080000003,2021-05-05 14:47:12.362654,2021-05-05 15:00:52.411835,0 days 00:13:40.049181000,512,100000,0.06909449523881653,0.24199031956185718,0.95,1000,0.004016710168884007,small,2,1,1000,COMPLETE
420,420,54.3333296,2021-05-05 14:49:02.790840,2021-05-05 14:51:05.342174,0 days 00:02:02.551334000,512,100000,0.0618085839240851,0.26517025414794465,0.95,10000,0.007534225476862023,small,2,20000,1000,PRUNED
421,421,-14.308502400000004,2021-05-05 14:51:05.343700,2021-05-05 15:02:59.179457,0 days 00:11:53.835757000,512,100000,0.05465970911534927,0.23181278792722154,0.95,20000,0.004297133178134117,small,2,1,1000,COMPLETE
422,422,871.8877260000002,2021-05-05 14:56:45.021464,2021-05-05 15:08:45.264417,0 days 00:12:00.242953000,512,100000,0.05344326622012523,0.22254892333030427,0.95,20000,0.0011096156518657619,small,2,1,1000,COMPLETE
423,423,677.9094672000001,2021-05-05 15:00:52.413887,2021-05-05 15:21:57.119769,0 days 00:21:04.705882000,512,100000,0.053960738909918295,0.23172322829226236,0.95,10000,0.0011302673401589929,small,1,1,1000,COMPLETE
424,424,246.388881,2021-05-05 15:02:59.183517,2021-05-05 15:23:33.682054,0 days 00:20:34.498537000,512,100000,0.050144951559728916,0.2546686507400634,0.95,10000,0.0011076889811147395,small,1,1,1000,COMPLETE
425,425,37.389165200000015,2021-05-05 15:08:45.269750,2021-05-05 15:10:00.588981,0 days 00:01:15.319231000,512,100000,0.06564696968949539,0.25788699132063303,0.9999,10000,0.0014785343037857616,tiny,8,1,1000,PRUNED
426,426,55.8774766,2021-05-05 15:10:00.591015,2021-05-05 15:34:33.584267,0 days 00:24:32.993252000,512,100000,0.04831514116436694,0.2781199606502807,0.95,0,0.006077260900386089,small,1,1,4,COMPLETE
427,427,112.1835904,2021-05-05 15:21:57.134424,2021-05-05 15:38:15.162531,0 days 00:16:18.028107000,512,100000,0.04932837525552644,0.25350050735295043,0.95,0,0.0025741352851382016,small,2,1,4,COMPLETE
428,428,-6.385722399999997,2021-05-05 15:23:33.687699,2021-05-05 15:28:36.209900,0 days 00:05:02.522201000,512,100000,0.04676752729003652,0.27214056118743174,0.95,0,0.005912374646380547,small,2,1,4,PRUNED
429,429,674.9384216,2021-05-05 15:28:36.211861,2021-05-05 15:36:27.703902,0 days 00:07:51.492041000,32,100000,0.04571398570221344,0.28095655614475584,0.95,10000,0.0028081733779653285,small,2,1,8,COMPLETE
430,430,49.1861914,2021-05-05 15:34:33.589116,2021-05-05 15:51:28.680995,0 days 00:16:55.091879000,512,100000,0.03034312452375708,0.28274910745332954,0.95,10000,0.002865305759703323,small,2,1,128,COMPLETE
431,431,168.64927400000002,2021-05-05 15:36:27.715038,2021-05-05 15:38:40.175537,0 days 00:02:12.460499000,512,100000,0.02948001003699987,0.31361298425148715,0.95,10000,0.002482574664671009,small,2,15000,128,PRUNED
432,432,-384.19905780000005,2021-05-05 15:38:15.168346,2021-05-05 15:51:38.397933,0 days 00:13:23.229587000,512,100000,0.05762995510484798,0.30018317401814437,0.95,10000,0.0016080950900793812,small,2,15000,128,COMPLETE
433,433,553.1042232,2021-05-05 15:38:40.178872,2021-05-05 15:55:09.779127,0 days 00:16:29.600255000,512,100000,0.040430952910703664,0.3012864483390971,0.95,10000,0.0015771164511945797,small,2,1,1000,COMPLETE
434,434,54.463226,2021-05-05 15:51:28.688141,2021-05-05 15:53:54.223905,0 days 00:02:25.535764000,16,100000,0.02238382668179047,0.21152658138530678,0.95,10000,0.0015709790417375654,small,2,1,1000,PRUNED
435,435,-163.2925922,2021-05-05 15:51:38.399607,2021-05-05 16:01:36.734464,0 days 00:09:58.334857000,16,100000,0.09248531424424863,0.2648278573463306,0.995,10000,0.0008431072177036856,small,2,1,1000,COMPLETE
436,436,145.87875679999996,2021-05-05 15:53:54.226312,2021-05-05 15:58:19.352768,0 days 00:04:25.126456000,512,100000,0.025965884050436025,0.26495411673384917,0.999,5000,0.0035972810761251395,small,2,1,16,PRUNED
437,437,32.41157220000001,2021-05-05 15:55:09.782060,2021-05-05 16:11:50.687647,0 days 00:16:40.905587000,512,100000,0.02292454609394638,0.2624821177452873,0.995,5000,0.0008666249835879161,small,2,1,1000,COMPLETE
438,438,1052.4676878,2021-05-05 15:58:19.354767,2021-05-05 16:14:35.517957,0 days 00:16:16.163190000,512,100000,0.04268152086103489,0.2480819530811876,0.995,10000,0.0022220387720233653,small,2,1,1000,COMPLETE
439,439,449.8234198,2021-05-05 16:01:36.741405,2021-05-05 16:18:48.205795,0 days 00:17:11.464390000,512,100000,0.019243414381172087,0.24878833766118766,0.95,10000,0.0019825847525660125,small,2,1,1000,COMPLETE
440,440,48.53014899999997,2021-05-05 16:11:50.690983,2021-05-05 16:28:49.527656,0 days 00:16:58.836673000,512,1000000,0.0427195166204196,0.2467038443809464,0.95,10000,0.002238384868087803,small,2,1,1000,COMPLETE
441,441,274.5941428,2021-05-05 16:14:35.530679,2021-05-05 16:31:18.949277,0 days 00:16:43.418598000,512,1000000,0.039590039111973695,0.2224009924808023,0.95,10000,0.003210449826887008,small,2,1,1000,COMPLETE
442,442,1068.5433890000002,2021-05-05 16:18:48.217704,2021-05-05 16:35:30.021537,0 days 00:16:41.803833000,512,1000000,0.07741069155210528,0.22569894696054368,0.95,10000,0.003333589129721676,small,2,1,1000,COMPLETE
443,443,1252.6131544,2021-05-05 16:28:49.535535,2021-05-05 16:44:27.583889,0 days 00:15:38.048354000,512,1000000,0.029317346468149704,0.22801834804952295,0.95,10000,0.0033248521602923914,small,2,1,1000,COMPLETE
444,444,-38.854230000000015,2021-05-05 16:31:18.951426,2021-05-05 16:46:43.082899,0 days 00:15:24.131473000,512,1000000,0.03516448352816663,0.2339574165125806,0.95,10000,0.0013307048570305783,small,2,1,1000,COMPLETE
445,445,182.66094360000002,2021-05-05 16:35:30.042463,2021-05-05 16:51:09.034969,0 days 00:15:38.992506000,512,100000,0.03044064118515067,0.23276780233722563,0.95,10000,0.0013543414636867479,small,2,1,1000,COMPLETE
446,446,575.1198598,2021-05-05 16:44:27.592578,2021-05-05 17:01:02.929703,0 days 00:16:35.337125000,512,100000,0.033427967898028856,0.21051747805010557,0.95,10000,0.005027251670934038,small,2,1,1000,COMPLETE
447,447,1096.7479966,2021-05-05 16:46:43.092497,2021-05-05 17:02:47.216179,0 days 00:16:04.123682000,512,100000,0.031162744528653495,0.2871709606940877,0.95,10000,0.004423119314611708,small,2,1,1000,COMPLETE
448,448,163.2547826,2021-05-05 16:51:09.043767,2021-05-05 17:07:25.865390,0 days 00:16:16.821623000,512,100000,0.03690935087122239,0.2088177815043427,0.99,10000,0.0043365119007569095,small,2,1,1000,COMPLETE
449,449,57.1882832,2021-05-05 17:01:02.934326,2021-05-05 17:17:49.033237,0 days 00:16:46.098911000,512,1000000,0.02651408600802904,0.29125062276181113,0.99,10000,0.003924159858434846,small,2,1,1000,COMPLETE
450,450,254.3851116,2021-05-05 17:02:47.220958,2021-05-05 17:18:35.005899,0 days 00:15:47.784941000,512,1000000,0.027358556674722565,0.27350428029104146,0.99,10000,0.003976732768435894,small,2,1,1000,COMPLETE
451,451,39.150745400000005,2021-05-05 17:07:25.867901,2021-05-05 17:21:05.199185,0 days 00:13:39.331284000,128,1000000,0.028006760881835367,0.26939522737129834,0.95,10000,0.0029011657827108933,small,2,1,4,COMPLETE
452,452,-201.68865060000002,2021-05-05 17:17:49.035557,2021-05-05 17:28:51.590958,0 days 00:11:02.555401000,512,1000000,0.03942519644236501,0.27525993534690774,0.95,10000,0.002718487150315178,tiny,2,1,4,COMPLETE
453,453,1084.3795237999998,2021-05-05 17:18:35.010416,2021-05-05 17:32:54.984624,0 days 00:14:19.974208000,128,1000000,0.0391452150337461,0.25596674747545783,0.95,10000,0.0029048714926087254,small,2,1,4,COMPLETE
454,454,739.1579356,2021-05-05 17:21:05.200917,2021-05-05 17:38:26.751719,0 days 00:17:21.550802000,512,100000,0.037766966020319065,0.24037011701068203,0.95,10000,0.002808231190479159,small,2,1,1000,COMPLETE
455,455,-157.54546679999999,2021-05-05 17:28:51.593274,2021-05-05 17:31:15.754233,0 days 00:02:24.160959000,512,100000,0.034023345893342175,0.257331797703344,0.95,10000,0.0023548637077790814,small,8,1,1000,PRUNED
456,456,1324.4730338000002,2021-05-05 17:31:15.756396,2021-05-05 17:47:11.435150,0 days 00:15:55.678754000,512,100000,0.03637355259808532,0.24160794868609226,0.95,10000,0.003331419649477894,small,2,1,1000,COMPLETE
457,457,510.99107920000006,2021-05-05 17:32:54.998511,2021-05-05 17:49:02.940452,0 days 00:16:07.941941000,512,100000,0.05183233511267106,0.24616988896765274,0.95,10000,0.001784934002164848,small,2,1,1000,COMPLETE
458,458,253.5443232,2021-05-05 17:38:26.753559,2021-05-05 17:54:07.962822,0 days 00:15:41.209263000,512,100000,0.03184317583559671,0.24132561487994914,0.95,10000,0.0018777801106531456,small,2,1,1000,COMPLETE
459,459,-93.6488614,2021-05-05 17:47:11.444278,2021-05-05 17:58:47.446644,0 days 00:11:36.002366000,64,1000000,0.03279718320716116,0.22132158417731945,0.9999,10000,0.005446991081071375,small,2,1,1000,COMPLETE
460,460,-246.7412784,2021-05-05 17:49:02.942840,2021-05-05 17:59:54.086400,0 days 00:10:51.143560000,32,1000000,0.03394491162067531,0.21850245075605162,0.95,10000,0.005552716642849554,small,2,1,1000,COMPLETE
461,461,-356.55760399999997,2021-05-05 17:54:07.972712,2021-05-05 17:55:30.078964,0 days 00:01:22.106252000,32,1000000,0.03519782415359871,0.2203406671367352,0.95,10000,0.005313861027130849,small,2,10000,1000,PRUNED
462,462,-4.489424599999995,2021-05-05 17:55:30.081466,2021-05-05 18:07:48.251483,0 days 00:12:18.170017000,64,1000000,0.037911652179928576,0.22000041036552415,0.9999,10000,0.003601936805199456,small,2,1,1000,COMPLETE
463,463,726.255889,2021-05-05 17:58:47.452665,2021-05-05 18:15:02.044318,0 days 00:16:14.591653000,512,1000000,0.042554989631952346,0.2356648875884987,0.95,10000,0.004038442861839319,small,2,1,1000,COMPLETE
464,464,56.128269599999996,2021-05-05 17:59:54.088632,2021-05-05 18:03:49.911277,0 days 00:03:55.822645000,512,100000,0.04628990689478159,0.22997704509485514,0.95,10000,0.003335591735588722,small,2,1,8,PRUNED
465,465,844.7079067999999,2021-05-05 18:03:49.913464,2021-05-05 18:21:00.245608,0 days 00:17:10.332144000,512,1000000,0.0414391441672904,0.33682643192466943,0.95,5000,0.003960087254532351,small,2,1,1000,COMPLETE
466,466,842.4338233999999,2021-05-05 18:07:48.261774,2021-05-05 18:26:12.496693,0 days 00:18:24.234919000,512,100000,0.04256772782654137,0.23829904901610913,0.95,10000,0.004392502972017477,small,2,1,16,COMPLETE
467,467,1054.743638,2021-05-05 18:15:02.047653,2021-05-05 18:45:51.710433,0 days 00:30:49.662780000,512,100000,0.10624505302981943,0.24177326005073418,0.95,5000,0.002390282218550484,small,1,1,16,COMPLETE
468,468,1327.805236,2021-05-05 18:21:00.254613,2021-05-05 18:48:50.423449,0 days 00:27:50.168836000,512,100000,0.07287741396786192,0.24306677782304448,0.95,10000,0.0023465625931869,small,1,1,1000,COMPLETE
469,469,-121.27913979999998,2021-05-05 18:26:12.504414,2021-05-05 18:45:28.022206,0 days 00:19:15.517792000,512,100000,0.024442572367971854,0.25247370934195157,0.95,0,0.002269998662598285,small,2,1,1000,COMPLETE
470,470,437.9243888,2021-05-05 18:45:28.031355,2021-05-05 19:11:25.018667,0 days 00:25:56.987312000,512,100000,0.06372625317561842,0.3183724517948435,0.999,10000,0.00309635121808165,small,1,1,1000,COMPLETE
471,471,491.7234512,2021-05-05 18:45:51.712319,2021-05-05 19:01:44.161834,0 days 00:15:52.449515000,512,1000000,0.031206267055569226,0.3100987811355709,0.95,10000,0.0028675534243254963,small,2,1,1000,COMPLETE
472,472,1212.2825770000002,2021-05-05 18:48:50.431144,2021-05-05 19:15:45.421467,0 days 00:26:54.990323000,512,100000,0.046953135225248695,0.3114172037216882,0.999,10000,0.0032172716317509908,small,1,1,1000,COMPLETE
473,473,284.65939399999996,2021-05-05 19:01:44.171624,2021-05-05 19:27:25.530590,0 days 00:25:41.358966000,512,100000,0.07446861538089995,0.25607395375799297,0.95,10000,0.003541366373553818,small,1,1,1000,COMPLETE
474,474,273.6810958,2021-05-05 19:11:25.020774,2021-05-05 19:38:12.400677,0 days 00:26:47.379903000,512,100000,0.05996622590147684,0.2595546957594705,0.95,10000,0.003482933469561027,small,1,1,1000,COMPLETE
475,475,-80.4733558,2021-05-05 19:15:45.430294,2021-05-05 19:39:45.845453,0 days 00:24:00.415159000,512,100000,0.05577739717564091,0.31903665418490756,0.999,20000,0.003314308357223365,small,1,1,1000,COMPLETE
476,476,-347.8410266,2021-05-05 19:27:25.544481,2021-05-05 19:29:40.537573,0 days 00:02:14.993092000,512,100000,0.05264588891705467,0.23264344599754105,0.95,20000,0.0032397419105848232,small,1,5000,4,PRUNED
477,477,681.2637437999999,2021-05-05 19:29:40.544971,2021-05-05 19:57:01.545051,0 days 00:27:21.000080000,512,100000,0.05061214677611685,0.33231995074049364,0.95,10000,0.006409222539736727,small,1,1,256,COMPLETE
478,478,-372.133463,2021-05-05 19:38:12.403643,2021-05-05 19:44:09.333690,0 days 00:05:56.930047000,512,100000,0.05599950618296024,0.3209715662607435,0.999,10000,0.9052890214937886,small,1,1,256,PRUNED
479,479,-51.593340999999995,2021-05-05 19:39:45.854089,2021-05-05 19:54:31.165883,0 days 00:14:45.311794000,512,100000,0.04784869774723289,0.33315345516791717,0.999,10000,0.0026429265919574144,tiny,1,1,1000,COMPLETE
480,480,-383.2169766,2021-05-05 19:44:09.334839,2021-05-05 19:45:08.041988,0 days 00:00:58.707149000,512,100000,0.04946207588756032,0.22617312972372233,0.999,10000,0.006411215003234323,small,8,20000,1000,PRUNED
481,481,185.4831836,2021-05-05 19:45:08.064530,2021-05-05 19:59:45.508507,0 days 00:14:37.443977000,512,100000,0.04589648866655339,0.3512512967860494,0.999,10000,0.004817853529652585,tiny,1,1,1000,COMPLETE
482,482,102.57003979999999,2021-05-05 19:54:31.173473,2021-05-05 20:16:52.747822,0 days 00:22:21.574349000,512,100000,0.06594638505436504,0.20219418341289114,0.999,10000,0.004606614269803537,small,1,1,1000,COMPLETE
483,483,666.8455034,2021-05-05 19:57:01.555784,2021-05-05 20:11:16.632581,0 days 00:14:15.076797000,512,100000,0.04516023539827716,0.21025759256853757,0.999,10000,0.0046163408798920325,small,2,1,1000,COMPLETE
484,484,613.5051900000001,2021-05-05 19:59:45.515072,2021-05-05 20:21:00.446457,0 days 00:21:14.931385000,512,100000,0.06824807245795787,0.2082835979880128,0.999,10000,0.004440587480713964,small,1,1,1000,COMPLETE
485,485,1023.7946024,2021-05-05 20:11:16.636106,2021-05-05 20:32:41.207773,0 days 00:21:24.571667000,512,100000,0.05644270602026636,0.24532224031203614,0.95,10000,0.0023673262504719356,small,1,1,4,COMPLETE
486,486,102.65577939999999,2021-05-05 20:16:52.753380,2021-05-05 20:28:05.337219,0 days 00:11:12.583839000,16,100000,0.04293282653540078,0.2469168573315424,0.95,0,0.002263041859203897,small,1,1,4,COMPLETE
487,487,-205.90826740000003,2021-05-05 20:21:00.448338,2021-05-05 20:25:47.837086,0 days 00:04:47.388748000,512,100000,0.051967183238137406,0.24144789107954595,0.95,10000,0.009425630446084477,small,1,1,4,PRUNED
488,488,602.6720499999999,2021-05-05 20:25:47.846526,2021-05-05 20:39:08.957173,0 days 00:13:21.110647000,512,100000,0.05885282102686788,0.2501497557450863,0.95,0,0.0023714819270945916,small,2,1,1000,COMPLETE
489,489,-367.38606980000003,2021-05-05 20:28:05.339168,2021-05-05 20:30:16.713773,0 days 00:02:11.374605000,64,100000,0.038255310069323575,0.2677623791661148,0.95,10000,0.002476295456592409,small,1,15000,1000,PRUNED
490,490,956.9131970000001,2021-05-05 20:30:16.714527,2021-05-05 20:50:14.066075,0 days 00:19:57.351548000,512,100000,0.058205889421474706,0.22862516095800398,0.95,10000,0.002935236478129508,small,1,1,1000,COMPLETE
491,491,-1.9427055999999765,2021-05-05 20:32:41.213358,2021-05-05 20:52:57.111879,0 days 00:20:15.898521000,512,100000,0.04412478377921163,0.2587922729093466,0.95,10000,0.0029469093470339824,small,1,1,1000,COMPLETE
492,492,50.401754200000006,2021-05-05 20:39:08.963684,2021-05-05 20:42:39.913913,0 days 00:03:30.950229000,512,1000000,0.038892960598275544,0.22913709463808282,0.95,10000,0.003087300552588034,small,1,10000,1000,PRUNED
493,493,164.87596639999998,2021-05-05 20:42:39.922092,2021-05-05 21:02:52.822050,0 days 00:20:12.899958000,512,100000,0.04434700633509586,0.25975584357252945,0.95,10000,0.003706806361686519,small,1,1,1000,COMPLETE
494,494,1124.470004,2021-05-05 20:50:14.070874,2021-05-05 21:11:16.345477,0 days 00:21:02.274603000,512,1000000,0.04473191184601483,0.26205722535739084,0.95,10000,0.0037682264796162898,small,1,1,1000,COMPLETE
495,495,226.57280779999996,2021-05-05 20:52:57.117788,2021-05-05 21:05:46.571593,0 days 00:12:49.453805000,512,1000000,0.04832601500518148,0.2862453760650728,0.9,10000,0.003844100413921471,small,2,1,1000,COMPLETE
496,496,181.867379,2021-05-05 21:02:52.828768,2021-05-05 21:05:44.167801,0 days 00:02:51.339033000,512,1000000,0.048492432009555525,0.2810245575254763,0.95,10000,0.0020980802472290315,small,2,1,1000,PRUNED
497,497,1265.7178838,2021-05-05 21:05:44.178541,2021-05-05 21:18:28.282573,0 days 00:12:44.104032000,512,1000000,0.03703102702227902,0.23551318048841133,0.95,10000,0.003961917382728519,small,2,1,1000,COMPLETE
498,498,624.1233654,2021-05-05 21:05:46.573410,2021-05-05 21:18:42.759551,0 days 00:12:56.186141000,512,1000000,0.06246006542066238,0.23882006944011122,0.95,10000,0.001889165980383633,small,2,1,1000,COMPLETE
499,499,958.0283704000001,2021-05-05 21:11:16.352821,2021-05-05 21:24:41.542299,0 days 00:13:25.189478000,512,100000,0.03777438917536459,0.302594103988022,0.95,5000,0.0019119663747751768,small,2,1,1000,COMPLETE
500,500,734.0054134,2021-05-05 21:18:28.284967,2021-05-05 21:33:31.092966,0 days 00:15:02.807999000,512,100000,0.036329032548561874,0.24254825588151432,0.95,5000,0.0020213265376217066,small,2,1,8,COMPLETE
501,501,525.2605375999999,2021-05-05 21:18:42.764361,2021-05-05 21:32:58.060473,0 days 00:14:15.296112000,512,100000,0.03923777741822406,0.24666273106598371,0.95,1000,0.007296576516100379,small,2,1,1000,COMPLETE
502,502,-175.7508178,2021-05-05 21:24:41.549573,2021-05-05 21:35:24.140605,0 days 00:10:42.591032000,64,100000,0.03600705326682258,0.25040275824495334,0.95,1000,0.006548917880237928,small,2,1,1000,COMPLETE
503,503,103.1604018,2021-05-05 21:32:58.065499,2021-05-05 21:43:03.893936,0 days 00:10:05.828437000,64,50000,0.03630128311233554,0.2691331780668072,0.95,10000,0.0060614441603608965,small,2,1,1000,COMPLETE
504,504,388.81589199999996,2021-05-05 21:33:31.097260,2021-05-05 21:46:25.478478,0 days 00:12:54.381218000,512,50000,0.035153989574720865,0.26629218928050613,0.95,10000,0.004998919342670825,small,2,1,1000,COMPLETE
505,505,340.53857800000003,2021-05-05 21:35:24.144624,2021-05-05 21:48:20.064657,0 days 00:12:55.920033000,512,1000000,0.040744376488117545,0.27254756649481476,0.95,10000,0.004798513257314684,small,2,1,1000,COMPLETE
506,506,11.644747799999996,2021-05-05 21:43:03.899800,2021-05-05 21:56:56.751657,0 days 00:13:52.851857000,512,1000000,0.040717893978958364,0.2333988718986303,0.95,10000,0.0024873847581799047,small,2,1,4,COMPLETE
507,507,-89.33516439999998,2021-05-05 21:46:25.485281,2021-05-05 21:49:43.021932,0 days 00:03:17.536651000,512,1000000,0.04211439888843374,0.23635794496664422,0.95,10000,0.07942036803339501,small,2,1,4,PRUNED
508,508,-77.8540114,2021-05-05 21:48:20.066505,2021-05-05 21:50:32.098473,0 days 00:02:12.031968000,512,1000000,0.02893352036260055,0.236255523001503,0.95,10000,0.002750144270681862,small,2,5000,4,PRUNED
509,509,-16.087620999999995,2021-05-05 21:49:43.023813,2021-05-05 21:51:12.880846,0 days 00:01:29.857033000,128,1000000,0.05344895629114491,0.25227711290207,0.95,10000,0.0027899855877607997,small,2,5000,1000,PRUNED
510,510,15.056172600000002,2021-05-05 21:50:32.100067,2021-05-05 22:00:29.978806,0 days 00:09:57.878739000,128,100000,0.05312686559562684,0.2548905205204871,0.95,10000,0.0010740124966192646,small,2,1,1000,COMPLETE
511,511,1076.2864797999998,2021-05-05 21:51:12.883879,2021-05-05 22:03:43.553612,0 days 00:12:30.669733000,512,100000,0.03221502188079226,0.22346672409185173,0.95,10000,0.0013220010013735854,small,2,1,1000,COMPLETE
